REPUBBLICA	dopo	strage	?	?	il consiglio di gabinetto non si è occupato solo del	dopo-strage	.
REPUBBLICA	dopo	dinasty	?	?	gli esperti hanno già definito il " caso abc " , come la " sindrome del	dopo-dinasty	" la abc , infatti , è ormai da mesi incapace di realizzare un programma che possa anche solo eguagliare
REPUBBLICA	dopo	terrorismo	?	?	anche quando non lo si dice a chiare lettere , si lascia intendere che in questa italia del	dopo-terrorismo	chi solleva obiezioni sulla triade confessione -- pentimento -- assoluzione va considerato un residuo degli anni di piombo .
REPUBBLICA	dopo	ginevra	?	?	gromyko raffredda il	dopo-ginevra	.
REPUBBLICA	dopo	novelli	?	?	la fiducia all' esecutivo monocolore pci , e insieme hanno concordato un documento che costituisce il primo passo ufficiale del	dopo-novelli	.
REPUBBLICA	dopo	cuccia	?	?	il leader del	dopo-cuccia	in una mediobanca privatizzata ?
REPUBBLICA	dopo	neve	?	?	ore 10 e 30 , piazzale loreto , punto nevralgico della milano a quattroruote che inizia la settimana del	dopo-neve	.
REPUBBLICA	dopo	terrorismo	?	?	e culturale , ha affrontato poco e male una discussione difficile e per molti versi scomoda , come quella sul	dopo-terrorismo	.
REPUBBLICA	dopo	cernienko	?	?	mosca pensa già al	dopo-cernienko	.
REPUBBLICA	dopo	buscetta	?	?	droga , traffico d' armi , nuovi boss ecco la mafia del	dopo-buscetta	.
REPUBBLICA	dopo	tito	?	?	una situazione in qualche modo simile a quella della jugoslavia : si temeva molto per il	dopo-tito	, si è visto che non è successo nulla .
REPUBBLICA	dopo	novelli	?	?	torino ( s.t. ) -- alla coreografia del primo consiglio comunale del	dopo-novelli	hanno provveduto i disoccupati che ieri sera hanno invaso le sale d' ingresso del municipio .
REPUBBLICA	dopo	novelli	?	?	il pentapartito discute del	dopo-novelli	e la dc si candida alla guida della città .
REPUBBLICA	dopo	elezioni	?	?	i socialisti , che già ieri sera hanno discusso con martelli sul	dopo-elezioni	e su come portare il partito fuori dalle bufere giudiziarie , dicono d' avere già disegnato la torino dei prossimi
REPUBBLICA	dopo	breznev	?	?	il	dopo-breznev	non si è ancora concluso , ma la " vecchia guardia " sta lentamente perdendo tutti i principali esponenti e
REPUBBLICA	dopo	breznev	?	?	per andropov un' alleanza eterogena il	dopo-breznev	, non ancora concluso , comincia in effetti undici mesi prima della scomparsa del leader , e comincia con due
REPUBBLICA	dopo	breznev	?	?	delle alleanze , delle clientele , delle promesse , delle pressioni -- hanno in mano la chiave che chiuderà il	dopo-breznev	.
REPUBBLICA	dopo	novelli	?	?	e fra i candidati al	dopo-novelli	c' è anche bodrato .
REPUBBLICA	dopo	fassbinder	?	?	in tutto questo c' è un grande ottimismo riguardante il cinema tedesco del	dopo-fassbinder	.
REPUBBLICA	dopo	blitz	?	?	il	dopo-blitz	registra intanto l' avvio degli interrogatori , mentre in un bosco vicino a pavia le ruspe hanno dissotterrato il primo
REPUBBLICA	dopo	sfiducia	?	?	in casa socialista prevalgono due ipotesi per il	dopo-sfiducia	.
REPUBBLICA	dopo	condono	?	?	roma -- il	dopo-condono	è appena iniziato e già si accendono nuove polemiche .
REPUBBLICA	dopo	maggio	?	?	livelli , altro dichiarare fin dall' inizio che la dc garantisce , essa sola , la tenuta di governo del	dopo-maggio	" .
REPUBBLICA	dopo	cernienko	?	?	la malattia di cernienko anticipa domande sul	dopo-cernienko	e su come cambierà l' urss .
REPUBBLICA	dopo	stalin	?	?	il	dopo-stalin	pareva portatore di sconvolgimenti totali .
REPUBBLICA	dopo	kruscev	?	?	il	dopo-kruscev	doveva partorire la famosa " russia degli ingegneri " .
REPUBBLICA	dopo	breznev	?	?	il	dopo-breznev	vide trionfare la teoria della svolta militare .
REPUBBLICA	dopo	cernienko	?	?	adesso si suppone che il	dopo-cernienko	vedrà davvero la rivoluzione generazionale , magari simboleggiata da gorbaciov .
REPUBBLICA	dopo	cernienko	?	?	ma non è detto che esso sia prossimo alla conclusione col	dopo-cernienko	.
REPUBBLICA	dopo	cernienko	?	?	il	dopo-cernienko	non può quindi essere previsto in base alle spinte di fondo di una società che certamente chiede modernizzazione .
REPUBBLICA	dopo	weekend	?	?	è arrivato un lunedì pomeriggio ( l' 8 ottobre scorso ) in un senato semideserto per le consuete assenze del	dopo-weekend	.
REPUBBLICA	dopo	terremoto	?	?	delinquere di tipo mafioso , emesso a roma nel novembre '83 , riguarda un giro di appalti in campania nel	dopo-terremoto	.
REPUBBLICA	dopo	breznev	?	?	due brevi interregni di ben diverso valore politico , ma egualmente segnati dall' età avanzata e dalla infermità , il	dopo-breznev	si è davvero chiuso .
REPUBBLICA	dopo	breznev	?	?	robert tucker , ex direttore del dipartimento di studi russi all' università di princeton , dice che " il	dopo-breznev	comincia solo ora " : gorbaciov è il primo leader supremo dell' urss che sia nato dopo la morte di
REPUBBLICA	dopo	stalin	?	?	ho detto che è una svolta che ricorda quella del	dopo-stalin	, ma con le debite differenze .
REPUBBLICA	dopo	helsinki	?	?	questo obiettivo è stato sviato nel	dopo-helsinki	: in particolare da quando è stata accantonata la battaglia per i diritti umani , e ci si è concentrati
REPUBBLICA	dopo	crack	?	?	liquidatore dell' impero sindoniano , e per la violenta escalation di minacce e intimidazioni mafiose che segnarono gli anni del	dopo-crack	.
REPUBBLICA	dopo	consiglio	?	?	organigrammi per esempio , che i socialisti vorrebbero discutere con le nomine dei consiglieri , mentre la dc rinvierebbe al	dopo-consiglio	.
REPUBBLICA	dopo	lama	?	?	pizzinato in corsa per il	dopo-lama	.
REPUBBLICA	dopo	lama	?	?	roma -- il	dopo-lama	è davvero già cominciato ?
REPUBBLICA	dopo	pertini	?	?	dice : " per affrontare il	dopo-pertini	bisogna dire qual è il peso che ci lascia la sua presidenza .
REPUBBLICA	dopo	lama	?	?	i comunisti della cgil : sarà unitario il	dopo-lama	.
REPUBBLICA	dopo	fixing	?	?	in italia si ferma a quota 2016,75 e nel	dopo-fixing	a 2004 .
REPUBBLICA	dopo	fixing	?	?	in italia , è stato fissato a 2016,75 lire , per scendere poi nel	dopo-fixing	a quota 2004 .
REPUBBLICA	dopo	concilio	?	?	della liberazione -- n.d.r. ) soprattutto per " gli attacchi accaniti contro il marxismo , senza precedenti nel periodo del	dopo-concilio	" e attacca in particolare il discorso del papa pronunciato il 1 gennaio scorso in occasione della 18 giornata della
REPUBBLICA	dopo	rossi	?	?	il	dopo-rossi	non è iniziato , ma forse c' è ora il caldidato giusto .
REPUBBLICA	dopo	concilio	?	?	temi in discussione : il	dopo-concilio	, l' evoluzione della società nazionale e il suo rapporto con la fede .
REPUBBLICA	dopo	sanremo	?	?	ma la tournèe del	dopo-sanremo	l' ho cominciata il 29 marzo a palermo .
REPUBBLICA	dopo	tito	?	?	si potè ragionare del possibile dopo-franco , si scrutarono i	dopo-tito	e dopo-breznev , ma non possediamo elementi per immaginare il decorso politico a tirana .
REPUBBLICA	dopo	breznev	?	?	si potè ragionare del possibile dopo-franco , si scrutarono i dopo-tito e	dopo-breznev	, ma non possediamo elementi per immaginare il decorso politico a tirana .
REPUBBLICA	dopo	hoxha	?	?	belgrado lancia a tirana segnali di distensione ma teme il	dopo-hoxha	.
REPUBBLICA	dopo	buscetta	?	?	forse falcone , come tutti noi , ha avvertito il passaggio brusco dagli entusiasmi del	dopo-buscetta	alla controffensiva , peraltro prevedibile , della mafia " .
REPUBBLICA	dopo	scala	?	?	sempre a proposito di moda si sono avuti momenti drammatici quando si è saputo che al ricevimento	dopo-scala	della notte di sabato 20 aprile , offerto dal prefetto di milano , vincenzo vicari , erano stati invitati ,
REPUBBLICA	dopo	calvi	?	?	si era addirittura arrivati a ipotizzare un' accoppiata bagnasco-venini alla guida dell' ambrosiano nell' immediato	dopo-calvi	, ma l' ipotesi fu presto accantonata .
REPUBBLICA	dopo	moro	?	?	oggi " la politica dell' alternativa ha consentito di progettare uno sbocco alla involuzione del	dopo-moro	incarnata dal pentapartito " .
REPUBBLICA	dopo	crisi	?	?	giappone , paese che la crisi del cinema l' ha vissuta fino in fondo o forse è già entrato nel	dopo-crisi	.
REPUBBLICA	dopo	novelli	?	?	ha già esercitato nell' autunno dell' 83 allorché il segretario nazionale del psi aveva tentato di anticipare d' autorità il	dopo-novelli	.
REPUBBLICA	dopo	hoxha	?	?	tirana -- l' albania del "	dopo-hoxha	" manterrà una posizione di " piena indipendenza e contrapposizione rispetto alle due superpotenze " e ripone invece " grandi
REPUBBLICA	dopo	natta	?	?	un tripudio il	dopo-natta	" toro !
REPUBBLICA	dopo	cassa	?	?	parlamento , che dovrà disciplinare in modo organico l' intervento straordinario nel mezzogiorno e determinare l' attesa svolta del "	dopo-cassa	" .
REPUBBLICA	dopo	yalta	?	?	in altri termini , di muover- si sulla famosa strada del	dopo-yalta	.
REPUBBLICA	dopo	bruxelles	?	?	con l' aria che tira , una gestione del	dopo-bruxelles	basata su un tentativo di " embrassons-nous " come se nulla fosse accaduto è facile che risulti catastrofica .
REPUBBLICA	dopo	franco	?	?	oggi a tokyo la sesta conferenza parlamentare promossa dal consiglio d' europa e guidata da marcelino oreja , ministro del	dopo-franco	, insieme a umberto colombo , presidente dell' enea e dei comitati scientifici cee ed onu , e da bernard
REPUBBLICA	dopo	einaudi	?	?	una decina d' anni fa , giacomo mancini fece una dura polemica contro i " settennati " del	dopo-einaudi	.
REPUBBLICA	dopo	zanone	?	?	finora tenuto al di fuori -- insieme ai due presidenti del partito , bozzi e malagodi -- dalle riunioni sul	dopo-zanone	.
REPUBBLICA	dopo	carniti	?	?	malgrado questa felice combinazione di eventi , il	dopo-carniti	si preannuncia assai tormentato .
REPUBBLICA	dopo	buscetta	?	?	ricercato da sei anni dai segugi della criminalpol e sfuggito ai blitz del	dopo-buscetta	, francesco di carlo , 44 anni , uno dei più potenti boss delle cosche siciliane , è caduto nella
REPUBBLICA	dopo	esami	Event	?	domanda sulla codificazione della prospettiva in brunelleschi ha spiazzato l' allieva rigazzi che , adesso , nella panica felicità del	dopo-esami	, racconta a chi deve " andare sotto " la singolare curiosità della " prof " d' italiano sui perché
REPUBBLICA	dopo	mao	?	?	le riforme dell' agricoltura iniziate nel	dopo-mao	hanno richiesto la creazione di nuove strutture amministrative nelle campagne : governi locali caratterizzati da una maggiore agilità burocratica e
REPUBBLICA	dopo	breznev	?	?	omaggio a un istinto di sopravvivenza senza pari , e premia pure il ruolo rilevante giocato nelle scelte decisive del	dopo-breznev	.
REPUBBLICA	dopo	teatro	Place or function	?	cauteruccio , abbinerà laser e pineta il 13 e il 19 agosto con elettriche lune , oltre a un costante	dopo-teatro	di luci : qui la versiliana battezza per il suo pubblico nuove frontiere del inguaggio teatrale .
REPUBBLICA	dopo	carniti	?	?	ma su quali argomenti potranno ritrovare un' unità d' azione la uil , la cgil e la cisl del	dopo-carniti	?
REPUBBLICA	dopo	zanone	?	?	giovedì prossimo la direzione liberale aprirà la discussione sul	dopo-zanone	.
REPUBBLICA	dopo	croce	?	?	il	dopo-croce	si rivelava così non un anti-croce , ma come lo svolgimento di un' opera di legittimazione e istituzionalizzazione di una
REPUBBLICA	dopo	carniti	?	?	ma le novità del	dopo-carniti	si misurano sulla parte dell' intervento di marini dedicato alle prospettive sindacali dell' immediato futuro .
REPUBBLICA	dopo	carniti	?	?	il	dopo-carniti	, almeno sulla carta , ne esce ben chiaro e definito per i prossimi quattro anni , sia per quel
REPUBBLICA	dopo	corea	?	?	due partite in nazionale nell' immediato	dopo-corea	: a milano con l' urss e a napoli con la romania .
REPUBBLICA	dopo	zanone	?	?	è cominciato il	dopo-zanone	.
REPUBBLICA	dopo	mundial	?	?	la squadra più problematica fu quella del	dopo-mundial	, quando si aggiunsero platini e boniek , ritornò bettega ed utilizzammo sin dall' inizio paolo rossi .
REPUBBLICA	dopo	catastrofe	?	?	il vento di bonaccia che sembrava avvolgere il	dopo-catastrofe	è stato spezzato nella giornata di ieri .
REPUBBLICA	dopo	terrorismo	?	?	di autant-lara : la grande storia d' amore non ha sullo sfondo la guerra mondiale , ma gli anni del	dopo-terrorismo	.
REPUBBLICA	dopo	ferie	?	?	uno dei primi incontri del	dopo-ferie	sarà quello tra il ministro delle finanze e le tre confederazioni , in un primo tempo previsto per oggi .
REPUBBLICA	dopo	buscetta	?	?	, un brillantissimo ufficiale adesso a venezia , il capitano scala è arrivato a palermo proprio nelle caldissime giornate del	dopo-buscetta	.
REPUBBLICA	dopo	serena	?	?	torino alla ricerca del	dopo-serena	, radice potrebbe aver già risolto il suo grande problema .
REPUBBLICA	dopo	svalutazione	?	?	la lira del	dopo-svalutazione	più forte grazie alla sterlina .
REPUBBLICA	dopo	serena	?	?	comi-schachner , è iniziato il	dopo-serena	.
REPUBBLICA	dopo	falcao	?	?	il tempo dirà se si tratta solo d' un episodio , ma certo il	dopo-falcao	non poteva cominciare peggio .
REPUBBLICA	dopo	strage	?	?	sono i giorni del	dopo-strage	: funerali , polemiche , accuse incrociate , e poi le indagini che si confondono , le inchieste che ruotano
REPUBBLICA	dopo	massacro	?	?	la squadra mobile ricostruita nei giorni del	dopo-massacro	sarà trasformata .
REPUBBLICA	dopo	loreto	?	?	la chiesa del "	dopo-loreto	" sarà analizzata il 3 settembre , presenti il teologo di cl , rocco buttiglione , giuseppe chiarante , luigi
REPUBBLICA	dopo	impegno	?	?	esegeti e apologeti stile anni cinquanta sanno ancora meno , e che per lo più sono cresciuti nel clima del	dopo-impegno	, al seguito di quel grido che nanni moretti fa lanciare da un personaggio del film io sono un autarchico
REPUBBLICA	dopo	tito	?	?	che inferno nella zattera del	dopo-tito	.
REPUBBLICA	dopo	tito	?	?	gli eroi del	dopo-tito	sono neoborghesi , arricchiti , gonzi , farabutti e vittime .
REPUBBLICA	dopo	bomba	?	?	i cavalieri del	dopo-bomba	.
REPUBBLICA	dopo	terrorismo	?	?	la favola , che trent' anni fa mobilitò i fischiatori neorealisti di la strada , domina il paesaggio del	dopo-terrorismo	.
REPUBBLICA	dopo	fusione	?	?	uno sguardo alla prevedibile composizione azionaria del "	dopo-fusione	" permette di mettere a fuoco quali potrebbero essere gli sviluppi futuri di questo " matrimonio " .
REPUBBLICA	dopo	ferie	?	?	artigianato -- lunedì 16 primo incontro del	dopo-ferie	con le tre organizzazioni che pagano i decimali : cna , casa e claii .
REPUBBLICA	dopo	bruxelles	?	?	qui da noi non si tratta , come afferma carraro , di cadere nella psicosi del	dopo-bruxelles	, ma di essere pronti a scongiurare un' altra bruxelles .
REPUBBLICA	dopo	scala	?	?	via agnello , l' ottagono della galleria sfiorando il savini , che fu la culla degli ozi gastronomici e dei	dopo-scala	di boito , di puccini , di mascagni , il tratto della galleria che sfocia su piazza della scala e
REPUBBLICA	dopo	crack	?	?	il processo per l' omicidio di ambrosoli e per le altre malefatte del	dopo-crack	sindoniano è alla sua ripresa dopo la pausa estiva .
REPUBBLICA	dopo	vietnam	?	?	recente , ora che parlano della guerra in vietnam come di un gigantesco malinteso , e l' unico film sul	dopo-vietnam	che ha successo è rambo , dove ogni minuto c' è un vietnamita che muore sullo schermo tra boati e
REPUBBLICA	dopo	burghiba	?	?	la vera posta in gioco è di consentire o no a gheddafi di avere voce in capitolo nella tunisia del	dopo-burghiba	.
REPUBBLICA	dopo	burghiba	?	?	proprio dal problema della stabilità tunisina , dal timore d' uno " sfondamento " gheddafiano , dalle incertezze del "	dopo-burghiba	" .
REPUBBLICA	dopo	pensione	?	?	gli italiani , quindi , hanno scarsa attenzione ai problemi del "	dopo-pensione	" .
REPUBBLICA	dopo	sequestro	?	?	lealista , ma con tutti i governi del medio oriente -- libia e siria compresi -- la goffa gestione del	dopo-sequestro	minaccia di sgretolare quel piccolo patrimonio di credibilità che negli anni arafat era riuscito faticosamente a costituire presso diversi paesi
REPUBBLICA	dopo	sessantotto	?	?	tavolone , sul palco , prendono posto i leaders di dp : il segretario , mario capanna , che nel	dopo-sessantotto	fu a capo del movimento studentesco della statale , insieme a massimo gorla , basilio rizzo , luigi vinci ed
REPUBBLICA	dopo	mitterrand	?	?	era il primo congresso "	dopo-mitterrand	" e i delegati non lo ignoravano .
REPUBBLICA	dopo	concilio	?	?	paolo vi parlava del	dopo-concilio	.
REPUBBLICA	dopo	cuccia	?	?	in realtà il problema del	dopo-cuccia	è sul tappeto da oltre un anno e proprio su questo terreno si è aperta la prima grossa frattura tra
REPUBBLICA	dopo	cuccia	?	?	è passato un anno , il problema è più che mai ancora quello di preservare certi equilibri nella prospettiva del	dopo-cuccia	.
REPUBBLICA	dopo	terremoto	?	?	segretario di cirillo , giuliano granata ; ad alvaro giardili , il costruttore beneficiario degli appalti ottenuti da pazienza nel	dopo-terremoto	; allo stesso pazienza oggi in carcere negli stati uniti .
REPUBBLICA	dopo	cuccia	?	?	sui vari nomi che sono stati fatti per il	dopo-cuccia	( da romiti a rondelli , da cingano a maccanico ) , l' iri -- dice prodi -- non ha
REPUBBLICA	dopo	cuccia	?	?	evidentemente anche a piazza cadorna hanno cominciato a pensare al	dopo-cuccia	, cioè al giorno in cui il vecchio finanziere abbandonerà , per limiti di età , l' istituto di via
REPUBBLICA	dopo	pentapartito	?	?	e allora si discute del	dopo-pentapartito	.
REPUBBLICA	dopo	summit	?	?	shultz a mosca , ma io vorrei provare a leggere i fondi di caffè alla rovescia , partendo già dal	dopo-summit	.
REPUBBLICA	dopo	cuccia	?	?	la seconda ipotesi è ben più articolata e riguarda direttamente il	dopo-cuccia	.
REPUBBLICA	dopo	lama	?	?	dice pizzinato , segretario in pectore della cgil del	dopo-lama	: " l' evoluzione positiva del negoziato per il pubblico impiego può essere trascinante per gli altri 19 tavoli di
REPUBBLICA	dopo	nicolazzi	?	?	il	dopo-nicolazzi	.
REPUBBLICA	dopo	ginevra	?	?	qui s' apre il vero	dopo-ginevra	.
REPUBBLICA	dopo	cuccia	?	?	il	dopo-cuccia	è l' argomento preferito nelle conversazioni serali della finanza italiana .
REPUBBLICA	dopo	cuccia	?	?	adesso la situazione è cambiata proprio perché il	dopo-cuccia	, che fa orrore a tutti per le complicazioni che si porta dietro , sta per arrivare .
REPUBBLICA	dopo	cuccia	?	?	e infatti tutti quelli che fino a oggi hanno provato a pensare al	dopo-cuccia	sono arrivati alla serena conclusione che esso non esiste .
REPUBBLICA	dopo	cuccia	?	?	ecco perché , forse , è bene non innamorar- si troppo dei facili	dopo-cuccia	che cominciano a circolare .
REPUBBLICA	dopo	chiave	?	?	e il buon dio ; dall' altra , con il film scandalosa gilda , si inserisce nel mercato cinematografico del	dopo-chiave	e aizza sornione la carica dei porcelli .
REPUBBLICA	dopo	ginevra	?	?	gorbaciov ha dedicato il messaggio ad un commento del	dopo-ginevra	, ringraziando il governo italiano per la lettera di felicitazioni che di recente è stata inviata a mosca .
REPUBBLICA	dopo	schmidt	?	?	due : da una parte lo " scandilux " , i partiti scandinavi e del benelux con la spd del	dopo-schmidt	nel ruolo di osservatore esterno ( ma in realtà in quello dell' eminenza grigia ) ; dall' altra l' "
REPUBBLICA	dopo	marcos	?	?	hanno chiesto il ripristino di un vice-presidente che garantisca un minimo di continuità legale nell' eventualità di un	dopo-marcos	precoce .
REPUBBLICA	dopo	franco	?	?	per essi il	dopo-franco	doveva essere " trinitario " : con franco-padre , col re-figlio , e con la spagna spirito santo .
REPUBBLICA	dopo	vietnam	?	?	i primi due presidenti del	dopo-vietnam	, ford e carter , non si sono preoccupati molto di riabilitare l' onore perduto nelle risaie del sud-vietnam ,
REPUBBLICA	dopo	ginevra	?	?	una due-giorni ( ieri a roma , oggi a parma ) per dibattere lo spirito del	dopo-ginevra	e per confermare la bontà dell' impostazione della linea " anticipatrice " di alcuni governi europei -- quello italiano in
REPUBBLICA	dopo	ginevra	?	?	la pace , quindi , la lotta al terrorismo internazionale , la distensione del	dopo-ginevra	( furgler ha incontrato personalmente a ginevra il 10 e 20 novembre scorso gorbaciov e reagan ) , il ruolo
REPUBBLICA	dopo	schmidt	?	?	questo documento , il più innovativo e più concreto che la spd del	dopo-schmidt	abbia prodotto , cerca abbastanza convincentemente di comporre le esigenze tra economia e ecologia tra obblighi del presente e responsabilità
REPUBBLICA	dopo	ginevra	?	?	ma reagan ha già bocciato l' offerta new york -- reagan ha detto di no alla prima offerta sovietica del	dopo-ginevra	.
REPUBBLICA	dopo	cuccia	?	?	in sostituzione di quelle distrutte dalla scalata alla bi-invest effettuata dalla montedison e dalla necessità di preparare in fretta il	dopo-cuccia	.
REPUBBLICA	dopo	maggio	?	?	parigi , prima di assumere la cattedra di filosofia dell' università parigina ex vincennes , creata nel clima turbolento del	dopo-maggio	1968 .
REPUBBLICA	dopo	sci	?	?	sono rimaste all' asciutto , mentre da altre località arrivavano notizie trionfalistiche sulla nevicata : cielo coperto e gente in	dopo-sci	a passeggiare in paese .
REPUBBLICA	dopo	borsa	?	?	come già avvenuto lunedì gli acquisti sono proseguiti nel	dopo-borsa	portando il prezzo a 2.780 lire .
REPUBBLICA	dopo	listino	?	?	nell' immediato	dopo-listino	ha compiuto altri vistosi balzi ed è stato negoziato a 2.830 lire .
REPUBBLICA	dopo	borsa	?	?	nel	dopo-borsa	il flusso della domanda non si è arrestato portando il prezzo a 2.880 lire .
REPUBBLICA	dopo	craxi	?	?	la formula non è , nonostante le dichiarazioni attenuate sul "	dopo-craxi	" fatte dallo stesso presidente del consiglio , separabile dalla presidenza socialista .
REPUBBLICA	dopo	trapianto	?	?	dovrà stare ancora un mese all' ospedale , ma le sue condizioni sono definite buone e la fase critica del	dopo-trapianto	è stata superata : antonino romano , 6 anni , di messina , è stato operato giovedì della scorsa settimana
REPUBBLICA	dopo	tito	?	?	litigioso viene in mente quel vecchio motto in cui l' umorismo popolare esorcizzava , anni fa , le ansie del	dopo-tito	: " domanda : che cosa facciamo , se i sovietici ci attaccano ?
REPUBBLICA	dopo	thatcher	?	?	nel partito conservatore heseltine si candida per il	dopo-thatcher	.
REPUBBLICA	dopo	marcos	?	?	il	dopo-marcos	, dipende ancora in larga misura da marcos : l' ultima carta del patriarca al tramonto è proprio questa :
REPUBBLICA	dopo	ginevra	?	?	questa affermazione che introduce , sebbene con un linguaggio assai sfumato , un elemento di novità nel	dopo-ginevra	, e che sembra porre un minimo di riserva sul progettato secondo incontro con reagan , gorbaciov l' ha fatta
REPUBBLICA	dopo	listino	?	?	in realtà il mercato si era già risvegliato nel	dopo-listino	di mercoledì e dei due punti di incremento dell' indice di ieri , uno è la registrazione di quanto avvenuto
REPUBBLICA	dopo	lama	?	?	roma -- il	dopo-lama	comincia con un' impressione di grande fervore , ma con una sensazione un po' di smarrimento .
REPUBBLICA	dopo	lama	?	?	un altro segnale di quanto oscilli incerta la cgil del	dopo-lama	.
REPUBBLICA	dopo	nantes	?	?	il presidente ernesto pellegrini ha rimandato ogni intervento al	dopo-nantes	.
REPUBBLICA	dopo	contestazione	?	?	life " o il nostro " diario di una schizofrenica " , che pure ebbero in quegli anni dell' immediato	dopo-contestazione	giovanile , libero e anche relativamente fruttuoso corso .
REPUBBLICA	dopo	trapattoni	?	?	come allenatore giovane , bravo , " vergine " di grandi platee , arrigo sacchi ha la faccia del possibile	dopo-trapattoni	.
REPUBBLICA	dopo	franco	?	?	serata di ieri -- era considerata notevole , all' altezza delle grandi occasioni elettorali che hanno caratterizzato la spagna del	dopo-franco	: il referendum sulla nato è un appuntamento sentito che ha scatenato la passione politica degli spagnoli .
REPUBBLICA	dopo	franco	?	?	serata di ieri -- era considerata notevole , all' altezza delle grandi occasioni elettorali che hanno caratterizzato la spagna del	dopo-franco	: il referendum sulla nato è un appuntamento sentito che ha scatenato la passione politica degli spagnoli .
REPUBBLICA	dopo	attentato	?	?	ancora molte critiche alla poca tempestività della polizia di stoccolma per i primi minuti e le prime ore del	dopo-attentato	.
REPUBBLICA	dopo	congresso	?	?	" con piacere " l' invito di craxi e andreotti ; verrà a roma molto presto , anche se il	dopo-congresso	si presenta molto difficile per la dirigenza del cremlino .
REPUBBLICA	dopo	ginevra	?	?	amaro bilancio sul	dopo-ginevra	.
REPUBBLICA	dopo	cinema	Place or function	?	automobili lustre , vestiti da festa , pneumatici che fischiano , insulti che volano nell' euforia un po' demente del	dopo-cinema	davanti ad una gelateria del centro , quando le risse esplodono improvvise , quasi senza ragione , sanguinose e violente
REPUBBLICA	dopo	ginevra	?	?	fgci pone infatti al centro degli incontri bilaterali " le situazioni nei conflitti locali " , insieme alle prospettive del	dopo-ginevra	e alle relazioni tra le due organizzazioni giovanili .
REPUBBLICA	dopo	sci	?	?	prelibatezze con l' inappetenza di chi ha imparato ad avere cura di sé , hanno saturato il mercato mondiale del	dopo-sci	con i marchi nordica e san marco , lotto di montebelluna , o diadora , per restare ai maggiori .
REPUBBLICA	dopo	berlinguer	?	?	fondamentali del congresso che si apre domattina a firenze è proprio quale collocazione internazionale intenda dar- si il pci del	dopo-berlinguer	.
REPUBBLICA	dopo	casale	?	?	associazioni verdi , che da qualche tempo marciano compatte come una squadra di rugby , hanno presentato il conto del	dopo-casale	e del dopo-metanolo .
REPUBBLICA	dopo	metanolo	?	?	che da qualche tempo marciano compatte come una squadra di rugby , hanno presentato il conto del dopo-casale e del	dopo-metanolo	.
REPUBBLICA	dopo	nimeiri	?	?	vediamo allora chi sono i civili che si offrono per governare il sudan nel	dopo-nimeiri	.
REPUBBLICA	dopo	fascismo	movimento culturale/politico	?	l' analisi politica dell' immediato	dopo-fascismo	non è meno severa .
