REPUBBLICA	dopo	rabin	?	?	ha colto l' occasione di un solenne discorso al congresso americano , al quale ha presentato la politica israeliana del	dopo-rabin	: " voglio approfittare di questo podio per dire al presidente assad : senza dimenticare il passato , non guardiamo
REPUBBLICA	dopo	barba	?	?	tre le proposte per il	dopo-barba	: fluido ultra-addolcente per pelli sensibili ( 75 ml , l. 22.500 ) .
REPUBBLICA	dopo	barba	?	?	un nuovo prodotto guy laroche sull' onda della nuova generazione dei	dopo-barba	delicati : baume aprés-rasage horizon ( in profumeria , 100 ml , l. 40.000 ) .
REPUBBLICA	dopo	barba	?	?	come	dopo-barba	gel senz' alcol ( 50 ml , l. 37.000 ) , balsamo ( 100 ml , l. 56.000 ) ,
REPUBBLICA	dopo	dini	?	?	anzi l' aveva presa alla lontana , sul	dopo-dini	.
REPUBBLICA	dopo	natale	?	?	in una buffa smorfia di ottimismo : " c' è sempre tanta buona musica , anche nell' edizione ridotta del	dopo-natale	.
REPUBBLICA	dopo	concilio	?	?	fu il libro che esplicitò i malumori di papa wojtyla su tutti gli sviluppi del	dopo-concilio	ed anche su certe svolte conciliari che non aveva mai approvato .
REPUBBLICA	dopo	dini	?	?	gianfranco fini è chiarissimo : " l' esplorazione di berlusconi non è archiviata , perché è relativa al	dopo-dini	: così è nata e così continua ...
REPUBBLICA	dopo	dini	?	?	il	dopo-dini	si gioca in gran parte attorno alla stagione costituente prossima ventura , più o meno alternativa al voto anticipato .
REPUBBLICA	dopo	abete	?	?	i ' saggi ' stanno per avviare la consultazione sul	dopo-abete	.
REPUBBLICA	dopo	dini	?	?	anche all' estero sono in molti a credere che , nel	dopo-dini	, ci sarà ancora lamberto dini , almeno fino a giugno .
REPUBBLICA	dopo	dini	?	?	dimissioni del " governo tecnico " , pare ora disponibile addirittura a concorrere alla ricerca di una intesa per il	dopo-dini	( sul cui nome , assicura il leader di an , " non vi sono pregiudiziali " ) .
REPUBBLICA	dopo	bosman	?	?	, intanto annuncia per lunedì prossimo una riunione con l' uefa a zurigo , proprio per trattare il problema del	dopo-bosman	.
REPUBBLICA	dopo	sessantotto	?	?	ma per certi registi del	dopo-sessantotto	, da antoine vitez in poi , ecco una rivalutazione del suo enfatico trombonismo cattolico : quella vertigine di '
REPUBBLICA	dopo	mitterrand	?	?	gia' insidiato dall' iperindebitamento dei paesi mediterranei , soppravviverà il sogno europeo a problemi e dubbi della germania del	dopo-mitterrand	?
REPUBBLICA	dopo	abete	?	?	nella loro qualità di ex presidenti e perciò di componenti la troika dei saggi , avvieranno la consultazione per il	dopo-abete	, non potranno non tenere conto di questi precedenti .
REPUBBLICA	dopo	collasso	?	?	tutti i dubbi antichi e recenti , quelli del matromonio e quelli del	dopo-collasso	, hanno trovato puntualmente conferma ieri quando le agenzie di stampa hanno diffuso la notizia della richiesta di divorzio .
REPUBBLICA	dopo	agnelli	?	?	gli americani si accontentano di una partecipazione di minoranza ma destinata a diventare maggioranza nel	dopo-agnelli	.
REPUBBLICA	dopo	pechino	?	?	" il primo esame del	dopo-pechino	si terrà a new york già nel marzo prossimo " , annuncia turco " ma nel frattempo c' è ancora
REPUBBLICA	dopo	g	?	?	ma allora era davvero solo immagine , senza basi solide , la napoli del	dopo-g	7 ?
REPUBBLICA	dopo	incendio	?	?	allen aveva dichiarato di voler contribuire alla ricostruzione : sarà lui il primo " concertista " del	dopo-incendio	.
REPUBBLICA	dopo	stalin	?	?	e franca valeri e un cugino di vladimir horowitz venuto apposta da carkhov : evgenij liberman , l' economista del	dopo-stalin	.
REPUBBLICA	dopo	sport	?	?	la manopola è orientabile per le varie applicazioni : bambini , insonnia , insufficienza venosa , cellulite , artrosi ,	dopo-sport	.
REPUBBLICA	dopo	alluvione	?	?	dai fondi ex gescal , osservano i ricercatori , sono stati utilizzati mille miliardi per la ricostruzione	dopo-alluvione	in piemonte ed è previsto l' uso dei due terzi dei soldi " per il finanziamento della riforma delle pensioni
REPUBBLICA	dopo	mazzotta	?	?	per il	dopo-mazzotta	in campo anche vimercati .
REPUBBLICA	dopo	mazzotta	?	?	la commissione non ha finora discusso il	dopo-mazzotta	.
REPUBBLICA	dopo	maccanico	?	?	tronchetti provera sul	dopo-maccanico	' non si deve rivedere maastricht .
REPUBBLICA	dopo	cerimonia	?	?	ma le polemiche sono ritornate nella conferenza stampa del	dopo-cerimonia	: protagonista noel gallagher , chitarrista del gruppo e fratello di liam , che ha definito i discografici ' porci
REPUBBLICA	dopo	baudo	?	?	del resto il programma era di baudo e di ambra , un	dopo-baudo	più che un dopofestival " , dice scherzando ma non troppo .
REPUBBLICA	dopo	mattei	?	?	infine , il presidente dell' enichem , marcello colitti , interverrà sul	dopo-mattei	all' eni .
REPUBBLICA	dopo	arizona	?	?	gli elettori del partito repubblicano , ci dicono i dati del	dopo-arizona	e del dopo-dakota , puntano in tre direzioni diverse , la rivoluzione fiscale di forbes , la rivoluzione culturale di
REPUBBLICA	dopo	dakota	?	?	gli elettori del partito repubblicano , ci dicono i dati del dopo-arizona e del	dopo-dakota	, puntano in tre direzioni diverse , la rivoluzione fiscale di forbes , la rivoluzione culturale di buchanan e la
REPUBBLICA	dopo	dc	movimento culturale/politico	?	un trionfo del prima , del durante e del	dopo-dc	.
REPUBBLICA	dopo	dimissioni	Event	?	alla fine è antonio la forgia , segretario regionale e vicino alla famiglia occhetto anche nei momenti terribili del	dopo-dimissioni	, a prender- si l' incarico di ambasciatore-paciere .
REPUBBLICA	dopo	marini	?	?	la nuova vedette di rose rosse ( da questa sera su canale 5 ) , lasciando intendere che per il	dopo-marini	la via era obbligata : dimenticare valeria .
REPUBBLICA	dopo	oscar	?	?	di " vanity fair " , sarà il maestro di cerimonie della festa da morton , la più ambita del	dopo-oscar	.
REPUBBLICA	dopo	craxi	?	?	minore , che i medici denunciano la malasanità condivisa , che l' ex amico di craxi pretende di guidare il	dopo-craxi	, che l' ex ministro di berlusconi promette il dopo-berlusconi , che il giacobino democratico lamenta la fine delle élites
REPUBBLICA	dopo	gonzalez	?	?	al via in spagna la trattativa di governo per il	dopo-gonzalez	resta da convincere l' ala più dura del partito .
REPUBBLICA	dopo	ribaltone	?	?	alle regionali del '95 ( dati proporzionali ) la lega del	dopo-ribaltone	precipitò al 7,48 , peggior risultato di tutti i collegi della provincia di milano , superato anche da rifondazione che
REPUBBLICA	dopo	europei	?	?	dubbi restano , se è vero che sacchi è stato contattato ancora ultimamente , per strappar- lo alla nazionale del	dopo-europei	.
REPUBBLICA	dopo	dini	?	?	verso gennaio , quando erano cominciate le trattative per il	dopo-dini	( ricordate l' esperimento maccanico ?
REPUBBLICA	dopo	trasmissione	?	?	nel	dopo-trasmissione	lucia annunziata ha radunato a casa sua un gruppo d' amici per una cena a base di pasta al formaggio
REPUBBLICA	dopo	spettacolo	Event	?	settimane , arrivavano fino a 500 dollari a persona , quattro volte di più per partecipare alle varie feste del	dopo-spettacolo	.
REPUBBLICA	dopo	vialli	?	?	potrebbe finire alla lazio come parziale conguaglio di boksic , in quel colossale supermarket che è diventata la juve del	dopo-vialli	( a proposito , sono sempre più insistenti le offerte dei glasgow rangers per il pelato , quindici miliardi netti
REPUBBLICA	dopo	tangentopoli	?	?	-- fuoco incrociato sui regolamenti che dovrebbero attuare i principi della merloni-bis , la legge quadro sugli appalti pubblici del	dopo-tangentopoli	.
REPUBBLICA	dopo	comunismo	movimento culturale/politico	?	rifugio dalle minacce dei nuovi nazionalismi e da una persecuzione che gli zar , stalin e breznev hanno tramandato al	dopo-comunismo	.
REPUBBLICA	dopo	silvio	?	?	si smentirà , come sempre , ma il passo indietro è nell' aria e fini già prepara il	dopo-silvio	incontrando in segreto un di pietro prosciolto da tutte le accuse .
REPUBBLICA	dopo	vittoria	?	?	poi , chiuso l' immediato	dopo-vittoria	, ha preso un aereo ed è tornato a casa sua , a bologna .
REPUBBLICA	dopo	agnelli	?	?	la fiat del	dopo-agnelli	ha chiamato gli uomini della generazione di cantarella e testore per fronteggiare questa battaglia .
REPUBBLICA	dopo	capello	?	?	la terza fase della gestione berlusconi , infatti , si apre con il dilemma sul	dopo-capello	.
REPUBBLICA	dopo	pertini	?	?	è stato " il presidente inesistente " del	dopo-pertini	e poi l' esternatore incontenibile che solo nel 1991 -- l' anno del suo exploit -- occupò il video per
REPUBBLICA	dopo	mercato	Qualification or Set of Circumstances	?	la seduta è stata dominata da ricoperture , come già nel	dopo-mercato	di venerdì , e da acquisti dovuti a fattori tecnici .
REPUBBLICA	dopo	festival	?	?	baudo , che l' ha presa in simpatia e le vuol bene , le ha affidato in febbraio il "	dopo-festival	" di sanremo , rilanciando- la .
REPUBBLICA	dopo	apartheid	?	?	l' assemblea approva la legge fondamentale del	dopo-apartheid	.
REPUBBLICA	dopo	mercato	Qualification or Set of Circumstances	?	in apertura il listino ha annullato le pesanti perdite accusate nel	dopo-mercato	della vigilia ed ha mostrato un tono nel complesso positivo ma nel durante sono prevalse le incertezze sull' andamento dei
REPUBBLICA	dopo	muro	?	?	nell' europa attuale , fra il	dopo-muro	e il pre-maastricht , e le dispute sulla legittimazione politica degli ex-comunisti ed ex-fascisti ed ex-democristiani ed ex-arlecchini dei trasformismi
REPUBBLICA	dopo	shock	?	?	il nome del regista in calopestri ) esprime dubbi sulle possibilità che " da questa parte delle alpi , il	dopo-shock	del terrorismo dell' ultrasinistra possa portare alla superficie gli stessi traumi " smossi in italia ; ma aggiunge che il
REPUBBLICA	dopo	spettacolo	Event	?	i miei tre titoli messi insieme occupano meno spazio di un' opera vera " ) , ha vantato un inedito	dopo-spettacolo	offerto dal ciclo ' ora mistica ' a s. eufemia , ha reso noto che alla fine del festival girerà
REPUBBLICA	dopo	mani	?	?	il ministro lancia il	dopo-mani	pulite , i verdi protestano ' vorrei escluderei giudici dagli arbitrati ' .
REPUBBLICA	dopo	bosman	?	?	la francia , dove vanno a caccia i nostri mercanti nel	dopo-bosman	, la francia di vieira , pires , maurice e makelele .
REPUBBLICA	dopo	pop	movimento culturale/politico	?	forestale nazionale , completa di foglie e fiori e frutti : in un gusto che aggiorna balla e depero al	dopo-pop	.
REPUBBLICA	dopo	vita	Entity	?	" questa è vita primaria -- spiega franco cremonini , organizzatore del film -- mentre l' altro racconta il	dopo-vita	.
REPUBBLICA	dopo	vertice	?	?	le indiscrezioni del	dopo-vertice	riferiscono di una manovra ancora fortemente incentrata sui tagli alle spese ( almeno 10 mila miliardi ) che colpirebbero fs
REPUBBLICA	dopo	baresi	?	?	è in salute , o perché giocare centrale gli riesce indigesto ( ma nei piani del milan è lui il	dopo-baresi	) : comunque il fuorigioco è un meccanismo disperso e ogni lancio di balog e lisztes diventa occasione di brividi
REPUBBLICA	dopo	ungheria	?	?	il	dopo-ungheria	è anche questo , il recupero dei due piccoli grandi malati della nazionale , gli unici costretti a 24 ore
REPUBBLICA	dopo	malattia	?	?	ieri , nel primissimo allenamento	dopo-malattia	, le due punte sono state assistite da sacchi , che è rimasto a milanello fino a quando zola e
REPUBBLICA	dopo	romiti	?	?	roma -- con due anni di anticipo sono cominciate le grandi manovre del	dopo-romiti	.
REPUBBLICA	dopo	franco	?	?	loro compromesso con militari e comunisti riformatori sfociò nella transizione non violenta alla democrazia , sul modello della spagna del	dopo-franco	.
REPUBBLICA	dopo	mercato	Qualification or Set of Circumstances	?	il listino ha recuperato già in avvio tutte le perdite accusate nel	dopo-mercato	di venerdì , quando il dato sulla disoccupazione americana di maggio ha gettato nello scompiglio le borse europee .
REPUBBLICA	dopo	sole	?	?	e fp 15 , non grasso , di facile assorbimento , resistente all' acqua ; la linea bambini ; i	dopo-sole	( prezzi a partire da l. 7150 nel canale della grande distribuzione ) .
REPUBBLICA	dopo	sole	?	?	un nuovo	dopo-sole	specifico per il viso è la proposta dei laboratori clarins .
REPUBBLICA	dopo	muro	?	?	" in forma di pasticciaccio ideologico del	dopo-muro	e delle mode frananti .
REPUBBLICA	dopo	tangentopoli	?	?	dimensioni delle rispettive forze armate ; la francia di chirac l' ha fatto in un mese , l' italia del	dopo-tangentopoli	prima o poi dovrà far- lo .
REPUBBLICA	dopo	montreal	?	?	piove e i test tanto attesi della ferrari del	dopo-montreal	vanno in fumo .
REPUBBLICA	dopo	baudo	?	?	l' azienda prepara il	dopo-baudo	.
REPUBBLICA	dopo	berlusconi	?	?	ipotesi che l' uscita di monti abbia come orizzonte l' intenzione di candidar- si alla guida del polo per il	dopo-berlusconi	?
REPUBBLICA	dopo	ravanelli	?	?	la curiosità potrebbe servire a dimostrare che il	dopo-ravanelli	non è così pieno di certezze .
REPUBBLICA	dopo	matarrese	?	?	milano , ma giraudo , ammistratore delegato della juve , ha annunciato : " oggi è iniziata l' era del	dopo-matarrese	in italia " .
REPUBBLICA	dopo	romiti	?	?	da registrare che paolo fresco -- neoconsigliere fiat e da molti indicato come il tecnico in grado di guidare il	dopo-romiti	-- ha smentito dagli usa la notizia di un suo imminente addio alla general electric con due anni di anticipo
REPUBBLICA	dopo	prodi	?	?	certo il	dopo-prodi	è aperto .
REPUBBLICA	dopo	tangentopoli	?	?	le scelte del governo torna , con un' idea controversa , il dibattito sul	dopo-tangentopoli	.
REPUBBLICA	dopo	fenice	?	?	ma il	dopo-fenice	, incredibilmente , va catalogato tra i numerosi e robusti risvegli di una città da tempo anoressica di ruolo ,
REPUBBLICA	dopo	prodi	?	?	tavolo : possibile presidente del nuovo partito , come è stato ventilato , e possibile carta di riserva per il	dopo-prodi	" .
REPUBBLICA	dopo	baudo	?	?	milano -- " ma sì , certo , mi hanno cercato per sanremo , per il	dopo-baudo	, sono stati i discografici " .
REPUBBLICA	dopo	pippo	?	?	so che in rai sono contenti del mio nome , certo che il	dopo-pippo	sarà una bella sfida " .
REPUBBLICA	dopo	baudo	?	?	il suo sarà dunque il primo show del	dopo-baudo	?
REPUBBLICA	dopo	sentenza	?	?	oggi il primo interrogatorio del	dopo-sentenza	.
REPUBBLICA	dopo	divorzio	?	?	mentre l' ex moglie non gli lesina complicazioni legali da	dopo-divorzio	.
REPUBBLICA	dopo	baudo	?	?	verrà deciso anche il volto -- o i volti -- del festival '97 che passerà alla storia come quello del	dopo-baudo	.
REPUBBLICA	dopo	mercato	Qualification or Set of Circumstances	?	dopo aver concluso la seduta ufficiale al livello invariato di 23,75 marchi , il titolo continental ha guadagnato nel	dopo-mercato	il 3,8 % -- 24,50 marchi -- a fronte di scambi molto vivaci e in aumento .
REPUBBLICA	dopo	giunta	?	?	ma , nonostante i toni concilianti del	dopo-giunta	, le posizioni dei contendenti sembrano ancora tutte lì , ferme , granitiche , irremovibili .
REPUBBLICA	dopo	dittatura	?	?	primo presidente del	dopo-dittatura	in portogallo .
REPUBBLICA	dopo	eltsin	?	?	l' elemento di fondo che ha convinto forsyth a puntare sulla russia di un ipotetico	dopo-eltsin	è la perdurante , critica , situazione di quel paese .
REPUBBLICA	dopo	bosman	?	?	potranno , anche , essere quotate in borsa ) si parla di un inserimento nella reiterazione del decreto dini sul	dopo-bosman	, che prevede il differimento in 3 anni delle perdite dei club legate alla sparizione dei parametri ; la reiterazione
REPUBBLICA	dopo	allenamento	?	?	nel testo attuale noi reinventiamo di sana pianta due solitudini in un	dopo-allenamento	" .
REPUBBLICA	dopo	sconfitta	?	?	di aver influenzato il risultato della gara , sono mesi che aspettiamo i comodi di biaggi " , dichiarazione del	dopo-sconfitta	.
REPUBBLICA	dopo	convention	?	?	clinton era stato strappato nella notte al corso trionfale del	dopo-convention	democratica di chicago , dalla quale era uscito volando sopra un vantaggio mostruoso nei sondaggi , e portato alla casa
REPUBBLICA	dopo	bosman	?	?	è il primo campionato del	dopo-bosman	, e dunque avanti con gli stranieri .
REPUBBLICA	dopo	santoro	?	?	per il	dopo-santoro	minoli sta lavorando con lucia annunziata : potrebbe finire che al posto di ' tempo reale ' faranno un programma
REPUBBLICA	dopo	mercato	Qualification or Set of Circumstances	?	nel	dopo-mercato	, scontata una prima reazione negativa al dato usa , il listino e il mercato obbligazionario hanno recuperato terreno .
REPUBBLICA	dopo	privatizzazione	?	?	estero i concorrenti si schierano per il	dopo-privatizzazione	.
REPUBBLICA	dopo	bosman	?	?	reti di marca straniera : sette nel '95 - 96 , dieci nel turno d' avvio del primo campionato del	dopo-bosman	.
REPUBBLICA	dopo	mercato	Qualification or Set of Circumstances	?	nel	dopo-mercato	il listino ha registrato un' improvvisa ondata di vendite a causa dell' inasprir- si della crisi nel golfo .
REPUBBLICA	dopo	porto	?	?	roberto baggio traduce in tristezza i grandi dubbi del	dopo-porto	.
REPUBBLICA	dopo	parto	?	?	medicina studio comparato con francia e spagna sul	dopo-parto	.
REPUBBLICA	dopo	sorteggio	?	?	pescosolido che , da buon professionista , aspetta in silenzio , nascosto in un angolo , che la ressa del	dopo-sorteggio	si concluda .
REPUBBLICA	dopo	wojtyla	?	?	ma certo colpisce assistere allo scatenar- si sotterraneo della battaglia per il	dopo-wojtyla	.
REPUBBLICA	dopo	tangentopoli	?	?	l' alta velocità ferroviaria è davvero rimasta , nel deserto del	dopo-tangentopoli	, un' ancora di salvezza per gli imprenditori del settore .
REPUBBLICA	dopo	operazione	?	?	cuore malato di eltsin di riprender- si dall' ultimo attacco e per curare altri malanni collaterali che potrebbero complicare il	dopo-operazione	.
REPUBBLICA	dopo	necci	?	?	per il secondo e più importante atto del	dopo-necci	-- la nomina del successore -- la scelta non si presenta facile e nel corso delle trattative il governo ha
REPUBBLICA	dopo	pescara	?	?	ancelotti ripete lo stesso sconsolato sermone del	dopo-pescara	( eliminazione dalla coppa italia ) , un po' sacchiano ma non indisponente , anzi accorato : " non ho
REPUBBLICA	dopo	stalinismo	movimento culturale/politico	?	pajetta , che nei mesi recenti del xx congresso erano sembrati avanzare qualche riserva sul passaggio tacito dallo stalinismo al	dopo-stalinismo	, a imperitura gloria del " paese-guida " .
REPUBBLICA	dopo	ciclismo	?	?	ora che è più chiaro il	dopo-ciclismo	del navarro , bisogna stabilire che ne sarà dell' ultimo periodo dell' atleta-indurain , dopo il ritiro alla vuelta e
REPUBBLICA	dopo	thatcher	?	?	e subito , a segnalare l' eccitante risveglio creativo del	dopo-thatcher	, s' impone un lavoro singolare , vitalissimo e sorprendente del quarantenne martin crimp ; già visto al royal court
REPUBBLICA	dopo	eltsin	?	?	a mosca l' ex-generale della guerra afghana e protagonista del	dopo-eltsin	, aleksandr lebed aveva chiesto a gran voce l' appoggio degli avversari dei taliban .
REPUBBLICA	dopo	sisma	?	?	caso affitti il caso si è sbagliato a votare e ha contribuito ad affossare il decreto per gli stanziamenti del	dopo-sisma	.
REPUBBLICA	dopo	messa	?	?	di peluche infiocchettata di tenerezze un po' kitsch , non già l' arrosto pasquale con le patate fritte dei devoti	dopo-messa	.
REPUBBLICA	dopo	di	?	?	e che questo alimenti il disagio e le preoccupazioni del suo agitatissimo	dopo-di	pietro : " da quando sono andato via mi sento sotto tiro " , confida con un sospiro .
REPUBBLICA	dopo	uomo	Qualification or Set of Circumstances	?	vivevamo nel moderno , e una mattina ci siamo svegliati post-moderni , ora attrezziamo- ci a entrare nell' era del	dopo-uomo	.
REPUBBLICA	dopo	uomo	Qualification or Set of Circumstances	?	dove si vede che il	dopo-uomo	è tutto e solo fisico .
REPUBBLICA	dopo	guerra	Qualification or Set of Circumstances	?	nel capitalismo senza frontiere del	dopo-guerra	fredda le potenze economiche consolidate dell' europa continentale partono svantaggiate su tutta la linea : non a caso invenzioni e
REPUBBLICA	dopo	necci	?	?	giudiziarie i ribaltoni e le nuove nomine le ferrovie dello stato si apprestano a fronteggiare un nuovo spinoso capitolo del	dopo-necci	: i conti dell' azienda che rischiano di andare fuori di ogni controllo .
REPUBBLICA	dopo	desailly	?	?	ambrosini 6 : continua a dare un apporto discreto , calando- si sempre pi nella parte di	dopo-desailly	come diga di centrocampo .
REPUBBLICA	dopo	vertice	?	?	a metà pomeriggio , con le agenzie che amplificano l' ottimismo del	dopo-vertice	di d' alema con i capi del polo , è un fausto bertinotti insolito quello che si ferma a chiacchierare
REPUBBLICA	dopo	mobutu	?	?	ci sono tensioni bilaterali , rivendicazioni territoriali legate ai vecchi assetti pre-coloniali dei tutsi , aspettative per il	dopo-mobutu	" .
REPUBBLICA	dopo	atlanta	?	?	il personaggio miss italia , teatro , spot , testimonial ovunque : un	dopo-atlanta	frenetico .
REPUBBLICA	dopo	finanziaria	?	?	gradimento che potrà ricevere da quei settori della maggioranza ( pds in testa a tutti ) che guardano già al	dopo-finanziaria	e ritengono indispensabile un rasserenamento del clima .
REPUBBLICA	dopo	sacchi	?	?	" un	dopo-sacchi	l' ho già gestito , al milan .
REPUBBLICA	dopo	necci	?	?	tra fs e cgil cisl e uil , il	dopo-necci	infatti non si presenta facile alla luce di due elementi : la volontà dell' azienda di procedere ad un' ulteriore
REPUBBLICA	dopo	congresso	?	?	prodi-rifondazione -- il capo della quercia e l' ex presidente del consiglio puntino a costruire insieme gli scenari per il	dopo-congresso	pidiessino .
REPUBBLICA	dopo	prima	?	?	dai gioielli al cibo per spiegare che quest' anno sarà gianni versace a organizzare la tradizionale serata del	dopo-prima	di sant' ambrogio .
REPUBBLICA	dopo	bosman	?	?	' non ho paura , ma quanto stress ' zola , sacchi , e i disagi del	dopo-bosman	.
REPUBBLICA	dopo	fascismo	movimento culturale/politico	?	, fanfani , lazzati , che si riunivano in casa padovani , nella milano del '42 , per progettare il	dopo-fascismo	.
REPUBBLICA	dopo	strehler	?	?	i problemi del	dopo-strehler	.
REPUBBLICA	dopo	maniero	?	?	padova -- un furto " autonomo " , da attribuire probabilmente ad una frangia isolata della malavita veneta del	dopo-maniero	.
REPUBBLICA	dopo	tomba	?	?	a sognare che il	dopo-tomba	sia meno crudele di quanto ci si immagina .
REPUBBLICA	dopo	baudo	?	?	nell' anno del	dopo-baudo	, del ritorno di mike bongiorno in rai , che presenterà la rassegna in coppia con l' imprevedibile piero chiambretti
REPUBBLICA	dopo	scudetto	?	?	quello che dovrebbe almeno arraffare il secondo posto in campionato , per non considerare un fallimento assoluto la stagione del	dopo-scudetto	.
REPUBBLICA	dopo	anestesia	Process	?	davanti , il solo dugarry , mentre weah smaltisce il	dopo-anestesia	( per la rimozione della placca al braccio .
REPUBBLICA	dopo	bosman	?	?	( ravanelli come zola ) ignorando in quale realtà si andassero a cacciare , il tutto nella grande frenesia del	dopo-bosman	.
REPUBBLICA	dopo	mani	?	?	il '	dopo-mani	pulite ' : el paìs esamina il crescente disinteresse degli italiani verso le cronache giudiziarie .
REPUBBLICA	dopo	verona	?	?	non c' è null ' altro di allegro nel	dopo-verona	di baresi e compagni : sguardi torvi , dirigenti impegnati altrove .
REPUBBLICA	dopo	lottizzazione	?	?	roma -- passata la buriana delle nomine nel consiglio di amministrazione , per le ferrovie dello stato del	dopo-lottizzazione	si torna a pensare ai conti e alla struttura .
REPUBBLICA	dopo	sconfitta	?	?	berlusconi e sacchi hanno raccontato l' ennesimo	dopo-sconfitta	con frasi diverse , ma legate da concetti paralleli , addolciti .
REPUBBLICA	dopo	sydney	?	?	il testa a testa fra roma e rio , considerate le favorite per aggiudicar- si le olimpiadi del	dopo-sydney	, sta impossessando- si del cuore e del samba di ogni brasiliano .
REPUBBLICA	dopo	wembley	?	?	poiche a complicare le cose ci si è messo anche il buon cesare , colto nel	dopo-wembley	in flagranza d' " intensità " .
REPUBBLICA	dopo	deng	?	?	deng xiaoping , le forze armate si schierano con l' attuale vertice cinese guidato jiang zemin , confermando che il	dopo-deng	non porterà scossoni agli assetti di potere .
REPUBBLICA	dopo	bosman	?	?	buoni rapporti con le società straniere e che adesso sa giocare le sue carte nelle arruffate e movimentate trattative del	dopo-bosman	.
REPUBBLICA	dopo	assad	?	?	da tempo ormai in tutto il medio oriente si riflette su quale potrà essere il	dopo-assad	.
REPUBBLICA	dopo	mao	?	?	ora , nella nuovisssima cina , quella del	dopo-mao	e del dopo-deng -- i quali fumavamo tutti e due come turchi -- il capo del livello amministrativo più basso
REPUBBLICA	dopo	deng	?	?	ora , nella nuovisssima cina , quella del dopo-mao e del	dopo-deng	-- i quali fumavamo tutti e due come turchi -- il capo del livello amministrativo più basso può multare chi
REPUBBLICA	dopo	mao	?	?	anni , che vengono codificati e propagandati nel resto del continente i cosiddetti valori asiatici ai quali la cina del	dopo-mao	e del dopo-deng si ispira .
REPUBBLICA	dopo	deng	?	?	vengono codificati e propagandati nel resto del continente i cosiddetti valori asiatici ai quali la cina del dopo-mao e del	dopo-deng	si ispira .
REPUBBLICA	dopo	doping	?	?	il	dopo-doping	-- ma questa stagione è cominciata in modo diverso : con i controlli sul sangue , appunto .
REPUBBLICA	dopo	partita	Event	?	nel	dopo-partita	berlusconi anticipa sacchi : " avevo visto giusto dopo il primo tempo : milan in grande spolvero e squadra ritrovata
REPUBBLICA	dopo	scala	?	?	un fascino irripetibile , e alle " prime " della stagione lirica trabocca tradizionalmente di vip disposti a pagare il	dopo-scala	più caro di milano ( cifra record mezzo milione a testa ) .
REPUBBLICA	dopo	partita	Event	?	disordini nel	dopo-partita	: sassaiole tra le due tifoserie , con la polizia costretta ad usare i lacrimogeni .
