REPUBBLICA	dopo	shevardnadze	?	?	vertice d' urgenza al quartier generale di evere sul "	dopo-shevardnadze	" .
REPUBBLICA	dopo	ceausescu	?	?	partito nazionale contadino , sostengono che sia necessario organizzare un referendum popolare per stabilire la forma costituzionale della romania del	dopo-ceausescu	, ovvero scegliere tra repubblica e monarchia .
REPUBBLICA	dopo	sessantotto	?	?	scena essenziale , tra un grande letto e il tavolino di un caffè che riassume tanti caffè , sfila quel	dopo-sessantotto	nel quale anche far l' amore era politica : è la storia a tre del protagonista che vuole costruire la
REPUBBLICA	dopo	feste	?	?	le prime quattro alla prova del	dopo-feste	riuscirà finalmente la samp a vincere di questi tempi ?
REPUBBLICA	dopo	siad	?	?	il fallimento dell' iniziativa , coordinata da italia ed egitto , che doveva preparare la transizione al	dopo-siad	barre era però già scritto .
REPUBBLICA	dopo	dittatura	?	?	l' ex presidente raul alfonsin , l' uomo che guidò il paese nella delicata fase del	dopo-dittatura	e che ordinò alla commissione sabato l' indagine sulle gravissime responsabilità dei militari nella repressione , ha commentato : graziare
REPUBBLICA	dopo	berlusconi	?	?	nel	dopo-berlusconi	non ha più avuto il coraggio di far- li .
REPUBBLICA	dopo	siad	?	?	egli già pensa al	dopo-siad	barre : la nostra principale priorità sarà la ricostruzione dell' esercito somalo su basi nazionali e non tribali e nepotistiche
REPUBBLICA	dopo	siad	?	?	processi regolari quanto al	dopo-siad	barre , abdulle nur assicura che tutte le persone che si sono macchiate di delitti contro i diritti umani e
REPUBBLICA	dopo	ginevra	?	?	le domande sui possibili scenari del	dopo-ginevra	vengono accuratamente aggirate .
REPUBBLICA	dopo	sarcinelli	?	?	ancora mistero sul	dopo-sarcinelli	.
REPUBBLICA	dopo	ginevra	?	?	l' attesa del	dopo-ginevra	non ha distolo il paese dai suoi preparativi di guerra .
REPUBBLICA	dopo	catastrofe	?	?	, o l' autore annullava il tempo e azzerava la storia : la vita germogliava dal paesaggio annientato di un	dopo-catastrofe	, dove quei lemuri al ritmo di un tango riprendevano i loro gesti da presepe meccanico : nella casa di
REPUBBLICA	dopo	sarcinelli	?	?	roma si accendono i riflettori sul	dopo-sarcinelli	.
REPUBBLICA	dopo	alga	?	?	al turismo alfredo sandri abbiamo bisogno di grossi eventi per tirar- ci fuori dall' anonimato e cancellare la crisi del	dopo-alga	.
REPUBBLICA	dopo	attacco	?	?	in queste ore si prepara all' impatto del	dopo-attacco	.
REPUBBLICA	dopo	attacco	?	?	stato maggiore americano , colin powell , ha fatto più volte riferimento alla rete , nella prima conferenza stampa del	dopo-attacco	.
REPUBBLICA	dopo	resistenza	?	?	eppure mesi fa , nel contesto del drammatico dibattito sui delitti politici del	dopo-resistenza	, bobbio ha ricordato come la liberazione fosse l' insieme di tre guerre ( patriottica contro i tedeschi , civile
REPUBBLICA	dopo	vassalli	?	?	craxi , infatti , non intende affrontare il	dopo-vassalli	in tempi anticipati rispetto alla verifica di governo : la questione sarà discussa insieme a tutte le altre , ed
REPUBBLICA	dopo	crisi	?	?	colloquio con de michelis sui piani diplomatici in preparazione per lo scenario mediorientale del	dopo-crisi	.
REPUBBLICA	dopo	golfo	?	?	fra le poste in gioco c' è , senza dubbio , la sua statura politica nella turchia del	dopo-golfo	.
REPUBBLICA	dopo	ceausescu	?	?	effetti , il programma di aiuti è stato esteso formalmente alla romania ( finora esclusa per le vicende politiche del	dopo-ceausescu	) ; all' ungheria è stato concesso un contributo suplementare di mezzo miliardo di dollari per consentir- le di pagare
REPUBBLICA	dopo	saddam	?	?	il presidium dell' internazionale appare però diviso quando si parla di come affrontare il	dopo-saddam	.
REPUBBLICA	dopo	saddam	?	?	differenziazioni , e più d' una , sorgono quando si tenta di valutare l' avvenire , il	dopo-saddam	.
REPUBBLICA	dopo	golfo	?	?	agnelli ottimista sul	dopo-golfo	.
REPUBBLICA	dopo	saddam	?	?	comunque si è parlato del	dopo-saddam	, indicando l' obiettivo di una conferenza internazionale di pace su tutti i problemi della regione mediorientale e mediterranea ,
REPUBBLICA	dopo	barre	?	?	morte e paura delle epidemie nella mogadiscio del	dopo-barre	durante la notte si sentono colpi di arma da fuoco e ogni mattina vengono ritrovate nuove vittime degli scontri .
REPUBBLICA	dopo	pci	?	?	sì , achille occhetto probabilmente già venerdì sarà eletto primo segretario del	dopo-pci	.
REPUBBLICA	dopo	crisi	?	?	dopo il 19 febbraio , una volta definito il pacchetto per il	dopo-crisi	, la troika della cee incontrerà i capi della diplomazia di tunisia , algeria , marocco , egitto e israele
REPUBBLICA	dopo	golfo	?	?	prospettive difficili nel	dopo-golfo	.
REPUBBLICA	dopo	riforma	documento	?	tanti anni fa , nell' entusiasmo del	dopo-riforma	, quelle informazioni venivano date .
REPUBBLICA	dopo	rimini	?	?	le prime riunioni di segreteria del	dopo-rimini	hanno già dato al segretario generale e al suo aggiunto parecchio filo da torcere .
REPUBBLICA	dopo	crisi	?	?	, ripeto , la vera entità della posta in gioco , ecco la ragione per cui diventano così importanti il	dopo-crisi	e la logica con cui affrontar- lo .
REPUBBLICA	dopo	crisi	?	?	no , si tratta di cercare di dare al	dopo-crisi	una risposta che consolidi il miracolo di metà agosto , e dimostri che la logica di saddam hussein non solo
REPUBBLICA	dopo	crisi	?	?	quali sono le idee in discussione per il	dopo-crisi	?
REPUBBLICA	dopo	crisi	?	?	naturalmente va detto anche che senza saddam hussein sarà molto più facile organizzare il	dopo-crisi	.
REPUBBLICA	dopo	crisi	?	?	respingeremo questo argomento , ma può aiutare l' europa soprattutto il fatto che nel	dopo-crisi	conterà più la politica delle armi , e gli stessi americani si accorgeranno che le armi non bastano .
REPUBBLICA	dopo	barre	?	?	nel	dopo-barre	è ancora emergenza .
REPUBBLICA	dopo	golfo	?	?	progetto vaticano per il	dopo-golfo	un vertice d' eccezione con patriarchi e alte gerarchie religiose .
REPUBBLICA	dopo	carnevale	?	?	il	dopo-carnevale	: proseguono le liberazioni dei boss in tutta italia .
REPUBBLICA	dopo	resistenza	?	?	suoi effetti sono stati così devastanti da influenzare persino il drammatico dibattito di alcuni mesi fa sui delitti politici del	dopo-resistenza	.
REPUBBLICA	dopo	crisi	?	?	roma è la novita' più sorprendente del	dopo-crisi	del golfo : mentre in tutto il mondo si sta affrontando con decisione il problema della diversificazione delle fonti energetiche
REPUBBLICA	dopo	maradona	?	?	a giugno potrebbe essere tagliato nella rivoluzione del	dopo-maradona	.
REPUBBLICA	dopo	saddam	?	?	la guerra nel golfo mitterrand in tv : occorre pensare al	dopo-saddam	.
REPUBBLICA	dopo	saddam	?	?	andreotti teme nel	dopo-saddam	la rabbia araba contro l' occidente .
REPUBBLICA	dopo	regime	Qualification or Set of Circumstances	?	tre possibili ipotesi per il	dopo-regime	.
REPUBBLICA	dopo	saddam	?	?	tareq aziz , il ministro degli esteri , come capo di un regime provvisorio che regga i primi giorni del	dopo-saddam	.
REPUBBLICA	dopo	saddam	?	?	che potrebbe essere interpretato come un tentativo del ministro degli esteri di propor- si come nuovo uomo forte per il	dopo-saddam	.
REPUBBLICA	dopo	saddam	?	?	in un articolo dedicato al	dopo-saddam	, il times scrive che stati uniti , gran bretagna e francia avrebbero già discusso la questione e si sarebbero
REPUBBLICA	dopo	saddam	?	?	in attesa di un auspicabile	dopo-saddam	parigi guarda ai problemi della pace futura non senza nascondere una certa diffidenza nei confronti du una temuta pax americana
REPUBBLICA	dopo	vittoria	?	?	new york nel clima più rilassato del	dopo-vittoria	, le nazioni unite non sembrano troppo ansiose di accelerare i tempi del chiarimento diplomatico .
REPUBBLICA	dopo	terremoto	?	?	sostanzioso afflusso di finanziamenti pubblici , che vengono richiesti proprio all' indomani della conclusione dell' inchiesta parlamentare sulla ricostruzione del	dopo-terremoto	.
REPUBBLICA	dopo	crisi	?	?	un	dopo-crisi	, dunque , come preludio di altre sfide , di altre avventure , di immaginarie rivincite .
REPUBBLICA	dopo	naufragio	?	?	cercati , e ritrovati , tantissimi figli , mogli , mariti , familiari albanesi che si erano perduti , nel	dopo-naufragio	.
REPUBBLICA	dopo	golfo	?	?	per il	dopo-golfo	, il documento segnala le preoccupazioni che riguardano una ipotizzata e diffusa campagna terroristica , nonché le inevitabili ripercussioni sull'
REPUBBLICA	dopo	golfo	?	?	fa leggere al suo portavoce una dichiarazione nella quale definisce opportuna e interessante la riflessione europea al massimo livello sul	dopo-golfo	, proposta dai francesi e che la presidenza di turno lussemburghese sta tentando di organizzare per la fine di marzo
REPUBBLICA	dopo	crisi	?	?	roma quando la guerra del golfo doveva ancora cominciare , tutti i progetti politico-diplomatici per il	dopo-crisi	sembravano egualmente validi e accettabili perché nessuno sapeva prevedere come il conflitto sarebbe finito .
REPUBBLICA	dopo	andreotti	?	?	le prime scommesse sul	dopo-andreotti	risatine .
REPUBBLICA	dopo	andreotti	?	?	e ancora , è già cominciato il gioco del	dopo-andreotti	: scommetti sulle elezioni anticipate , sull' andreotti bis , o su un altro democristiano a palazzo chigi ?
REPUBBLICA	dopo	atalanta	?	?	ci sono le sue parole nel	dopo-atalanta	sulla sua posizione al milan : intendo rimanere , e comunque non sarò io a fare la prima mossa ,
REPUBBLICA	dopo	golfo	?	?	nel	dopo-golfo	gli usa rilanciano il nucleare pulito .
REPUBBLICA	dopo	saddam	?	?	vuol dire che il	dopo-saddam	potrà esser ancora più rischioso per gli stati arabi arabia saudita e i varii emirati che hanno partecipato alla coalizione
REPUBBLICA	dopo	golfo	?	?	nell' analisi del fondo , dedicata principalmente all' economia mondiale del	dopo-golfo	, l' italia si trova in posizione mediana tra i paesi in recessione ( usa , canada e gran bretagna
REPUBBLICA	dopo	elezioni	?	?	albania ,	dopo-elezioni	nel sangue .
REPUBBLICA	dopo	stangata	?	?	nel giorno della prima , grande esplosione sociale del	dopo-stangata	, la voce della repubblica più tranquilla dell' urss si è unita al grido di protesta dei 300 mila minatori
REPUBBLICA	dopo	golfo	?	?	oggetto dei colloqui un bilancio del	dopo-golfo	, ma soprattutto i nuovi scenari di fronte ai quali si troverà l' alleanza nei prossimi mesi .
REPUBBLICA	dopo	golfo	?	?	torino il	dopo-golfo	non ha prodotto il miracolo .
REPUBBLICA	dopo	mohammed	?	?	così è tornato holmes , il campione che aveva costretto la generazione del	dopo-mohammed	alì ad un estenuante ciclo di sconfitte .
REPUBBLICA	dopo	maradona	?	?	agroppi , rispondendo a una domanda di sandro ciotti su come il napoli potesse cominciare il	dopo-maradona	, aveva risposto : penso che possa ricominciare da muccioli , con evidente riferimento alla comunità per il recupero dei
REPUBBLICA	dopo	golfo	?	?	usa , giappone , gran bretagna , germania , francia , canada e italia dovranno analizzare insieme le conseguenze del	dopo-golfo	, gli effetti ( benefici ?
REPUBBLICA	dopo	barucci	?	?	intanto i banchieri italiani pensano al	dopo-barucci	.
REPUBBLICA	dopo	match	?	?	non è fair play quello di holyfield , quando dice nel	dopo-match	: l' ho avuto in mio potere tre volte , ma ogni volta che volevo chiudere , lui dimostrava di
REPUBBLICA	dopo	atlanta	?	?	di questa partecipazione e per gli scarsi vantaggi finanziari del prestito subordinato da 1.200 miliardi concessi alla banca romana nel	dopo-atlanta	.
REPUBBLICA	dopo	franco	?	?	persino in spagna , nella spagna di questi ultimi anni , e comunque del	dopo-franco	, si è levata qualche voce contro l' arte del toreare , e persino i turisti , un po' meno
REPUBBLICA	dopo	imola	?	?	in attesa di una risposta di lauda , analizziamo tutti i problemi del	dopo-imola	.
REPUBBLICA	dopo	maradona	?	?	nasce il napoli del	dopo-maradona	: ferlaino è impegnato a ricostruire la squadra , ma non saranno molti i ritocchi .
REPUBBLICA	dopo	oscar	?	?	un pronostico : soprattutto milano , lontana dal triangolo eroico meneghin - d' antoni-mcadoo , ma neppure la caserta del	dopo-oscar	.
REPUBBLICA	dopo	cariglia	?	?	bisogno , perché proprio il segretario , poco dopo , gli riconosce indirettamente l' investitura da delfino : per il	dopo-cariglia	i candidati sono tanti -- commenta coi cronisti -- ma io ho già dato un' indicazione chiara quando ho nominato
REPUBBLICA	dopo	proiezione	?	?	o da uscieri , nella hall della salle debussy , dove si affolla la stampa internazionale , durante l' esodo	dopo-proiezione	.
REPUBBLICA	dopo	apartheid	?	?	, o l' organizzazione di mandela si ritirerà dai colloqui preparatori che dovrebbero aprire la strada alla riforma costituzionale del	dopo-apartheid	.
REPUBBLICA	dopo	apartheid	?	?	tiene immobilizzate le energie del paese , impedendo- gli di riprendere il cammino iniziato dal presidente de klerk verso il	dopo-apartheid	.
REPUBBLICA	dopo	apartheid	?	?	è logico che anche il	dopo-apartheid	annunciato da de klerk si misuri secondo lo stesso metro .
REPUBBLICA	dopo	yalta	?	?	pace sia sempre più difficile , invece che più facile , riapre il dibattito politico su due punti centrali del	dopo-yalta	: sulla guerra del golfo e sul nuovo ordine mondiale .
REPUBBLICA	dopo	yalta	?	?	questa tesi sostiene che il sistema internazionale è entrato col	dopo-yalta	in una fase di cambiamenti sistemici .
REPUBBLICA	dopo	discoteca	?	?	mamme-antitrock , ma ritenuta da molti , al contrario , un semplice palliativo rispetto alle vere cause delle morti del	dopo-discoteca	.
REPUBBLICA	dopo	golfo	?	?	il tempo infatti stringe e l' occasione che la congiuntura internazionale del	dopo-golfo	offre , non può essere persa , come , ha ricordato andreotti , è già avvenuto purtroppo in passato .
REPUBBLICA	dopo	esplosione	?	?	congo che dovevano evacuare i funzionari dell' organizzazione dell' unità africana , ieri la città ha vissuto con tranquillità il	dopo-esplosione	.
REPUBBLICA	dopo	opec	?	?	emblematica , in questo senso , la discussione sul petrolio , con le incognite del	dopo-opec	e la possibilità che l' europa diventi totalmente indipendente nell' approvvigionamento petrolifero .
REPUBBLICA	dopo	gorbaciov	?	?	l' aiuto occidentale , e stabilità del potere in urss , fa breccia , oltretutto perché fa paura un eventuale	dopo-gorbaciov	.
REPUBBLICA	dopo	listino	?	?	1,72 % , mentre i titoli montedison hanno perso 2 lire ( lo 0,13 % ) per poi recuperare nel	dopo-listino	.
REPUBBLICA	dopo	gardini	?	?	ma è garofano che nel	dopo-gardini	acquista il ruolo maggiore : è presidente della montedison , amministratore delegato della ferfin e di fronte ad una famiglia
REPUBBLICA	dopo	danimarca	?	?	stoccolma il	dopo-danimarca	è una giornata di pioggia e sole , che le due nuove stelle di mercoledì hanno equamente diviso fra una
REPUBBLICA	dopo	orlando	?	?	del psdi nella maggioranza alla regione , un tripartito che fotocopia il patto già stretto al comune di palermo nel	dopo-orlando	.
REPUBBLICA	dopo	referendum	?	?	rende noto il carteggio col presidente della camera e la secca risposta alla richiesta di un " consiglio " sul	dopo-referendum	.
REPUBBLICA	dopo	tacconi	?	?	walter zenga si racconta con accenti molto più spigolosi : il	dopo-tacconi	ha già contorni un po' faticosi , ma non perché fanno giocare un tempo a pagliuca , anzi , io
REPUBBLICA	dopo	summit	?	?	il	dopo-summit	si consuma tra un infittir- si di voci su prossimi ritocchi ai tassi di interesse tedeschi .
REPUBBLICA	dopo	apartheid	?	?	ore sulle colline vicino a durban un' organizzazione ancora ignota , destinata a dominare la scena politica nel sudafrica del	dopo-apartheid	.
REPUBBLICA	dopo	discoteca	?	?	stragi del sabato sera , che dovrebbero almeno sulla carta , far cadere drasticamente il numero delle giovanissime vittime del	dopo-discoteca	.
REPUBBLICA	dopo	golfo	?	?	si è discusso anche del nuovo clima internazionale nato dal	dopo-golfo	, ma anche l' elaborazione di politiche che costruiscano nuovi rapporti di fiducia fra i vari paesi dell' area mediterranea
REPUBBLICA	dopo	malattia	?	?	e questo sarebbe un	dopo-malattia	, alberto lionello ?
REPUBBLICA	dopo	rauti	?	?	secolo d' italia , l' organo del partito , nel quale illustra anche le quattro principali aree di intervento del	dopo-rauti	: lotta alla criminalità , lotta all' immigrazione clandestina , battaglia contro l' oppressione fiscale e impegno per la riforma
REPUBBLICA	dopo	karajan	?	?	direttore artistico gérard mortier li rivelerà tutti insieme nel corso di una conferenza stampa che segnerà l' inizio ufficiale del	dopo-karajan	.
REPUBBLICA	dopo	cronometro	?	?	il	dopo-cronometro	non ha prodotto scosse in classifica , e le due giornate fresche , dopo tanto caldo , sono state molto
REPUBBLICA	dopo	calvi	?	?	nell' ambroveneto lo ior del	dopo-calvi	.
REPUBBLICA	dopo	maradona	?	?	coppa america : oggi primo titolo del	dopo-maradona	?
REPUBBLICA	dopo	maradona	?	?	adesso -- quella che ha vinto dopo lunghissima attesa la coppa america -- è l' argentina del	dopo-maradona	: batistuta , ruggeri , rodriguez , soprattutto caniggia .
REPUBBLICA	dopo	tour	?	?	e lietti perde la soddisfazione di arrivare ai campi elisi , di raccogliere ingaggi nei circuiti del	dopo-tour	, perché uno come lui , che sa il francese , un posto in cartellone lo trova sempre .
REPUBBLICA	dopo	comunismo	movimento culturale/politico	?	dei gelati che avevano dieci anni o poco più quando gorbaciov entrò nel cremlino e saranno grandi nell' urss del	dopo-comunismo	.
REPUBBLICA	dopo	golfo	?	?	il cartello opec affronta il	dopo-golfo	intervista a subroto , leader dell' organizzazione dei paesi esportatori di greggio .
REPUBBLICA	dopo	maradona	?	?	america , il capocannoniere del torneo sudamericano di questa estate , capace di portare l' argentina al primo titolo del	dopo-maradona	: il ventiduenne attaccante è l' ultimo acquisto , travagliatissimo , di un mercato-stranieri che si è chiuso proprio ieri
REPUBBLICA	dopo	giro	?	?	prestazioni di chioccioli , che si è forse meritato qui la fiducia incondizionata di martini dopo le opache prove del	dopo-giro	, e dello svizzero richard ( in gran forma , brutto cliente per il mondiale !
REPUBBLICA	dopo	invasione	?	?	certo , è stata la flessione più sensibile dell' ultimo anno , paragonabile a quella del	dopo-invasione	del kuwait .
REPUBBLICA	dopo	gorbaciov	?	?	e al suo soviet , i russi hanno sfidato tutti i divieti del comitato golpista , nel primo giorno del	dopo-gorbaciov	.
REPUBBLICA	dopo	golpe	?	?	sia perché l' urss del	dopo-golpe	è , se possibile , ancora più spaccata e sbandata di prima : le spinte secessioniste dei baltici si sono
REPUBBLICA	dopo	golpe	?	?	, soprattutto sulle reti rai le edizioni straordinarie del tg , con aggiornamenti da mosca e commenti in studio sul	dopo-golpe	.
REPUBBLICA	dopo	borsa	?	?	indicazione : i rialzi massicci sono stati concentrati negli ultimi minuti di contrattazioni : a piazza affari hanno caratterizzato il	dopo-borsa	ed è più che probabile che l' ondata positiva continui anche oggi .
REPUBBLICA	dopo	ferragosto	?	?	un	dopo-ferragosto	agitato , sulla costiera sorrentina .
REPUBBLICA	dopo	golpe	?	?	i neocomunisti denunciano insieme i rischi che nazionalismo , conservazione autoritaria e capitalismo ' selvaggio ' preparano all' urss del	dopo-golpe	.
REPUBBLICA	dopo	golpe	?	?	: quel che serve ai quadri di rifondazione comunista della capitale per mettere in scena il primo confronto aperto sul	dopo-golpe	a mosca .
REPUBBLICA	dopo	golpe	?	?	quindi lei crede che sarà eltsin il nuovo leader del	dopo-golpe	?
REPUBBLICA	dopo	golpe	?	?	quella contro il " generale inverno " che minaccia l' urss del	dopo-golpe	?
REPUBBLICA	dopo	beffa	?	?	ad oslo , nella cena del	dopo-beffa	, il tecnico ha accennato ad una frase tutt ' altro che sibillina , " le squadre si fanno già
REPUBBLICA	dopo	ferie	?	?	gli analisti raccolgono gli ultimi dati del	dopo-ferie	.
REPUBBLICA	dopo	golpe	?	?	adeguar- si ai riconoscimenti della comunità internazionale e della russia di eltsin , il potere più forte nell' ex-urss del	dopo-golpe	.
REPUBBLICA	dopo	golpe	?	?	nel clima di " caccia alle streghe " del	dopo-golpe	, è stato perquisito anche il suo ufficio al cremlino , così come quello di anatolj chernajev , l' altro
REPUBBLICA	dopo	golpe	?	?	perestrojka si è rafforzata , e quel realismo tante volte invocato comincia a far- si strada tra le passioni del	dopo-golpe	.
REPUBBLICA	dopo	ferie	?	?	superato le prime , iniziali resistenze , lo scenario economico-sindacale italiano giunge , ancora una volta , alla ripresa del	dopo-ferie	con gli stessi , annosi problemi che ormai da molto tempo lo affliggono .
REPUBBLICA	dopo	riunificazione	?	?	effetto trainante " dell' economia internazionale : gli stati uniti stentano ad uscire dalla recessione , l' economia tedesca del	dopo-riunificazione	non marcia ai ritmi previsti , la ripresa in generale è fiacca , lenta e stenta a propagar- si .
REPUBBLICA	dopo	estate	?	?	la fotografia congiuntural-statistica dell' italia del	dopo-estate	e , soprattutto , i provvedimenti del governo per recuperare equilibrio e terreno , saranno sottoposti al vaglio degli esperti
REPUBBLICA	dopo	golpe	?	?	passati in fretta gli entusiasmi del dopo-guerra del golfo e del	dopo-golpe	fallito , l' autunno non porterà nessuna ripresa della domanda .
REPUBBLICA	dopo	golpe	?	?	certo , anzi ha ancora più responsabilità e potere : ora , nei nuovi assetti del	dopo-golpe	, è a tutti gli effetti responsabile della ristrutturazione economica dell' unione sovietica nel nuovo comitato di risanamento presieduto da
REPUBBLICA	dopo	pacchetto	?	?	che maschera la paura della svp riguardo al "	dopo-pacchetto	" .
REPUBBLICA	dopo	sessantotto	?	?	dopo circa 7 secoli di vita e dopo la grande fuga del	dopo-sessantotto	, anno in cui incominciarono a diminuire le vocazioni , i seguaci di questi ordini sono presenti a migliaia in
REPUBBLICA	dopo	grassi	?	?	ragione loro , ricorda che il comune è statoparte civile al processo contro gli estorsori , riconosce l' emergenza del	dopo-grassi	e assicura l' appoggio della giunta formata da democristiani e socialisti .
REPUBBLICA	dopo	golpe	?	?	ieri sera , de michelis ha descritto in una conferenza stampa il suo primo incontro con il gorbaciov del "	dopo-golpe	" .
REPUBBLICA	dopo	barre	?	?	: da una parte l' ala politica , guidata da alì mahdi mohamed , un commerciante che nei giorni del	dopo-barre	venne designato presidente ad interim , un incarico in cui è stato confermato poco più di un mese fa alla
REPUBBLICA	dopo	urss	?	?	gorbaciov all' inaugurazione della csce spiega il	dopo-urss	' questo immenso paese ' , ha detto de michelis , ' diviene per la prima volta europa sul piano
REPUBBLICA	dopo	golpe	?	?	colloquio di lunedì con gorbaciov , l' italia ha così preso contatto con i due leader dell' urss del "	dopo-golpe	" .
REPUBBLICA	dopo	dc	movimento culturale/politico	?	stavolta il bersaglio è giulio di donato ed il suo " costruiamo il	dopo-dc	" , affidato ieri mattina alle colonne de " l' unità " .
REPUBBLICA	dopo	longarini	?	?	il	dopo-longarini	è dunque già iniziato .
REPUBBLICA	dopo	colpo	?	?	mercoledì silaev aveva chiuso un acceso dibattito osservando che il consiglio di stato , il massimo organismo dell' urss del	dopo-colpo	di stato , avrebbe deciso lunedì chi dovrà guidare il comitato stesso .
REPUBBLICA	dopo	liberazione	?	?	convinzione profonda : cioè che la morte di don pessina , come quelle di altre vittime di delitti dell' immediato	dopo-liberazione	, faceva parte di un piano deciso a tavolino nelle stanze del pci di reggio emilia .
REPUBBLICA	dopo	golpe	?	?	della tendopoli del pds , graciov è ospite assieme a una mezza dozzina di esponenti del magmatico panorama politico del	dopo-golpe	sovietico , dagli uomini di shevardnadze a quelli del composito fronte che sorregge eltsin , i repubblicani , i socialdemocratici
REPUBBLICA	dopo	comunismo	movimento culturale/politico	?	da ieri a martedì prossimo , invece , sui palchi della prima festa dell' unità del	dopo-comunismo	, va in scena tutto intero il grande rebus di mosca , gravido di quelle " durissime prove " e
REPUBBLICA	dopo	agnelli	?	?	ed è il	dopo-agnelli	.
REPUBBLICA	dopo	ceausescu	?	?	romania nel caos fallisce il progetto politico degli uomini che hanno guidato il	dopo-ceausescu	.
REPUBBLICA	dopo	ceausescu	?	?	già dai primi giorni , il	dopo-ceausescu	assunse connotati ben diversi dalle rivoluzioni democratiche esteuropee del 1989 : non i capi del dissenso appena usciti dalle galere
REPUBBLICA	dopo	comunismo	movimento culturale/politico	?	è su questo infido terreno che in gran parte sarà giocata la partita del	dopo-comunismo	russo .
REPUBBLICA	dopo	olimpiadi	?	?	al tomba godereccio e grassoccio del	dopo-olimpiadi	si sta insomma sostituendo un tomba fortissimo ma in guerra con il sistema e con le sue paure .
REPUBBLICA	dopo	cattani	?	?	l' ultima ' piovra ' , la quinta , quella del	dopo-cattani	, costa 12 miliardi e 800 milioni : la rai ne investe 9 e mantiene i diritti tv per il
REPUBBLICA	dopo	coppe	?	?		dopo-coppe	, anche il genoa soffrirà ...
REPUBBLICA	dopo	cska	?	?	nel	dopo-cska	ha fatto una profonda autocritica , il che è sembrato anche un segno di maturità , la speranza di un
REPUBBLICA	dopo	golpe	?	?	l' omicidio di igor taljkov sembra destinato a creare il primo " martire " giovanile dell' urss del	dopo-golpe	.
REPUBBLICA	dopo	pci	?	?	è una spina nel fianco del	dopo-pci	, che già l' anno scorso ha pagato cara la perdita di identità scendendo dal 44,5 per cento al 38,7
