ITWAC	dopo	perestrojka	?	?	cui è tratto il film di cesare ferrario la bella di mosca , come " caposcuola della letteratura russa del	dopo-perestrojka	" .
ITWAC	dopo	dittatura	?	?	servire una semplice idea di solidarietà : dare sicurezza al popolo iracheno nella preziosa ma durissima transizione dal caos del	dopo-dittatura	alla rivoluzionaria promessa di una stagione di libertà e di democrazia .
ITWAC	dopo	caduta	?	?	, in linea con le nuove esigenze ; in più , una sceneggiatura molto valida , che aggiorna sapientemente al	dopo-caduta	dell' unione sovietica ( e dunque delle correnti e degli equilibri che governavano in genere gl iscenari dei precedenti film
ITWAC	dopo	dimissioni	Event	?	alleanza nazionale abbandona la pregiudiziale anti-lega sul ministero delle riforme , cioè uno degli scogli più duri del	dopo-dimissioni	.
ITWAC	dopo	feste	?	?	sono molto preoccupato per il	dopo-feste	» .
ITWAC	dopo	unificazione	?	?	di qualità e promozione mirata rappresentano le chiavi di successo in un mercato colpito da una forte crisi economica del	dopo-unificazione	e con un tasso di disoccupazione che supera oggi il 10 per cento .
ITWAC	dopo	mundial	?	?	cresciuta considerazione di enzo bearzot che gli affida , senza più dubbi ed alternanze , la maglia numero 10 nel	dopo-mundial	.
ITWAC	dopo	berlusconi	?	?	dovremmo cominciare a pensare a cosa succederà nel	dopo-berlusconi	.
ITWAC	dopo	petrolio	?	?	focus r & s eco-energia avanza la ricerca sul	dopo-petrolio	- nei laboratori c' è grande fermento scientifico , tecnologico e industriale per mettere a punto fonti alternative al greggio
ITWAC	dopo	petrolio	?	?	forse il primo messaggio concreto che sta manifestandosi nell' era del	dopo-petrolio	.
ITWAC	dopo	sviluppo	?	?	potevamo così continuare a riflettere e lavorare ad un	dopo-sviluppo	, mettere insieme una post-modernità accettabile .
ITWAC	dopo	sviluppo	?	?	il	dopo-sviluppo	deve necessariamente essere plurale .
ITWAC	dopo	sviluppo	?	?	, di cui possiamo scorgere qua e là qualche fremito iniziale , ad aprire le porte alla speranza di un	dopo-sviluppo	.
ITWAC	dopo	natale	?	?	du chau , apre al 4 ° posto con 13,9 milioni - qualcuno meno del previsto , effettivamente il	dopo-natale	non è il periodo migliore per un film così .
ITWAC	dopo	guerra	Qualification or Set of Circumstances	?	, tra l' altro , in una fase economica italiana , che viene considerata da tutti la più grave del	dopo-guerra	, soprattutto in una regione , come il piemonte , che sta su ­ bendo un forte processo di deindustrializzazio
ITWAC	dopo	famiglia	?	?	e la cultura del cosiddetto	dopo-famiglia	che traspare dai progetti e dai discorsi di tante associazioni attorno a quali nodi si costruisce ?
ITWAC	dopo	shoà	?	?	il dovere della testimonianza dei sopravvissuti nel "	dopo-shoà	" la città di carpi ed il vicino campo di fossoli , dove abbiamo testé sostato in meditazione e preghiera
ITWAC	dopo	shoà	?	?	costringe noi , i sopravvissuti , a porci quotidianamente la domanda : come dobbiamo vivere , pensare , agire nel	dopo-shoà	?
ITWAC	dopo	concerto	?	?	e molto coinvolgenti dal vivo , non si sono nemmeno lasciati sfuggire l' occasione di girare per il locale nel	dopo-concerto	e di scambiare quattro chiacchiere con chiunque volesse , compreso il sottoscritto e i suoi compari .
ITWAC	dopo	giro	?	?	diffonderanno in diretta nelle americhe , in australia , asia e africa gli arrivi di tappa e i commenti del	dopo-giro	, così come il programma " giromattina " coprodotto da raitre e tgr , un viaggio tra le regioni alla
ITWAC	dopo	apartheid	?	?	anche il sudafrica del	dopo-apartheid	ha visto nascere diverse tendenze musicali fra gli strati più disagiati della popolazione .
ITWAC	dopo	apartheid	?	?	« questa musica si basa sull' energia del nostro tempo , della generazione del	dopo-apartheid	che esprime la sua libertà e la sua eccitazione , perché tutto le sembra nuovo » , spiega la splendida
ITWAC	dopo	boom	?	?	e' il 1963 tra reggio emilia e modena , come in tante altre zone dell' italia del	dopo-boom	, nascono , a ritmo frequentissimo , centinaia di gruppi musicali , accumunati dalla voglia di esprimere sensazioni , pensieri
ITWAC	dopo	mobutu	?	?	, e gli zairesi non hanno dubbi : il ruanda ha aggredito lo zaire e vuole condizionare a cannonate il	dopo-mobutu	) .
ITWAC	dopo	tsunami	?	?	ricostruire in modo sostenibile , è questa la priorità per il	dopo-tsunami	il wwf chiede ai governi di avviare la ricostruzione in modo che siano conservati i meccanismi naturali di difesa .
ITWAC	dopo	tsunami	?	?	congruo incasso di 2000 euro che prontamente volerà con destinazione asia , come donazione per le opere di ricostruzione del	dopo-tsunami	.
ITWAC	dopo	pranzo	?	?	prima di ripartire ci invita in chiesa per ascoltare un canto preparato dagli animatori che si ritrovano ogni	dopo-pranzo	per le prove .
ITWAC	dopo	comunismo	movimento culturale/politico	?	anni dopo arriverà un no anche al capitalismo selvaggio del	dopo-comunismo	, in perfetta linea con giovanni paolo ii : « il crollo del comunismo non certifica automaticamente la bontà del
ITWAC	dopo	scusa	?	?	il giorno	dopo-scusa	...
ITWAC	dopo	olocausto	?	?	anche se l' uso di un' ambientazione medioevaleggiante per un	dopo-olocausto	non è originale per il mondo della fantascienza , l' originalità di miller sta soprattutto nella base religiosa che gli
ITWAC	dopo	muro	?	?	profondissimo - dal comunismo al socialismo democratico e liberale - per potersi adattare con successo alla situazione politica del "	dopo-muro	" .
ITWAC	dopo	gara	?	?	umbri ai calci di rigore e nell' andata di questo campionato , quando i grifoni vinsero a torino e nel	dopo-gara	scoppio' il caso bucci-pieroni .
ITWAC	dopo	feste	?	?	dopo i primi otto titoli apparsi nei mesi estivi , quale miglior modo di trascorrere il "	dopo-feste	retrogaming " se non in compagnia di samus , link , dr-mario e simon belmont ?
ITWAC	dopo	dittatura	?	?	che ( così dice la gente ) aveva guarito perfino menem , uno dei primi presidenti giunti sulla scena nel	dopo-dittatura	.
ITWAC	dopo	palcoscenico	?	?	scoperto dagli attori è divenuto un simbolo del	dopo-palcoscenico	.
ITWAC	dopo	partita	Event	?	pensiamo anche ai benefici televisivi : intere telenovele di cialtroni e narratori del	dopo-partita	abolite , veline costrette a riciclarsi dopo una fama acquisita di pseudo-interiste , pseudo-juventine , pseudo-milaniste , famiglie pacificate in
ITWAC	dopo	scuola	Place or function	?	l' orario di arricchimento (	dopo-scuola	gestito dal comune ) si sviluppa dalle 12,30 alle 17,30 del lunedì , mercoledì e venerdì ; dalle 17,00 alle
ITWAC	dopo	tsunami	?	?	intanto però la militarizzazione del	dopo-tsunami	non aiuta la distensione .
ITWAC	dopo	rifiuto	?	?	lâ  tmassociazione indipendente di consumatori invita abi e tfa a delineare chiaramente quale sia la strategia del	dopo-rifiuto	, per poter fornire ai consumatori delle strade concrete da percorrere .
ITWAC	dopo	attacco	?	?	già , ci dicono che la guerra sarà brevissima , una nuova blitzkrieg ; si dimenticano del	dopo-attacco	, dice albright , si rischia una lunga occupazione militare ( vera bomba innescata nella capitale culturale dell' epoca d'
ITWAC	dopo	taliban	?	?	questa è oggi la kandahar del	dopo-taliban	, in superficie sembra il regno della legge e dell' ordine .
ITWAC	dopo	twin	?	?	effetti il clima in cui questi incontri con gli studenti tedeschi sono nati è quello stordito e incredulo dell' immediato	dopo-twin	towers .
ITWAC	dopo	talebani	?	?	l' impegno u.s.a per le donne afgane " due anni fa , con tanto di fanfara , nell' afganistan del	dopo-talebani	fu annunciato il consiglio delle donne statunitensi e afgane , ( uawc ) .
ITWAC	dopo	spettacolo	Event	?	autentico con chi viene a sentirmi , cercando un inizio di dialogo , che poi molto spesso infatti prosegue nel	dopo-spettacolo	...
ITWAC	dopo	taleban	?	?	islamica in iraq » e definisce allawi il « karzai iracheno » , paragonandolo con disprezzo al presidente afghano del	dopo-taleban	.
ITWAC	dopo	conferenza	?	?	in conclusione , vorremmo già pensare al	dopo-conferenza	, e richiediamo che a scadenza fissa , una o due volte all' anno , sia diffusa l' informazione sull'
ITWAC	dopo	conflitto	?	?	verificano oggi in quelle regioni , ma costituiscono anche una pesante ipoteca sulle possibilità di ripresa economica e sociale nel	dopo-conflitto	.
ITWAC	dopo	rivoluzione	?	?	l' estetica stalinista rifiutò le scoperte dell' avanguardia rivoluzionaria e tecnofila dei primi anni del	dopo-rivoluzione	.
ITWAC	dopo	guerra	Qualification or Set of Circumstances	?	quando giovanni battista montini era ancora un giovane sacerdote , durante il periodo del	dopo-guerra	, fu volontario presso il primo posto di accoglienza che monsignor carroll aprì , l' albergo della sciuscià vicino la
ITWAC	dopo	bagno	?	?	come se anche loro fossero in vacanza , albergano nella sabbia e nelle docce , meta obbligata del	dopo-bagno	per togliersi la salsedine .
ITWAC	dopo	elezioni	?	?	bossi , in sostanza , ha rammentato ai vari protagonisti del	dopo-elezioni	che la lega è parte integrante del progetto politico che si sviluppa sotto l' ombrello della casa delle libertà .
ITWAC	dopo	parto	?	?	sede , con possibilità per il p arto in acqua , consulenza ostetrica per allattamento , consulenza psicologica e corsi	dopo-parto	dalla nascita all' anno di vita del bambino .
ITWAC	dopo	pena	?	?	équipe del sert diventa un' autentica sfida specie per un' impresa che resta complessa come il reinserimento del detenuto nel	dopo-pena	.
ITWAC	dopo	sessantotto	?	?	e , racconta , la vicenda anche in quella francia del	dopo-sessantotto	, fece scalpore : « dovetti usare diplomazia coi genitori dei ragazzi .
ITWAC	dopo	stragi	?	?	già ad avere un nuovo capo , bernardo provenzano , l' uomo che aveva cominciato a lavorare alla fase del	dopo-stragi	prima ancora che le stragi fossero attuate .
ITWAC	dopo	enron	?	?	ondata degli scandali sono il frutto di nuovi poteri che l ´ authority ha acquisito solo di recente , nel	dopo-enron	.
ITWAC	dopo	enron	?	?	effetto benefico della concorrenza « virtuosa » tra la sec , e una magistratura potente la cui figura rappresentativa nel	dopo-enron	è eliot spitzer .
ITWAC	dopo	festival	?	?	http://inzjamed.cjb.net versione italiana ) , per comunicare tra di loro e mettere su le pr e le strutture per il	dopo-festival	, vale a dire nel dicembre 2004 .
ITWAC	dopo	esilio	?	?	nel	dopo-esilio	la profezia si esprimerà attraverso il movimento apocalittico che incoraggerà le comunità ebraiche alla resistenza nel contesto degli imperi ,
ITWAC	dopo	mucca	?	?	alimentazione e macellazione dell' animale : è la corsa all' informazione delle grandi catene di distribuzione per far fronte al	dopo-mucca	pazza .
ITWAC	dopo	scala	?	?	in occasione del	dopo-scala	il capogruppo vincenzo giudice avrebbe cercato sull' argomento un chiarimento con il sindaco .
ITWAC	dopo	conferenza	?	?	il	dopo-conferenza	( 2 ) : mobilitare le comunità italiane residenti nell' unione europea ( grtv ) focalizzavamo nel primo scritto sul
ITWAC	dopo	conferenza	?	?	2 ) : mobilitare le comunità italiane residenti nell' unione europea ( grtv ) focalizzavamo nel primo scritto sul "	dopo-conferenza	" ( v. webgiornale del 29.12.2000 ) come precipuo impegno delle organizzazioni italiane all' estero , il vigilare sull' attuazione
ITWAC	dopo	batistuta	?	?	attaccanti nel mirino per il	dopo-batistuta	, ma non solo .
ITWAC	dopo	batistuta	?	?	attaccanti nel mirino per il	dopo-batistuta	, ma non solo .
ITWAC	dopo	rientro	?	?	attività dell' ambulatorio per viaggiatori del dipartimento di prevenzione dell' a.s.s. 4 " medio friuli " con le valutazioni del	dopo-rientro	sulla profilassi consigliata .
ITWAC	dopo	olimpiadi	?	?	torino 2006 : colloquio killy-bresso apre la visita cio presidente regione piemonte : " pensiamo al	dopo-olimpiadi	" torino , 7 giugno 2005 un colloquio informale tra jean-claude killy e mercedes bresso , nella sua nuova veste
ITWAC	dopo	lavoro	Qualification or Set of Circumstances	?	di solito , un papà normale giocherebbe con la squadra del	dopo-lavoro	, " goppingen " gioca in serie d. " ho assunto una falsa identità perché non volevo creare clamore attorno
ITWAC	dopo	vacanze	?	?	molti docenti e molto dirigenti scolastici hanno già deciso autonomamente di dedicare allo tsunami le prime discussioni e lezioni del	dopo-vacanze	.
ITWAC	dopo	pranzo	?	?	faccio il mio solito giro	dopo-pranzo	e mi ritrovo al posto di quel nano bastardo con gli occhiali un cartone " nuovissimo " ...
ITWAC	dopo	bombe	?	?	alla crisi mondiale - oltre all' aiuto umanitario , mai sufficiente - è favorire un equilibrato ragionamento internazionale sul "	dopo-bombe	" .
ITWAC	dopo	cancun	?	?	wto : piccole manovre per il	dopo-cancun	( 24/11/2003 ) fervono i tentativi di rilancio del round negoziale .
ITWAC	dopo	scuola	Place or function	?	nelle città e nei quartieri che progettiamo , abbiamo " aree gioco " e " giochi sorvegliati " : un	dopo-scuola	di cui gli adulti dettano le regole e i regolamenti , istituzionalizzando il gioco .
ITWAC	dopo	lager	?	?	nel sistema del lager - dunque della problematicità individuale legata ad essa - che si proietta nella dimensione narrativa del	dopo-lager	, in cui il sopravvissuto è attante del processo di elaborazione e comunicazione dell' esperienza vissuta .
ITWAC	dopo	barba	?	?	propria sede , il fabbricante di profumi francesi caron ha recentemente rispolverato l' immagine dell' anarchico ravachol per lanciare un	dopo-barba	da uomo chiamato appunto « l' anarchiste » .
ITWAC	dopo	conflitto	?	?	ghali presentò un documento con proposte per un funzionamento migliore dell' onu nei conflitti potenziali e nell' attuazione delle misure	dopo-conflitto	per costruire la pace tra le parti in lotta .
ITWAC	dopo	guerra	Qualification or Set of Circumstances	?	ciò che ha stimolato in modo decisivo l' europa occidentale nel	dopo-guerra	è stata la decisione dell' attuazione della sicurezza sociale come " costo " del sistema , che sarebbe stato affrontato
ITWAC	dopo	eliminazione	?	?	, ad occuparsi delle sue faccende politiche ; i dirigenti hanno aspettato con calma che si placasse la bufera del	dopo-eliminazione	, e nessuno sa cosa abbiano in mente .
ITWAC	dopo	armstrong	?	?	chi dominerà i tour del	dopo-armstrong	?
ITWAC	dopo	armstrong	?	?	chi dominerà i tour del	dopo-armstrong	?
ITWAC	dopo	armstrong	?	?	chi dominerà i tour del	dopo-armstrong	?
ITWAC	dopo	armstrong	?	?	chi dominerà i tour del	dopo-armstrong	?
ITWAC	dopo	armstrong	?	?	chi dominerà i tour del	dopo-armstrong	?
ITWAC	dopo	fallimento	?	?	la « storia » degli animali di fuorigrotta , ricostruita con non poca fatica ( tra i vari episodi del	dopo-fallimento	, anche il furto del computer con le schede degli animali ) .
ITWAC	dopo	talebani	?	?	stato fissato per lunedì in germania il vertice tra le diverse fazioni afghane per definire il futuro del paese nel	dopo-talebani	.
ITWAC	dopo	mensa	?	?	il tempo dedicato alla refezione e al cosiddetto	dopo-mensa	, è comunque previsto ed assicurato dalla scuola .
ITWAC	dopo	parto	?	?	lazio marzolino nella zona di sora , in provincia di frosinone , con il latte del	dopo-parto	( il latte di marzo ) si produce un caprino piccolo e basso chiamato marzolina , da consumare fresco o
ITWAC	dopo	genocidio	?	?	partita da una corrente revisionista che ha attraversato il rwanda e il	dopo-genocidio	, questa tendenza ha toccato gli attori burundesi con lo slogan kiliziya yarakuye kirazira " la chiesa ha soppresso i
ITWAC	dopo	colazione	?	?	degli amanti del pic-nic e la mattina presto degli appassionati del jogging e dell' equitazione ( e tappa fissa del	dopo-colazione	di mia figlia ) .
ITWAC	dopo	barba	?	?	parenti della sua droga quotidiana , pur di bere , accetta qualsiasi bevanda o presunta tale , anche la lozione	dopo-barba	in cui è presente alcol .
ITWAC	dopo	discoteca	?	?	tutto è pronto , dunque , per l' avvio di una stagione del divertimento all' insegna della sicurezza anche nel	dopo-discoteca	.
ITWAC	dopo	chievo	?	?	forse , anche per questo , la società ha deciso di far quadrato nella settimana	dopo-chievo	.
ITWAC	dopo	ponte	?	?	» , il passaggio ha in sé i connotati essenziali della questione : lavorare , da subito , al «	dopo-ponte	» .
ITWAC	dopo	tsunami	?	?	clima dove tanti pronosticano e alcuni fomentano uno " scontro delle civiltà " ( e delle religioni ) , il	dopo-tsunami	aveva fatto registrare molteplici episodi di feconda collaborazione e reciproco aiuto tra credenti di diverse tradizioni religiose .
ITWAC	dopo	matrimonio	?	?	e ) tiziana rocca non organizzerà la cena	dopo-matrimonio	.
ITWAC	dopo	lager	?	?	quanto forti siano i legami tra lo squallore del momento politico presente con l' impatto che noi abbiamo subito nel	dopo-lager	, quando , rientrati in patria dalla deportazione , ci rendemmo conto che i valori più cari e semplici ai
ITWAC	dopo	tsunami	?	?	popolazioni sinistrate : da hong kong a oslo , le forze di polizia segnalano delitti di ogni genere legati al	dopo-tsunami	.
ITWAC	dopo	facoltà	?	?	una sorta di	dopo-facoltà	, per l' allievo umanista , è il vicino locale " farfarello " , " diabolico " ritrovo di tanti
ITWAC	dopo	mensa	?	?	posti di cui all' articolo 15 del decreto medesimo , va aggiunto il tempo eventualmente dedicato alla mensa e al	dopo-mensa	, che , nella sua espansione massima , è di 231 ore annue ( sino a 7 ore settimanali )
ITWAC	dopo	derby	?	?	2004 - le recenti intromissioni di silvio berlusconi nel mondo del calcio , dalle dichiarazioni rilasciate alla conferenza stampa del	dopo-derby	al lungo intervento in diretta durante la domenica sportiva , non sono passate inosservate .
ITWAC	dopo	conflitto	?	?	per quanto riguarda il	dopo-conflitto	la conferma di impegno italiano arriva da un' intervista a panorama del ministro della difesa antonio martino : « se
ITWAC	dopo	euro	?	?	, del rapporto predisposto dal gruppo di lavoro coordinato dal professor amato su « il mezzogiorno nella politica generale del	dopo-euro	» .
ITWAC	dopo	rivolta	?	?	analisi formale dal 1950 al 1956 all' accademia di budapest , ligeti abbandona l' ungheria in opposizione al regime del	dopo-rivolta	.
ITWAC	dopo	matrimonio	?	?	ed inoltre consigli per il	dopo-matrimonio	.
ITWAC	dopo	decreti	?	?	il	dopo-decreti	aniasi vide anche frequenti confronti spesso aspri tra varie parti istituzionali , in particolare tra servizi e autorità sanitarie ai
ITWAC	dopo	muro	?	?	di una famiglia negli anni del comunismo e l' educazione delle ragazze in boemia , ambientato nella repubblica ceca del	dopo-muro	.
ITWAC	dopo	attacco	?	?	immediatamente dopo che un crimine è stato scoperto , il software tripwire può essere usato per creare un database	dopo-attacco	per ogni sistema che è stato affetto .
ITWAC	dopo	pranzo	?	?	i cibi vengono intaccati dalla saliva , vi è un minor inghiottimento d' aria e quindi niente meteorismi , un	dopo-pranzo	leggero e senza mal di testa .
ITWAC	dopo	bomba	?	?	questa è la cronaca del	dopo-bomba	.
ITWAC	dopo	caporetto	?	?	, capaci di imporsi consisté nel rappresentare un combattente di tipo nuovo , che fosse di stimolo all' italia del	dopo-caporetto	» e , nel contempo , « servì a recuperare quel volontariato politico morale che l' esercito aveva scarsamente apprezzato
ITWAC	dopo	emergenza	Qualification or Set of Circumstances	?	, energia elettrica , mezzi di comunicazione , ecc. ) , gestire l' emergenza fino in fondo e organizzare il	dopo-emergenza	.
ITWAC	dopo	scala	?	?	dunque , si predispongano i vestiti delle signore , i controlli della questura , gli allestimenti del	dopo-scala	a villa torretta .
ITWAC	dopo	conflitto	?	?	la pace che ha investito il mondo , abbia la capacità di far avanzare questa prospettiva per la fase del	dopo-conflitto	, a partire dalla emergenza umanitaria .
ITWAC	dopo	dopoguerra	?	?	erano gli anni del	dopo-dopoguerra	.
ITWAC	dopo	batistuta	?	?	ad abdicare dalle aspirazioni tricolori era stata la fiorentina che faticosamente avvia con un nuovo allenatore la difficile era del	dopo-batistuta	.
ITWAC	dopo	scuola	Place or function	?	eravamo a scuola ( elementare ) e il pomeriggio	dopo-scuola	si andava a vedere se si riusciva a racimolare qualche frutto o radice da mangiare .
ITWAC	dopo	fondi	?	?	" per la toscana sta per iniziare una nuova stagione - ha concluso martini - quella del	dopo-fondi	europei .
ITWAC	dopo	sconfitta	?	?	era un' accusa all' ulivo del	dopo-sconfitta	.
ITWAC	dopo	referendum	?	?	inviato il 04 luglio 2005 alle 19:22 - commenti ( 0 ) scrivi	dopo-referendum	.
ITWAC	dopo	referendum	?	?	inviato il 20 giugno 2005 alle 14:15 - commenti ( 0 ) scrivi un documento riservato sui piani del	dopo-referendum	dopo la vittoria nel referendum del 12 giugno , i gruppi e movimenti che l' hanno conseguita studiano come farne
ITWAC	dopo	pasto	?	?	misurazione della glicemia si stava a digiuno dalla sera prima o dalla fatidica mezzanotte - , ma soprattutto nell' immediato	dopo-pasto	.
ITWAC	dopo	pranzo	?	?	avere dei livelli glicemici piu alti della norma nel	dopo-pranzo	, puo costituire in molti casi l' esordio della malattia diabetica .
ITWAC	dopo	legge	documento	?	lunedi' avra' luogo un attivo del pds sul	dopo-legge	, presenti napolitano e turco .
ITWAC	dopo	guerra	Qualification or Set of Circumstances	?	vari scandali " fotografici " ( torture , abusi , umiliazioni e altro ) avvenuti sempre in questo strano "	dopo-guerra	" .
ITWAC	dopo	tsunami	?	?	) , definendolo « la prossima tappa europea per delineare la " road-map " sulle strategie degli aiuti ue nel	dopo-tsunami	» .
ITWAC	dopo	elezioni	?	?	dunque fra gli alleati del cavaliere è fini che si assume la responsabilità di aprire le danze del	dopo-elezioni	e a mettere di nuovo nel mirino i poteri di giulio tremonti e la sua linea di politica economica .
ITWAC	dopo	buffy	?	?	io ho letto i riassunti degli episodi , perchè volevo sapere un pò come veniva affrontato il "	dopo-buffy	" ...
ITWAC	dopo	lavoro	Qualification or Set of Circumstances	?	e poi c' è il	dopo-lavoro	, la serata passata a bere birra o whisky con i capi e i colleghi , un proseguimento dell' attività
ITWAC	dopo	marketing	?	?	alla faccia della concorrenza - nell' era del	dopo-marketing	, cioè nella nostra era , la concorrenza non esiste .
ITWAC	dopo	cavaliere	Job or Career	?	ed è stata la prima volta che il governatore abbia ipotizzato apertamente un proprio convolgimento diretto nel	dopo-cavaliere	.
ITWAC	dopo	capitalismo	movimento culturale/politico	?	capitalismo viene individuato ( con marx ) nei rapporti sociali che espropriano i lavoratori , e la ricerca del «	dopo-capitalismo	» sta nelle strade , per nulla ideologiche , ma fortemente politiche , che consentono a lavoratori e cittadini di
ITWAC	dopo	carcere	Entity	?	se si guardasse al	dopo-carcere	si punterebbe di più sulla professionalità del lavoro , proprio nel rispetto del detenuto .
ITWAC	dopo	risanamento	?	?	confederali , proiettati ormai da tempo sul futuro , pensano alle aziende già in termini europei , alla fase del	dopo-risanamento	, « a come attrezzare le società di trasporto in vista del mercato internazionale e delle privatizzazioni » .
ITWAC	dopo	sbronza	?	?	ma gli estratti del cactus , oltre ad evitare il malessere del	dopo-sbronza	, hanno anche suggerito agli esperti una novità interessante : gli effetti deleteri dell' alcol dipendono anche da fenomeni infiammatori
ITWAC	dopo	lavoro	Qualification or Set of Circumstances	?	l' incontro con cristo non è una sorta di "	dopo-lavoro	" che si affianca alla vita quotidiana dell' uomo .
ITWAC	dopo	sviluppo	?	?	la mia riflessione si rivolge verso una rifondazione del sociale e del politico nell' era della post-modernità , del	dopo-sviluppo	, della società post-economicista .
ITWAC	dopo	taleban	?	?	sul terreno del	dopo-taleban	, musharraf continua a insistere sulla necessità che nel futuro governo di unità nazionale siano rappresentati i « taleban moderati
ITWAC	dopo	gara	?	?	e la stessa marie reine la gogne , in una riunione	dopo-gara	, avrebbe dichiarato : " ho ricevuto pressioni dalla federazione francese per votare così " .
ITWAC	dopo	rogo	?	?	un rimedio drastico quello che il sindaco dino latini si accinge a prendere nel	dopo-rogo	all' appartamento del comune di via roncisvalle assegnato a " castagna " e da lui incendiato .
ITWAC	dopo	viagra	?	?	in pratica anche il farmaco del	dopo-viagra	per la cura della disfunzione erettile ( ne soffrono mediamente 3 milioni di italiani ) può presentare i propri effetti
ITWAC	dopo	discoteca	?	?	di controlli con 50 pattuglie e niente alcol nei night dopo le tre paola perez basta con gli incidenti del	dopo-discoteca	.
ITWAC	dopo	conferenza	?	?	il	dopo-conferenza	.
ITWAC	dopo	parto	?	?	mi sto stancando troppo e forse dovrei tenere le energie per il	dopo-parto	visto che non bastano mai !
ITWAC	dopo	mercato	Qualification or Set of Circumstances	?	greggio per consegna a settembre è aumentato di 28 centesimi di dollaro , raggiungendo i 60,85 dollari a barile nel	dopo-mercato	elettronico che fa riferimento al nymex , la borsa merci di new york .
ITWAC	dopo	referendum	?	?	critica corre su indymedia dopo sabato , quello che era latente già da qualche mese , più o meno dal	dopo-referendum	sull' articolo 18 , è esploso con maggiore evidenza .
ITWAC	dopo	riforme	?	?	se si riteneva che le pensioni del	dopo-riforme	sarebbero state insufficienti a garantire una vita dignitosa ai futuri pensionati , meglio sarebbe stato aumentare i contributi da versare
ITWAC	dopo	concilio	?	?	di liturgia ) , al contrario , nonostante i miei sforzi per far ammettere al papa che alcuni aspetti del	dopo-concilio	avevano avuto connotazioni negative , non sono mai riuscito a cavare da lui la pur minima critica .
ITWAC	dopo	cena	?	?	ospitale , con un accogliente arredamento fusion , accomoda il visitatore su divanetti e tavoli colorati per rilassanti aperitivi e	dopo-cena	, le opere di artisti emergenti alle pareti completano l' idea del colpo d' occhio che l' orange vi offre
