REPUBBLICA	passato	destino	?	?	sono in corso riflessioni e dibatti sulla realtà odierna dell' isola , e su quel suo infelice	passato-destino	mediterraneo nel quale amano cullar- si molti dei suoi abitanti e dei suoi interlocutori .
REPUBBLICA	passato	fantasma	?	?	e specialmente dove l' ideologia è diventata burocrazia , vive solo il	passato-fantasma	, il presente sono scartoffie e fotocopie ...
REPUBBLICA	passato	presente	?	?	alla nuova russia di gorbaciov e all' europa viene da praga una sfida a fare i conti con il	passato-presente	, e un messaggio di speranza .
REPUBBLICA	passato	presente	?	?	il padre , achille , faccia burbera e piglio da siamo sempre in pista , ha un	passato-presente	di imprenditore edile e di presidente .
REPUBBLICA	passato	presente	?	?	da massimino a un' imprenditoria ritenuta nuova perché non compromessa col	passato-presente	della città .
REPUBBLICA	passato	presente	?	?	la linea rossa del	passato-presente	riappare qua e là .
REPUBBLICA	passato	presente	?	?	rende conto che si sta inoltrando in una costruzione complessa , un concerto di voci e figure che sono il	passato-presente	, la tradizione antica e oggi .
REPUBBLICA	passato	presente	?	?	mentre i debiti ereditati dal	passato-presente	di colosso pubblico sono stati ridotti dell' 11,1 per cento a 78,1 miliardi di marchi e i dipendenti sono scesi
REPUBBLICA	passato	ricordo	?	?	è la nostra mente che garantisce un' avventurosa continuità ( salvo frantumazione nervosa ) fra il	passato-ricordo	, il presente-percezione e il futuro-aspettativa .
REPUBBLICA	passato	presente	?	?	ascoltando lei che cerca di dare ai giovani serbi la voglia di discutere sul futuro , ripercorriamo i drammi del	passato-presente	dell' est e dell' europa intera .
REPUBBLICA	passato	presente	?	?	poi , aspetteremo i play out , ma soprattutto dirigenti nuovi che facciano tabula rasa di un	passato-presente	non più tollerabile .
ITWAC	passato	futuro	?	?	orrore della propria condizione , come il piccolo danny di shining strabuzzava gli occhi di fronte alla visione di un	passato-futuro	costituito da un' immenso rosso fiume eracliteo , di fronte alla percezione ineludibile di un tempo di sangue strabordante dalle
ITWAC	passato	presente	?	?	che impedisce ancora la nascita di una più fertile e democratica " seconda repubblica " , con malinconici ritorni al	passato-presente	che rimarrà per secoli il più brutto di una società che voleva far credere di essere sana , cattolica ,
ITWAC	passato	presente	?	?	) mentre l' immagine ha una sua originale dimensione di	passato-presente	.
ITWAC	passato	presente	?	?	queste scoperte macabre , frutto di una macchina omicida ancora potenzialmente attiva , costruiscono una specie di	passato-presente	e turbano il ritmo della distanza temporale .
ITWAC	passato	sedimento	?	?	" il viaggio lucifèrico " ulysses : il viaggio non autorizzato il viaggio lucifèrico esperienze itineranti nello spazio letterario (	passato-sedimento	) marco camerani ulysses : il viaggio non autorizzato breve scritto sul profeta antico e il profeta moderno ogni vita
ITWAC	passato	presente	?	?	razionalmente responsabile affermare che lo stato palestinese potrà esistere solo come , ad un tempo , sanzione della irreversibilità del	passato-presente	dello stato di israele e premessa ( una delle premesse ) per il suo futuro , non meno che per
ITWAC	passato	passato	?	?	la ' coscienza geniale ' , con i suoi slanci , e l' utopia ; insieme danno origine agli irraggiungibili	passato-passato	e futuro-futuro .
ITWAC	passato	futuro	?	?	il	passato-futuro	ed il presente-futuro sono surrogati , interpretano il futuro da una posizione condizionata che falsa la visione del libero futuro
ITWAC	passato	futuro	?	?	chiunque abbia imparato la dottrina della " liberazione dalle coppie degli opposti " (	passato-futuro	, gioia-dolore , eccetera : le simplegadi 21 del " folclore " ) resterà meravigliato quando scoprirà che per nicola
ITWAC	passato	sedimento	?	?	" territori " il viaggio lucifèrico " sulla strada del picaro il viaggio lucifèrico esperienze itineranti nello spazio letterario (	passato-sedimento	) filippo furri sulla strada del picaro breve scritto sul picaresco il viaggio può innegabilmente rappresentare una forma di conoscenza
ITWAC	passato	sedimento	?	?	alcune testimonianze di esperienze di viaggio , soffermandoci dapprima sul viaggio nella letteratura ( spazio letterario ) , dunque nel	passato-sedimento	, con furri , sulla strada del picaro ; camerani , ulysses : il viaggio non autorizzato ; cavagna ,
ITWAC	passato	sedimento	?	?	presentazione " territori " il viaggio lucifèrico " iter ad inferos il viaggio lucifèrico esperienze itineranti nello spazio letterario (	passato-sedimento	) mattia cavagna iter ad inferos breve scritto sui visionari viaggi agli inferi sia dal punto di vista fisico ,
ITWAC	passato	futuro	?	?	per esempio , la diminuzione dell' entropia o la convergenza delle onde nella direzione del tempo che va dal	passato-futuro	è improbabile , ma non è assolutamente proibita dalle leggi di natura .
ITWAC	passato	futuro	?	?	" in cui spazio e tempo si separano e ricongiungono in variabili-vettori di significato , nella circolarità di un "	passato-futuro	" .
ITWAC	passato	presente	?	?	brecht e weill , racconta la chiusura feroce delle piccole comunità , sbeffeggia il concetto di tradizione , riflette sul	passato-presente	che l' america condivide per certi versi anche con la nostra europa .
ITWAC	passato	immaginario	?	?	nei confronti delle esperienze amorose della moglie , rappresentate sullo schermo in bianco e nero , ossessiva testimonianza del suo	passato-immaginario	; questa sensazione è ingigantita dalle parole dette e non dette da alice , ma sarà per entrambi il punto
ITWAC	passato	sedimento	?	?	viaggio lucifèrico " la condizione dell' erranza per il poeta esule il viaggio lucifèrico esperienze itineranti nello spazio letterario (	passato-sedimento	) valerio cuccaroni la condizione dell' erranza per il poeta esule gëzim hajdari , vita e poetica di uno sradicato
ITWAC	passato	presente	?	?	in definitiva è stato un tuffo in un	passato-presente	musicale , un concerto ricco ma semplice allo stesso tempo , senza troppi trucchi elettronici , di grande spessore tecnico
ITWAC	passato	passato	?	?	non certo per ripristinare le forme di un	passato-passato	, ma per ridare forma a elementi di un tessuto che ha perduto la sua trama .
