ITWAC	quasi	maggioritario	?	?	oltre a quelle prettamente formali , relative al sistema elettorale nazionale	quasi-maggioritario	introdotto nel 1993 e a quelli locali , ai vari tentativi di riscrivere la costituzione , alla riorganizzazione delle autonomie
ITWAC	quasi	capolavoro	?	?	cosa più debole - forse l' unica , all' interno di una pellicola costruita con precisione chirurgica - del piccolo	quasi-capolavoro	the royal tenenbaums ) , e sfrutta la sua improbabile vena atletica ( già messa in mostra nel non infimo
ITWAC	quasi	caduta	?	?	come gia' ricordato , l' argomento delle deroghe era stato al centro di una	quasi-caduta	del governo prodi : la mini-crisi fu riassorbita con il decreto del presidente del consiglio del marzo '97 che tentava
ITWAC	quasi	protagonista	Qualification or Set of Circumstances	?	fin dal ritratto del	quasi-protagonista	, luca : " luca ha la camicia bianca picchiettata dalle gocce , poche mille lire nel taschino , in
ITWAC	quasi	omonimo	?	?	e a quest' ultimo proposito , anche la diatriba tribunalizia la trovo più fiacca rispetto al suo	quasi-omonimo	, sebbene abbia letto il contrario nella vostra , tra l' altro autorevole , recensione ...
ITWAC	quasi	invisibilità	?	?	per la compresione verso la	quasi-invisibilità	del blog ( adesso non si vedono più le ultime 5 foto ) e per tutte le tue altre comprensioni
ITWAC	quasi	maggioranza	Qualification or Set of Circumstances	?	mente cifre sostanzialmente simili a quelle esposte : in italia c' è una sinistra forte , ma c' è una	quasi-maggioranza	di agnostici o di decisamente ostili alla democrazia e alla repubblica laica e democratica .
ITWAC	quasi	maggioranza	Qualification or Set of Circumstances	?	anzi , facciamo una cosa : diamo a quella	quasi-maggioranza	che abbiamo per decenni calunniato con la nostra mentalità da trinariciuti ( della quale ci vergognamo profondamente ) , diamogli
ITWAC	quasi	totalità	?	?	attrezzature in vetro e in metallo non hanno legami stretti e permanenti con i produttori di bevande in quanto la	quasi-totalità	della fabbricazione degli imballaggi in vetro e in metallo è effettuata da terzisti .
ITWAC	quasi	suicidio	Event	?	[ + ] : : imbustato da chettimar alle 19.02 : : 2 postille cronaca di un	quasi-suicidio	informatico o , meglio , di un quasi-suicidio assistito premessa : la storiella in questione è alquanto kafkiana .
ITWAC	quasi	suicidio	Event	?	imbustato da chettimar alle 19.02 : : 2 postille cronaca di un quasi-suicidio informatico o , meglio , di un	quasi-suicidio	assistito premessa : la storiella in questione è alquanto kafkiana .
ITWAC	quasi	legge	documento	?	e qui , sospendendo il vigore della "	quasi-legge	" spaventa , occorre ridare forza - con il senno di poi - all' idea e alla pratica della programmazione
ITWAC	quasi	choc	?	?	di correlazione tra campo di velocità e campo magnetico ) lasciano pensare che trattasi appunto di onde nonlineari , o	quasi-choc	( non potendo parlare di choc in quanto i numeri di mach sono ovunque minori di 1 ) .
ITWAC	quasi	ministeri	?	?	questo comando regionale è dotato di « uffici » che sono dei	quasi-ministeri	, investiti di questioni militari o culturali , che svolgono una diplomazia parallela , si occupano della gestione di vasti
ITWAC	quasi	mercato	Qualification or Set of Circumstances	?	famiglie e alla comunità , a istituire un' authority indipendente per la valutazione della qualità scolastica , a creare un	quasi-mercato	per la competizione tra scuole , a varare una legge sulla parità , e a rompere la gabbia dell' impiegatizzazione
ITWAC	quasi	cinema	Place or function	?	pugilato fotografato in bianconero come in toro scatenato , quest' opera in cui i tre cabarettisti tentano di approdare al	quasi-cinema	d' autore non rinunciando alla loro comicità e facendo il passo troppo lungo della gamba : ricostruzione filologica adeguata ai
ITWAC	quasi	certezze	?	?	data : venerdì 14 novembre 2003 , 15:12 » | rispondi citando aussie , più che di dubbi parlerei di	quasi-certezze	, considerando le premesse che hai sinteticamente indicato .
ITWAC	quasi	certezze	?	?	citando quotato da : wind il venerdì 14 novembre 2003 , 15:12 aussie , più che di dubbi parlerei di	quasi-certezze	, considerando le premesse che hai sinteticamente indicato .
ITWAC	quasi	stato	?	?	nuovi attriti a causa del sahara occidentale la disputa intorno al	quasi-stato	della repubblica democratica araba saharawi , rads , meglio conosciuto come sahara occidentale , non si è ancora esaurita .
ITWAC	quasi	mare	?	?	" , ieri " turisti : sono pochi e non spendono molto " ) , la mia breve vacanza al	quasi-mare	si farà ricordare più che altro per un temporaneo abbandono della zona ( e questo per dire quanto le mie
ITWAC	quasi	retrocessione	?	?	per carità , tra gli errori dei della valle e la	quasi-retrocessione	ci sono di mezzo un' infinità di " avvenimenti straordinari " che non si possono imputare alla proprietà ; resta
ITWAC	quasi	consulenti	Job or Career	?	quindi da clienti a	quasi-consulenti	, proprio per il loro lavoro quotidiano di mediazione tra il libro e il ragazzo , ma anche di osservatorio
ITWAC	quasi	rigore	?	?	siamo al	quasi-rigore	ed alla quasi - riforma ' ' .
ITWAC	quasi	soggetto	?	?	in vitro , che non sarebbe ancora persona bensì una mera " spes di essere umano " , un "	quasi-soggetto	" , e quello dell' embrione in vivo , che sarebbe invece da considerare come soggetto ( f. modugno ,
ITWAC	quasi	dance	?	?	vezzo da critici il tentativo di cogliere le sottigliezze nascoste nelle " variazioni " rispetto al repertorio consueto : la	quasi-dance	di " l' ombra del gigante " , l' incedere blues di " l' aquila e il condor " .
ITWAC	quasi	mercato	Qualification or Set of Circumstances	?	scuola in quanto istituzione , il suo degrado a servizio , cui è presto seguito l' avvento di un "	quasi-mercato	" dell' istruzione fondato sulla concorrenza .
ITWAC	quasi	suicidio	Event	?	6.9.03 ( esame di pianoforte ) , 12.9.03 lights go out , stars come down , 28.9.03 cronaca di un	quasi-suicidio	informatico , 11.10.03 quella sporca dozzina , 31.12.03 stati dissociativi cronici , 9.1.04 la nevicata nel pineto , 26.1.04 metti
ITWAC	quasi	giurisdizione	?	?	governance mondiale ( dove campeggiano i compiti di	quasi-giurisdizione	, anche qui nel bene e nel male , dell' organizzazione mondiale del commercio ) .
ITWAC	quasi	scomparsa	?	?	di culture umane con valori diversi da quelli attuali ; - lo sviluppo economico si arresta gradualmente per la progressiva	quasi-scomparsa	della filosofia che ne costituisce il fondamento ( il materialismo ) .
ITWAC	quasi	partito	Qualification or Set of Circumstances	?	e con i governi " amici " di lamberto dini e romano prodi , costituendosi in un	quasi-partito	dei sindaci , hanno svolto un ruolo di lobby non priva di accenti di protesta .
ITWAC	quasi	rifiuto	?	?	brani probabilmente più " vivi " in concerto , ma anche " floppy " non è male : è un	quasi-rifiuto	della tecnologia ...
ITWAC	quasi	virus	?	?	i parassiti , i batteri , i virus e i	quasi-virus	della terra non ci vogliono male , ma approfittano di ogni occasione per espandersi , talvolta a nostro danno .
ITWAC	quasi	morte	Qualification or Set of Circumstances	?	congetturiamo su cosa accada dopo la morte e quale sia il significato delle esperienze di	quasi-morte	.
ITWAC	quasi	morte	Qualification or Set of Circumstances	?	story afferma : « anche le esperienze di	quasi-morte	in cui non hai subito ferite ti costringono a riflettere intensamente .
ITWAC	quasi	regime	Qualification or Set of Circumstances	?	stampo fascista o comunista visto che di giornali antiberlusconiani ce ne sono ancora , direi che siamo più in un	quasi-regime	) ed è anche vero che la censura e la lottizzazione ci sono sempre state nella storia della rai (
ITWAC	quasi	stati	?	?	cereda , responsabile del progettograndi laghi della caritasitaliana - non possono nemmeno legittimamente definirsi come tali ; sarebbemeglio parlare di	quasi-stati	, entità esistenti sulla carta o alle nazioniunite , ma in realt & agraveespressione di gruppi di potere minoritari ,
ITWAC	quasi	crisi	?	?	, avuta con l' ex marito eros ramazzotti , è in un momento di grazia : dopo un periodo di	quasi-crisi	 aperto dalle voci che la volevano legata all' ambiente di giulia breghella , la " maga " dei vip
ITWAC	quasi	fumetto	?	?	dal	quasi-fumetto	di enrico baj alle icone della società dei consumi nei collage di mimmo rotella , al pop di casa nostra
ITWAC	quasi	mercato	Qualification or Set of Circumstances	?	bretagna infatti è stato introdotto il principio del mercato all' interno dei servizi sociali , attraverso dei sistemi di "	quasi-mercato	" .
ITWAC	quasi	essere	?	?	si pone questa alternativa alla temporalità quodditativa in cui può essere legittimo individuare un tertium datur , che è un	quasi-essere	o un quasi-niente .
ITWAC	quasi	musicisti	?	?	stesso periodo , eno si dedica alla produzione di due album sperimentali della portsmouth sinfonia ( un' orchestra di "	quasi-musicisti	" ) .
ITWAC	quasi	trasparenza	?	?	e anche sul suo viso vide quella stessa	quasi-trasparenza	che faceva intravvedere un altro volto dietro a quello visibile .
ITWAC	quasi	ministero	Denomination	?	all' interno della presidenza esiste il dipartimento della funzione pubblica , un	quasi-ministero	che ha il compito specifico di progettare e rendere operativa una profonda riforma della pubblica amministrazione .
ITWAC	quasi	appunti	?	?	ma questo post , in forma di	quasi-appunti	personali , magari potrebbe muovere la curiosità di qualcun altro ...
ITWAC	quasi	steady	?	?	link esterni articoli scientifici recenti riguardo a teorie cosmologiche non ortodosse ( in inglese ) :	quasi-steady	state model - narlikar , vishwakarma , burbidge ( http://de.arxiv.org/abs/astro-ph / 0205064 ) ekpyrotic scenarios - steinhardt + turok
ITWAC	quasi	esperimento	?	?	scritta , una possibile situazione di ricerca da scegliersi tra : ø un vero esperimento - disegni fattoriali ø un	quasi-esperimento	- differenze tra gruppi o esperimento naturale ø uno studio correlazionale ø uno studio descrittivo la situazione di ricerca deve
ITWAC	quasi	scisma	?	?	uscito politicamente dalle schiere pannelliane nel 1983 , deciso di dar vita al movimento federativo radicale : un	quasi-scisma	che da allora gli è costato l' ostracismo personale e politico dei suoi antichi compagni .
ITWAC	quasi	fantascienza	?	?	è " i giorni del delfino " , e non ha niente a che vedere con il quasi-omonimo film di	quasi-fantascienza	di vent' anni fa .
ITWAC	quasi	vuoto	?	?	inerziale in quiete assoluta e si pensò di trovare tale sistema introducendo l' esistenza dell' etere , una sorta di	quasi-vuoto	, trasparente , impalpabile e legato alle stelle fisse .
ITWAC	quasi	monopoli	grado	?	la calda coperta della svalutazione e della spesa pubblica , devono essere liberate le risorse oggi sprecate per alimentare i	quasi-monopoli	che numerosi ancora prosperano nel paese , si devono liberalizzare il più possibile i servizi , le professioni ed il
ITWAC	quasi	collasso	?	?	come lucianne goldberg , una dei decani del movimento ( e madame lafarge durante il	quasi-collasso	di bill clinton ) , che ha esclamato : « intendete forse gente a cui piace ammazzare altre persone e
ITWAC	quasi	città	Qualification or Set of Circumstances	?	argomento del corso città e "	quasi-città	" nel pieno e tardo medioevo : istituzioni , società , economia .
ITWAC	quasi	città	Qualification or Set of Circumstances	?	c ) lettura critica di un' opera a scelta tra le seguenti : - g. gullino , una "	quasi-città	" dell' italia nord-occidentale , torino , paravia , 1996 - e. basso , un' abbazia e la sua città
ITWAC	quasi	cristalli	?	?	analitici rigorosi , nei seguenti campi : limite semiclassico della meccanica quantistica , localizzazione di anderson , proprietà spettrali di	quasi-cristalli	, meccanica statistica fuori dall' equilibrio .
ITWAC	quasi	copia	?	?	anche su prodotti vecchi , ma ancora validi , le case farmaceutiche potrebbero anche ridurre la spinta promozionale su prodotti	quasi-copia	che escono oggi solo perchè assicurano un profitto nettamente superiore .
ITWAC	quasi	morte	Qualification or Set of Circumstances	?	due sue precoci esperienze di "	quasi-morte	" gli hanno ispirato l' uso di un linguaggio che trasmette un profondo messaggio di speranza e di opportunità .
ITWAC	quasi	museo	?	?	la signora pilitzer considera la sua realizzazione un	quasi-museo	" una tipo di esperienza di visita alternativo " ai quelle possibili nei musei attuali , grandi e sempre più
ITWAC	quasi	collisione	?	?	e da questo argomento ovviamente passa alla trattazione delle questioni radar e dell' ipotesi di	quasi-collisione	.
ITWAC	quasi	autostrada	?	?	due anni fa il governo amato approvò un progetto per fare della vecchia aurelia una	quasi-autostrada	: quattro corsie senza pedaggio .
ITWAC	quasi	mercati	Qualification or Set of Circumstances	?	i	quasi-mercati	dei servizi sanitari in italia e gran bretagna xvii ciclo centemeri laura titolo conseguito in data 24/03/2005 con la tesi
ITWAC	quasi	disoccupato	?	?	ahiè , perdonate il mio caratteraccio da	quasi-disoccupato	.
ITWAC	quasi	disoccupato	?	?	ahiè , perdonate il mio caratteraccio da	quasi-disoccupato	.
ITWAC	quasi	maneggio	?	?	nel	quasi-maneggio	dove passo metà dei miei pomeriggi c \ ' era fino a ieri un bel sauretto , di forme molto
ITWAC	quasi	rinuncia	?	?	hanno come target i ceti mediobassi della popolazione ) predicano il totale astensionismo dalla politica , in un' ottica di	quasi-rinuncia	ai propri diritti ...
ITWAC	quasi	accordo	Process	?	questa ragione , è possibile ( e forse auspicabile ) che si pervenga mano a mano a uno stadio di	quasi-accordo	sui diversi tavoli negoziali , per poi sciogliere i nodi rimasti mediante un compromesso di ampia portata .
ITWAC	quasi	recessione	?	?	principali temi in agenda sono l' esame della situazione economica alla luce delle crescenti difficoltà della locomotiva usa ormai in	quasi-recessione	e la sostenibilità delle finanze pubbliche di fronte alla due bombe ad orologeria costituite dall' invecchiamento della popolazione e dall'
ITWAC	quasi	necessità	?	?	testo originario , in particolare attraverso l' obbligo di utilizzare le graduatorie provinciali anziché quelle di istituto e la conseguente	quasi-necessità	di ricorrere alle " scuole-polo " per le nomine .
ITWAC	quasi	obbligo	?	?	ma se si vuole un alleato , non lo si puo' trattare a calci in faccia , abusando del	quasi-obbligo	che lo stesso ha di utilizzare i servizi bancari per la sua quotidianita' economica .
ITWAC	quasi	certezza	?	?	comunque number 5 , non voglio affatto entrare in polemica , però ora come ora la certezza ( o	quasi-certezza	) che si tratti di al quaeda non la possiamo avere , non trovi ?
ITWAC	quasi	fidanzata	Kinship	?	, di giorno , da incentivi e pressioni psicologiche nei confronti dei lavoratori in esubero e dal rapporto con la	quasi-fidanzata	laura che comincia ad andare a rotoli , trova conforto , di notte , tra le braccia di angelique ,
ITWAC	quasi	teorie	?	?	, dei lavori , dei poteri con cui la disciplina stessa dialoga di necessità ) sviluppando trame di teorie ,	quasi-teorie	, pa ­ radigmi , prestiti e scambi .
ITWAC	quasi	parodia	?	?	mostow non ha un decimo del talento visionario di cameron , e si rifugia in una comoda "	quasi-parodia	" fracassona e convenzionale , facendo rimpiangere le atmosfere noir e sinistre dei primi due episodi .
ITWAC	quasi	mercato	Qualification or Set of Circumstances	?	di oasi - volevano , almeno alcune , essere semplici enti regolatori del sistema , facendo operare le aziende di	quasi-mercato	.
ITWAC	quasi	diritti	?	?	o - più genericamente - un' attività ; interessi molto simili ai diritti soggettivi , tanto da essere talvolta denominati	quasi-diritti	( 25 ) .
ITWAC	quasi	certezze	?	?	le	quasi-certezze	pero' in questo campo sono molte : sia sulle console ( uscira' sicuramente su x-box , quasi sicuramente su playstation
ITWAC	quasi	morte	Qualification or Set of Circumstances	?	i suoi personaggi , di una morte vera e propria , sarà allora un' esperienza molto simile , una "	quasi-morte	" , a rendere possibile una specie di rinascita , a provocare una sorta di agnizione , che segna l'
ITWAC	quasi	morte	Qualification or Set of Circumstances	?	, come ci rivela soltanto nelle ultime pagine , dall' essere egli passato attraverso un gravissimo infarto , una "	quasi-morte	" , insomma , che lo ha spinto a parlare nella consapevolezza di vivere ormai " in un tempo preso
ITWAC	quasi	premier	Role	?	un intervento da	quasi-premier	, insomma , pur avendo egli rifiutato l' investitura alla successione simbolicamente offertagli da berlusconi 10 giorni fa a genova
ITWAC	quasi	fallimento	?	?	vostra presidenza di ladri ed alla vostra squadra succedesse anche solo la metà delle cose ( leggi conseguenze legali ,	quasi-fallimento	, società alla merché di buffoni , prigione per il presidente , svendita della squadra dei sogni ) successe a
ITWAC	quasi	vita	Entity	?	tali eventi minori - un flusso impetuoso di pensieri verso l' estremità darwiniana dello spettro - come esperienze di "	quasi-vita	" .
ITWAC	quasi	vita	Entity	?	esso va dalle esperienze di	quasi-vita	a quelle sul letto di morte .
ITWAC	quasi	partito	Qualification or Set of Circumstances	?	o magari un	quasi-partito	, dove regnano le regole della delega e della personalizzazione .
ITWAC	quasi	monopolista	Rank	?	coincidenza , tre fatti si sovrappongono in questi giorni in italia , tre fatti che coinvolgono a diverso titolo il	quasi-monopolista	mondiale del software : il blocco parziale dell' internet ( in tutto il mondo ) , causato da un worm
ITWAC	quasi	gol	?	?	giallonero , ma non basta più il destino di una mezza squadra sarà sempre quello di sbagliare una miriade di	quasi-gol	e di compiere sempre un mezzo miracolo .
ITWAC	quasi	contratto	documento	?	si può epitomarli in 4 classi : contratto reale , contratto consensuale , certi	quasi-contratto	e certi rapporti di diritto reale .
ITWAC	quasi	spot	?	?	****** regionali e propaganda politica autogestita in tv tra segretari attori e	quasi-spot	milano  non chiamateli spot .
ITWAC	quasi	allarme	Qualification or Set of Circumstances	?	sulle misure specifiche , è l' improvviso e tardivo riconoscimento da parte del ministero dell' economia di una condizione di	quasi-allarme	della finanza pubblica .
ITWAC	quasi	stati	?	?	creazione di altrettanti momenti di filtro delle iniziative quali sono , per esempio , quelli delle regioni , dei nuovi	quasi-stati	.
ITWAC	quasi	stato	?	?	privateering ; quella successiva di consolidamento dell' impero è quella della concessione alle companie delle indie di uno status di	quasi-stato	con facoltà di muovere guerra ) ; così , oggi , la contrazione della sfera pubblica ha il suo corrispettivo
ITWAC	quasi	povertà	?	?	deve supporre ) attraverso uno spendere non compensato da nessun guadagno ( « niente acquistando » ) si riduce alla	quasi-povertà	, senza uscire tuttavia da un modo di vivere « cavalleresco » , nel senso di « improduttivo » (
ITWAC	quasi	divo	Qualification or Set of Circumstances	?	guerre stellari " e che , negli anni settanta , scioccava piacevolmente il nipote con la sua aria rilassata da	quasi-divo	in visita nella conservatrice cittadina di criff , dove il piccolo ewan viveva con la famiglia .
ITWAC	quasi	mercati	Qualification or Set of Circumstances	?	il risultato più consistente ottenuto dalla privatizzazione di parte dei rischi e dalla creazione di	quasi-mercati	assicurativi è stato una riduzione degli abusi della spesa sociale e un aumento dell' offerta di lavoro .
ITWAC	quasi	mercati	Qualification or Set of Circumstances	?	non solo a definire un salario con componenti non solamente monetarie , ma a sollecitare l' emergere di mercati o	quasi-mercati	per la copertura dei rischi cui i lavoratori vanno incontro nello svolgimento della loro attività .
ITWAC	quasi	mercati	Qualification or Set of Circumstances	?	copertura dei rischi connessi alle prestazioni di lavoro richiederebbe un' uniformità di impostazione tra i paesi dell' uem per fornire	quasi-mercati	sufficientemente ampi che consentano la diversificazione del rischio .
ITWAC	quasi	mercati	Qualification or Set of Circumstances	?	16 nel rendere contendibili i	quasi-mercati	delle prestazioni sociali , non va dimenticato che tali prestazioni in alcuni casi coprono dei rischi macroeconomici diversificabili solamente nel
ITWAC	quasi	mercati	Qualification or Set of Circumstances	?	idiosincratici che potrebbe esserlo in misura maggiore , soprattutto in vista di una dimensione europea di tali mercati , o	quasi-mercati	.
ITWAC	quasi	amore	Qualification or Set of Circumstances	?	protagonista , le due ragazze simili e diverse che lo aspettano ogni sera , sono messi a confronto con un	quasi-amore	nella casa con le luci : con la forte presenza d' una lei fuori età , la cui intelligenza sensibile
ITWAC	quasi	acronimo	?	?	beh , il	quasi-acronimo	era lì , bastava vederlo , in trasparenza ...
ITWAC	quasi	suocero	Kinship	?	so che ieri negli uffici di carate c' era gente , c' è andato il mio	quasi-suocero	; , gli hanno fatto compilare un modulo di richeste ( come se non sapessero cosa vogliamo ) ma c'
ITWAC	quasi	omologazione	?	?	ma anche quelle istituzionali ed ideologiche del mondo prevalgono sulle eterogeneità e i vincoli e promuovono l' omologazione o la	quasi-omologazione	rispetto a un unico modello di organizzazione politico-territoriale multi-statale .
ITWAC	quasi	contratto	documento	?	le infrazioni ai propri doveri importano bene spesso obblighi di restituzione , esistendo un	quasi-contratto	tra professionista e cliente ( 306 ) .
ITWAC	quasi	tolleranza	?	?	ad esempio , ci sono state richieste di porre fine a una politica di "	quasi-tolleranza	" ( nella dichiarazione di intenti del precedente governo ) .
ITWAC	quasi	citazioni	?	?	in un continuum di frammenti , stilisticamente di matrice disparata ( elementi importati dal tango alla canzone da musical ,	quasi-citazioni	da stravinskij fino al minimalismo , pannellature di scrittura assai avanzata ) , tenuti assieme da un furor di distorsione
ITWAC	quasi	libretto	?	?	prendendo a prestito il noto neologismo di andrea zanzotto , potremmo dire che il "	quasi-libretto	" in quattordici sezioni di komunyakaa , ciascuna composta di due testi di quattordici versi , disegna un doppio ipersonetto
ITWAC	quasi	collisione	?	?	i due periti firmatari infatti fanno riferimento alla	quasi-collisione	, come ipotesi da approfondire .
ITWAC	quasi	collisione	?	?	risulta facile dimostrare che una	quasi-collisione	non è compatibile con le evidenze dimostrate ( cfr. risposta al punto n. 22 ) .
ITWAC	quasi	collisione	?	?	resta quindi solo la eventuale possibilità di riconsiderare la	quasi-collisione	.
ITWAC	quasi	collisione	?	?	non è chiaro , comunque , quale tipo di approfondimento sarebbe necessario , visto che alla	quasi-collisione	è dedicato un intero capitolo , in cui vengono effettuate anche analisi di dettaglio e modellizzazioni del fenomeno .
ITWAC	quasi	collisione	?	?	la ipotesi della	quasi-collisione	in volo nasce dall' esame della rottura dell' ala sinistra , riconducibile , senza ombra di dubbio , a flessione
ITWAC	quasi	collisione	?	?	il collegio ritiene molto improbabile che una	quasi-collisione	avrebbe prodotto un carico aerodinamico abbastanza grande per provocare la rottura dell' ala del dc 9 .
ITWAC	quasi	collisione	?	?	nel caso di una	quasi-collisione	e di una conseguente brusca manovra , ad alti " g " , è molto improbabile che il caccia possa
ITWAC	quasi	assenza	?	?	i personaggi complementari sono quanto mai azzecccati ( peccato la	quasi-assenza	di walter cole in questo episodio ...
ITWAC	quasi	incidenti	?	?	a nove mesi esatti dalla tragedia del 18 ottobre 2001 , l' aeroporto milanese e' tornato alla ribalta per due	quasi-incidenti	.
ITWAC	quasi	incidenti	?	?	lo abbiamo constatato , analizzando assieme a un pilota collaudatore alcuni	quasi-incidenti	avvenuti in seguito a una « inversione incrociata di stato » : un equipaggio che voleva atterrare ha visto l'
ITWAC	quasi	comunità	?	?	visibile di una vera e propria cultura , nel senso antropologico del termine : i piloti di linea formavano una	quasi-comunità	etnologica , con le proprie gerarchie sociali ( legate al numero di ore di volo , al prestigio degli aerei
ITWAC	quasi	capovolgimento	?	?	la posizione degli esperti del ministero dell' interno segna una svolta , un	quasi-capovolgimento	della bossi-fini .
ITWAC	quasi	normalità	?	?	destinato raramente a ripetersi , oppure se non sia un qualcosa che ritornerà spesso , fino ad affermare una sua	quasi-normalità	.
ITWAC	quasi	violenza	?	?	istinto vitale e fondamentalmente sano , ma minata da una percezione negativa di fondo che le fa accettare passivamente una	quasi-violenza	e il conseguente aborto .
ITWAC	quasi	mercati	Qualification or Set of Circumstances	?	, in economia pubblica , n. 6 , 2000 luca fazzi , la riforma dell' assistenza in italia e i	quasi-mercati	, in economia pubblica , n. 6 , 2000 luigi zanella , una metodologia per la definizione delle microzone catastali
ITWAC	quasi	candidatura	?	?	molto meglio della	quasi-candidatura	di massimo moratti » .
ITWAC	quasi	embrione	?	?	non sarebbe ancora embrione , in cui sarebbe un	quasi-embrione	, in cui ...
ITWAC	quasi	legge	documento	?	e qui , sospendendo il vigore della "	quasi-legge	" spaventa , occorre ridare forza - con il senno di poi - all' idea e alla pratica della programmazione
ITWAC	quasi	ateismo	?	?	come quello di socrate ) che appaiono come vere e proprie anticipazioni di agnosticismo , interpretato forse abusivamente come un	quasi-ateismo	( e da ciò la sua irrimediabile condanna ) .
ITWAC	quasi	reato	?	?	la persona , anche se non imputabile o non punibile , la quale ha commesso un reato o un "	quasi-reato	( artt. 49 e 115 c.p. ) " quando è probabile che commetta nuovi fatti preveduti dalla legge come reati
