ITWAC	quasi	mostro	?	?	thriller leggero e piacevole , se non paragonato ai precedenti di tutti e tre i mostri sacri ( diciamo	quasi-mostro	sacro per edward norton , che con la 25 ma ora si è avvicinato al titolo onorario ) .
ITWAC	quasi	bellezza	?	?	e va beh dai qualcuno mi voterà anche per la	quasi-bellezza	!
ITWAC	quasi	storici	?	?	materiali , quell' aspetto tende a rendere il pezzo quasi provocatorio , perché sembra non avere timore di usare materiali	quasi-storici	.
ITWAC	quasi	market	?	?	( terminologia , responsabilità budgettaria , targets di servizio , standards di qualità ) - crescita del regime convenzionale (	quasi-market	, cultura contrattuale ) - promozione di economia sociale ( social firms , cattedre universitarie , business link , )
ITWAC	quasi	market	?	?	contrattuale ) - promozione di economia sociale ( social firms , cattedre universitarie , business link , ) il termine	quasi-market	è l' espressione inglese con cui si identifica quella forma di welfare mix che è agita attraverso i bandi di
ITWAC	quasi	market	?	?	perché il	quasi-market	funzioni , le grand individua alcune condizioni , che lo differenziano e lo rendono più efficace ed efficiente rispetto alle
ITWAC	quasi	realismo	movimento culturale/politico	?	il	quasi-realismo	afferma che gli enunciati morali del senso comune non hanno l' ambizione di cogliere verità morali .
ITWAC	quasi	realismo	movimento culturale/politico	?	constatazione di quale sia di fatto l' uso del linguaggio morale nel linguaggio ordinario , di modo che " il	quasi-realismo	stesso risulta una teoria estremamente non convincente sull' attuale significato del linguaggio morale " .
ITWAC	quasi	premier	Role	?	l' ex presidente per un esecutivo riequilibrato al centro vademecum per imparare a conoscere il	quasi-premier	vizi e virtu' del designato g li aggettivi sono ormai rituali .
ITWAC	quasi	santo	?	?	davanti a tutti , lui faceva il	quasi-santo	che sopporta una donna " sopra le righe " .
ITWAC	quasi	maggioranza	Qualification or Set of Circumstances	?	risultati che nessuno era mai riuscito a ottenere in sicilia - la cacciata dei cavalieri , l' individuazione di una	quasi-maggioranza	alternativa - e ...
ITWAC	quasi	certezza	?	?	altra	quasi-certezza	: non arriverà un centro in prestito .
ITWAC	quasi	colpo	?	?	forse , senza il trauma della guerra coloniale d' algeria e il	quasi-colpo	di stato del 1958 , in francia avrebbe potuto sopravvivere fino ad oggi il parlamentarismo puro della quarta repubblica ,
ITWAC	quasi	abisso	?	?	e' stato riscontrato un "	quasi-abisso	" di conoscenze dei programmi culturali ce .
ITWAC	quasi	suicidio	Event	?	6.9.03 ( esame di pianoforte ) , 12.9.03 lights go out , stars come down , 28.9.03 cronaca di un	quasi-suicidio	informatico , 11.10.03 quella sporca dozzina , 31.12.03 stati dissociativi cronici , 9.1.04 la nevicata nel pineto , 26.1.04 metti
ITWAC	quasi	silenzio	?	?	vivere » tra un silenzio iniziale e un silenzio finale , ossia di essere , come l' esistenza , un	quasi-silenzio	, un quasi-niente .
ITWAC	quasi	stagnazione	?	?	mercati azionari , restano marginali rispetti ai movimenti finanziari degli investimenti diretti , gli unici che in questa fase di	quasi-stagnazione	potrebbero avviare una fase di ripresa duratura del ciclo economico .
ITWAC	quasi	accordo	Process	?	una costituzionale , per modificare gli articoli 56 e 57 e definire quanti saranno i parlamentari ( esiste già un	quasi-accordo	per aggiungere 16 deputati e 8 senatori eletti da chi vive permanentemente all' estero ) ; e una ordinaria ,
ITWAC	quasi	silenzio	?	?	l' estradizione della baraldini sia stato frutto di un baratto con gli stati uniti ( con merce di scambio il	quasi-silenzio	sulla strage del cermis ) posso accettarlo ; mi mette paura e tristezza ma posso farlo .
ITWAC	quasi	premier	Role	?	alla riunione del gruppo parlamentare della camera , silvio berlusconi si toglie il primo sassolino da	quasi-premier	e avverte i parlamentari azzurri a non abbassare la guardia perchè « i comunisti non cambiano » e « ora
ITWAC	quasi	premier	Role	?	« loro - ha chiosato il	quasi-premier	- sono convinti che questo rallenterà le nostre riforme economiche .
ITWAC	quasi	particelle	?	?	teorie a temperatura finita ed in generale in teorie con rottura spontanea della simmetria dove l' identificazione degli operatori di	quasi-particelle	è condizionata dalla fase in cui il sistema viene studiato .
ITWAC	quasi	grazia	?	?	non abbiamo avuto nulla di nuovo da dirci eccetto questo : la	quasi-grazia	di questi giorni è un passo indietro » .
ITWAC	quasi	vigilia	?	?	eccoci quindi giunti alla	quasi-vigilia	del fantomatico lunedi' di pentecoste , normalmente un giorno di vacanza ma dichiarato da raffarin giornata della solidarieta' : si
ITWAC	quasi	necessità	?	?	si torna così rapidamente alla	quasi-necessità	di una certa simultaneità del presentarsi di parecchie proprietà fondamentali del vivente.se si accetta di porre il problema della simultaneità
ITWAC	quasi	necessità	?	?	quando queste leggi fossero enunciate , l' apparizione della vita diventerebbe forse una "	quasi-necessità	" .
ITWAC	quasi	crisi	?	?	la	quasi-crisi	per le rogatorie , gli attacchi del ministro castelli al presidente ciampi ( prima per la grazia negata a sofri
ITWAC	quasi	morte	Qualification or Set of Circumstances	?	la pausa country ( 1967 - 1970 ) il riscatto dopo l' incidente il periodo : la "	quasi-morte	" dell' incidente motociclistico del 29 luglio del 1966 molto probabilmente salvò dylan dalla morte vera .
ITWAC	quasi	morte	Qualification or Set of Circumstances	?	quella	quasi-morte	gli permise di risorgere .
ITWAC	quasi	liberazione	?	?	i vecchi ebrei che , nel corso della prima guerra mondiale , ricordavano l' occupazione tedesca come una "	quasi-liberazione	" , erano lungi dal pensare che ora i tedeschi giungevano per perseguitarli e ucciderli .
ITWAC	quasi	virus	?	?	" regalini " della rete , dalle cookies ai maligni script java e php , dalle finestre pop-up ai "	quasi-virus	" .
ITWAC	quasi	romanzo	?	?	ma il prodotto , narrato in prima persona dal protagonista , è un	quasi-romanzo	( lewis 1951 , 1961 , 1964 ) , veramente difficile da distinguere dalla narrativa latinoamericana contemporanea ( che non
ITWAC	quasi	romanzieri	?	?	sono  autori forti ' anche lewis e barnet e balestrini : per loro ,	quasi-romanzieri	, far parlare l' altro è  fare letteratura ' .
ITWAC	quasi	romanzieri	?	?	se lewis e barnet sono	quasi-romanzieri	, czarniawska è un quasi-critico letterario , o un quasi-filologo .
ITWAC	quasi	critico	?	?	se lewis e barnet sono quasi-romanzieri , czarniawska è un	quasi-critico	letterario , o un quasi-filologo .
ITWAC	quasi	filologo	?	?	se lewis e barnet sono quasi-romanzieri , czarniawska è un quasi-critico letterario , o un	quasi-filologo	.
ITWAC	quasi	partecipazione	?	?	mamma-soka castrante che gli impedisce di crescere d' altra parte partecipare a forum come questo gli permette una condizione di	quasi-partecipazione	a una situazione di scambio dialettico vero e proprio , visto che pure le persone come lui non possono che
ITWAC	quasi	religion	?	?	research and theory on	quasi-religion	, a cura di greil arthur e robbins thomas , jai , london-new york , 1996 ; pp. 241 -
ITWAC	quasi	insulti	?	?	rece di bnx , che ho coscenziosamente stampato e letto con avidità ) dopo di ciò , partono frecciatine e	quasi-insulti	nei confronti dell' autore , " accusato " di confonder fischi per fiaschi , di non saper distinguere la coca
ITWAC	quasi	gol	?	?	l' elogio del	quasi-gol	, ebbe giustamente a definirlo , anni addietro , eddy cilìa .
ITWAC	quasi	organismo	?	?	comunità , dal suo substrato geologico e dal suo ambiente atmosferico " , per indicare quello che considera come un	quasi-organismo	.
ITWAC	quasi	rendita	?	?	l' esempio più significativo è fornito dal concetto marshalliano di	quasi-rendita	( v. concorrenza pura ) , del quale è ovvia l' analogia col concetto ricardiano di rendita differenziale ( v.
ITWAC	quasi	amore	Qualification or Set of Circumstances	?	legge il racconto che ha scritto su di lei , in cui ha cercato di ricostruire un' ambigua storia di	quasi-amore	di nili , insegnante di yoga , per un suo giovane paziente .
ITWAC	quasi	programma	?	?	di ogni disegno a largo raggio e per i bassi livelli di plausibilità che oggi spettano a ogni programma o	quasi-programma	globale ...
ITWAC	quasi	ovvietà	?	?	ci sono stati momenti , negli anni scorsi , in cui dichiararsi d' accordo con popper era diventata una	quasi-ovvietà	.
ITWAC	quasi	nazione	?	?	i due staterelli dominano gli emirati arabi uniti : una	quasi-nazione	messa insieme dal padre di sheik mo e governante di abu dhabi nel 1971 per allontanare la minaccia dei marxisti
ITWAC	quasi	italiana	?	?	un ruolo che è stato sancito anche dalle parole della splendida	quasi-italiana	penelope cruz che , premiata ( meritatissimamente ) sul palco definisce castellito " un genio " , fino a commuoversi
ITWAC	quasi	dono	?	?	nessuno studio di fattibilità , nessun sistema di garanzie , o viceversa nessuna agevolazione che lo renda un "	quasi-dono	" , è in grado di garantire il buon esito di un credito , cioè il rispetto delle regole del
ITWAC	quasi	segretario	Role	?	« un valore che per troppo tempo abbiamo lasciato in mano alla destra » , dice il	quasi-segretario	della quercia , che sottolinea l' esigenza di coniugare quella bandiera dimenticata con la « liberalizzazione » , « che
ITWAC	quasi	visione	?	?	questo la temporalità dell' azione assomiglia alla temporalità della musica , dove l' esistente e il quasi-inesistente coincidono nella «	quasi-visione	» che preannuncia un mondo nuovo ( ib .
ITWAC	quasi	risse	?	?	cavaliere suscita un entusiasmo quasi smodato , fa gridare di gioia centinaia , migliaia di persone , provoca semi-svenimenti ,	quasi-risse	e l' isolamento totale dei pochi contestatori , uno dei quali vestito da coniglio , con una maglietta con su
ITWAC	quasi	indirizzo	?	?	traina esponeva nomecognome	quasi-indirizzo	, è probabile sia stato ' colpito ' nel quotidiano ; ad altri capitano ( solo ) commenti pesanti ,
ITWAC	quasi	sponsorizzazione	?	?	significherebbe una	quasi-sponsorizzazione	.
ITWAC	quasi	partito	Qualification or Set of Circumstances	?	o magari un	quasi-partito	, dove regnano le regole della delega e della personalizzazione .
ITWAC	quasi	invisibilità	?	?	innegabile maestria a uno schema narrativo che cominciamo a conoscere : mistero , minaccia ( soprannaturale o meno ) ,	quasi-invisibilità	della minaccia , rivelazione finale .
ITWAC	quasi	equilibrio	?	?	il campo coltivato , o agroecosistema , è simile ad un ecosistema giovane , con un equilibrio o	quasi-equilibrio	biologico precario e , per di più , le specie botaniche che lo popolano , al contrario delle pionieristiche ,
ITWAC	quasi	musical	?	?	questione sono essenzialmente due : gli interpreti e la lingua , declinata nelle canzoni ballate che fanno del film un	quasi-musical	.
ITWAC	quasi	gol	?	?	carosio , radiocronista della preistoria , inventava letteralmente le azioni , gridava al "	quasi-gol	!
ITWAC	quasi	genero	?	?	ora , io sono figlio di contadini ( veneti ) e	quasi-genero	di altri contadini ( olandesi ) , ma storie di sbudellamenti non ne ho mai sentite .
ITWAC	quasi	suicidio	Event	?	6.9.03 ( esame di pianoforte ) , 12.9.03 lights go out , stars come down , 28.9.03 cronaca di un	quasi-suicidio	informatico , 11.10.03 quella sporca dozzina , 31.12.03 stati dissociativi cronici , 9.1.04 la nevicata nel pineto , 26.1.04 metti
ITWAC	quasi	inattività	?	?	00:59 consiglia questo post martedì , gennaio 13 , 2004 e allora un bel giorno , dopo un anno di	quasi-inattività	, ti ritrovi a prepararti per il solito colloquio di lavoro .
ITWAC	quasi	stato	?	?	si chiese ai palestinesi di firmare un accordo finale imperniato sulla promessa di un	quasi-stato	diviso in quattro regioni separate , accerchiate da blocchi di colonie .
ITWAC	quasi	laureato	Qualification or Set of Circumstances	?	in verità le esperienze sudamericane del	quasi-laureato	in medicina guevara sono da inquadrarsi fuori da ogni schema politico , e il film riesce a visualizzare benissimo quest'
ITWAC	quasi	povertà	?	?	ignorate la roba hip hip hurra militare e ricordate che questo è denaro che aiuterà queste famiglie che vivono in	quasi-povertà	) .
ITWAC	quasi	consenso	?	?	dietro il	quasi-consenso	di ieri , si nasconde in realtà una polemica non innocente .
ITWAC	quasi	chiusura	?	?	19 ) chiusura e	quasi-chiusura	( fig .
ITWAC	quasi	mercato	Qualification or Set of Circumstances	?	- è disegnato sulle regole del cosiddetto " mercato " o , come è stato brillantemente definito , di "	quasi-mercato	" della sanità .
ITWAC	quasi	legalizzazione	?	?	" l' olanda ha un suo sistema di	quasi-legalizzazione	delle droghe leggere .
ITWAC	quasi	perfezione	?	?	scott rosenberg , che firma lo script , non ha mai più ritrovato la	quasi-perfezione	della sceneggiatura di cosa fare a denver quando sei morto , anche se generazione perfetta non fa così schifo come
ITWAC	quasi	apache	?	?	sanno esserlo i calabresi ) oliverio gentile ( detto " oli " ) per la gestione del server ; il	quasi-apache	giovanni casapulla ( detto " pulla " ) per la gestione della tecnologia e dell' interconnessione a internet .
ITWAC	quasi	sindaco	Role	?	vice-sindaco ,	quasi-sindaco	, sindaco in pectore , quasi-candidato a sindaco , ora collega di siniscalchi , cioè deputato .
ITWAC	quasi	morte	Qualification or Set of Circumstances	?	tod , cioè quasi morte , e in questo libro , se mai sarà scritto , c' entra moltissimo la	quasi-morte	.
ITWAC	quasi	ladro	Job or Career	?	il	quasi-ladro	, del quale non è stata rivelata l' identità secondo le leggi norvegesi sulla privacy , ha riempito il serbatoio
ITWAC	quasi	destra	?	?	il collegio di ischia ha un elettorato molto molto di destra ; quindi , si doveva candidare un uomo di	quasi-destra	( tremendo : ma la gad non era il centrosinistra ?? ) .
ITWAC	quasi	delitti	Event	?	, anzitutto che , contrariamente a quanto sostenuto dalla sentenza impugnata , la nozione di " materia di delitti o	quasi-delitti	" di cui all' art. 5 , n. 3 , della convenzione di bruxelles 27 settembre 1968 va considerata come
ITWAC	quasi	sposi	Kinship	?	le due figure più significative , anche se + marginali rispetto alla coppia di	quasi-sposi	, sono il prete che li sposerà e la tata , che ipoteticamente verrà presa a servizio x curare il
ITWAC	quasi	sordi	?	?	( e qui si potrebbe proseguire ad oltranza in questo dialogo tra	quasi-sordi	sulle sorti della scuola italiana ...
ITWAC	quasi	potenza	?	?	questo le conferisce uno status di	quasi-potenza	nucleare che rende molto più difficili i calcoli per un intervento militare .
ITWAC	quasi	collisione	?	?	ricorrenti disastri ; in particolare venere era una cometa ( frammento staccatosi da giove ) che in seguito a una	quasi-collisione	perdette la coda e si stabilizzò nell' attuale orbita .
ITWAC	quasi	stato	?	?	la creazione nel 1994 dell' autorità palestinese , il	quasi-stato	musulmano diretto da yassser arafat , è una catastrofe : delle persecuzioni continue conducono alla partenza dei ¾ della comunità
ITWAC	quasi	città	Qualification or Set of Circumstances	?	e sta costringendo i " capoluoghi " a fare i conti con " piccoli comuni intorno " , quartieri divenuti	quasi-città	, cittadine borderline che hanno acquistato peso e rilievo in una geoeconomia inedita , a scala di macroregioni e globale
ITWAC	quasi	infortuni	?	?	- analisi delle cause ; chiarire le cause degli infortuni e dei	quasi-infortuni	.
ITWAC	quasi	infortuni	?	?	- concorsi ; premiare i suggerimenti di miglioramento , incentivare la notifica dei	quasi-infortuni	e dei guasti avvenuti in azienda .
ITWAC	quasi	ottica	?	?	di 94 , 225 e 345 ghz , usando sia una configurazione in guida d' onda che una struttura aperta	quasi-ottica	su antenna planare .
ITWAC	quasi	logica	?	?	non solo , ma io ho detto che la derivazione della vita dalle leggi fisiche è	quasi-logica	; per es. , dipende in modo cruciale dalle abbondanze dei relativi elementi .
ITWAC	quasi	logica	?	?	non avendo né volontà né coscienza , non interviene nel mondo ; quindi : come conseguenza	quasi-logica	delle leggi .
ITWAC	quasi	fallimento	?	?	soprattutto mi sono indignato per il motivo del fallimento ( o	quasi-fallimento	) , cioè non gli ascolti ma le pubblicità negate ad un' emittente che ha la parola gay nel nome
ITWAC	quasi	cittadini	Qualification or Set of Circumstances	?	ciò non porta al blocco o all' impedimento del flusso migratorio , ma a rendere i migranti dei	quasi-cittadini	, sempre ricattabili , privi di diritti , precari per eccellenza .
ITWAC	quasi	terra	?	?	l' utilizzo delle sc ha infatti permesso di fare le famosissime ripresa ad altezza	quasi-terra	che sarebbero risultate impossibili o quasi con un altro tipo di sttrezzatura .
ITWAC	quasi	mercati	Qualification or Set of Circumstances	?	quote di ingresso , sistemi di cofinanziamento , autonomia di budget , regolazione attraverso processi di e-government , creazione di	quasi-mercati	...
ITWAC	quasi	domicilio	Qualification or Set of Circumstances	?	, lo stesso diritto di elezione può essere conferito ad altri sacerdoti che abbiano nella diocesi il domicilio o il	quasi-domicilio	.
ITWAC	quasi	morte	Qualification or Set of Circumstances	?	solito , racconto di sf ; il protagonista , l' autore , vive varie esperienze di non-morte , o di	quasi-morte	, assistito da jack kevornian , " ...
ITWAC	quasi	contatto	?	?	infatti , la forza esercitata dalla pressione aumenta se aumenta l' area di	quasi-contatto	( cioè il numero di bollicine ) , mentre una superficie liscia presenta solo piccoli avvallamenti , garantendo bollicine piccole
ITWAC	quasi	morte	Qualification or Set of Circumstances	?	mila ed oa e coloro che scelgono di ascendere hanno avuto un tale difficile periodo e così tante esperienze di	quasi-morte	: essi erano sotto i colpi dei falsi dei bianchi e rossi : tuttavia questo tempo sta per finire grazie
ITWAC	quasi	ontologia	?	?	da qui il giudizio positivo sulla	quasi-ontologia	dell' impostazione di maffettone , che è uno dei modi per misurarsi con la linea emergente della pura forza ,
ITWAC	quasi	perfezione	?	?	rispettono ( le persone si temono , quindi si rispettano ) con l' essere umano elogiato al massimo della sua	quasi-perfezione	...
ITWAC	quasi	perfezione	?	?	rispettono ( le persone si temono , quindi si rispettano ) con l' essere umano elogiato al massimo della sua	quasi-perfezione	ma sarebbe un mondo in cui io , piú forte , posso uccidere x , piú debole .
ITWAC	quasi	umanità	Qualification or Set of Circumstances	?	esiste una	quasi-umanità	a sinistra ( e anche al centro ) per denunciare i danni di una mondializzazione liberale , se non addirittura
ITWAC	quasi	domicilio	Qualification or Set of Circumstances	?	convocazione poi , quando deve essere personale , ha valore , se viene fatta nel luogo del domicilio o del	quasi-domicilio	oppure nel luogo di dimora .
ITWAC	quasi	domicilio	Qualification or Set of Circumstances	?	nella parrocchia in cui l \ ' una o l \ ' altra parte contraente ha il domicilio o il	quasi-domicilio	o la dimora protratta per un mese , oppure , se si tratta di girovaghi , nella parrocchia in cui
ITWAC	quasi	universalità	?	?	le convenzioni di ginevra , con 190 ratifiche , hanno raggiunto una sostanziale universalità e una	quasi-universalità	hanno raggiunto i protocolli aggiuntivi : il protocollo i ha varcato la soglia delle 160 ratifiche e poco meno sono
ITWAC	quasi	balla	?	?	di : massimo _ 65 il sabato 26 febbraio 2005 , 17:11 ed ora , passiamo alla balla ( o	quasi-balla	, o balla per via della strumentalizzazione ) dell' avviso di napoli .
ITWAC	quasi	esordiente	?	?	due le novità nella formazione veneta : fuori zanchetta e luciano , dentro sammarco ( e il	quasi-esordiente	- aveva giocato in a per soli 5 ' - ha mostrato grande personalità ) e mensah , con pellissier
ITWAC	quasi	collisione	?	?	dovendosi escludere la collisione in volo , già rigettata , si potrebbe pensare ad una ipotesi di "	quasi-collisione	" .
ITWAC	quasi	collisione	?	?	l' analisi è quindi passata a verificare se i fenomeni di interferenza per	quasi-collisione	possano provocare la rottura dell' estremità alare .
ITWAC	quasi	collisione	?	?	- l' ipotesi di esplosione interna è stata considerata come " tecnicamente sostenibile " ; - l' ipotesi di "	quasi-collisione	" è rigettata .
ITWAC	quasi	signori	?	?	localmente , i comandanti di regione sono considerati dei	quasi-signori	della guerra .
ITWAC	quasi	città	Qualification or Set of Circumstances	?	è un luogo feroce , geloso , vendicativo come sanno esserlo le	quasi-città	, come ce ne sono molte , e la provincia .
ITWAC	quasi	cittadini	Qualification or Set of Circumstances	?	essere molto allontanata dalla vera realtà delle cose : chi descrive la cronaca quotidiana di alcune decine di migliaia di	quasi-cittadini	di provincia ha a che fare con criminali di piccolo cabotaggio , presidenti di associazioni sportive , gestori di ristoranti
ITWAC	quasi	città	Qualification or Set of Circumstances	?	la	quasi-città	sopravvive , si accontenta di essere viva , non avendo nessun altro scopo , così , se non morire .
ITWAC	quasi	città	Qualification or Set of Circumstances	?	per qualche tempo , che esistesse chi avesse voglia di partecipare a una sorta di grande seduta di autoanalisi della	quasi-città	, così mi ero inventato il ruolo di una sorta di testimone dell' identità di sanguineto , con i miei
ITWAC	quasi	città	Qualification or Set of Circumstances	?	ma una	quasi-città	non è capace di autodefinirsi , né di capirsi .
ITWAC	quasi	città	Qualification or Set of Circumstances	?	ogni modo , i pochi che avrebbero qualche parola decente da proporre tacciono o si rifugiano nell' ombra , nella	quasi-città	, dove dominano le parole mal pronunciate .
ITWAC	quasi	campioni	Rank	?	per adesso sta nella categoria dei	quasi-campioni	delle corse a tappe .
ITWAC	quasi	satelliti	Qualification or Set of Circumstances	?	per contro , i	quasi-satelliti	offendono qualunque regola di decentramento pianificato : sono , in primo luogo , residenziali , e sono troppo vicini .
ITWAC	quasi	ibernazione	?	?	e' il primo meganoide creato dal dottor haran , ma ora si trova in un perenne stato di	quasi-ibernazione	, in quanto solo la sua mente sembra operare funzionalmente .
ITWAC	quasi	mercato	Qualification or Set of Circumstances	?	si è così costituito un	quasi-mercato	, in cui diversi erogatori competono per attrarre l' utente .
ITWAC	quasi	caos	?	?	via di scampo dal falso dilemma tra il " rapporto autoritario " ( della scuola tradizionale ) e il "	quasi-caos	dello spontaneismo per reazione " ( della contestazione anarchica ) .
ITWAC	quasi	caos	?	?	via di scampo dal falso dilemma tra il " rapporto autoritario " ( della scuola tradizionale ) e il "	quasi-caos	dello spontaneismo per reazione " ( della contestazione anarchica ) .
