REPUBBLICA	quasi	sospensione	?	?	ma nessuno si aspettava che fin da lunedì , giorno della ripresa del negoziato , si sarebbe giunti alla sua	quasi-sospensione	.
REPUBBLICA	quasi	zero	?	?	maniera sostanziale il rapporto esistente tra domanda ed offerta di alloggi e che soltanto di fronte ad un' offerta "	quasi-zero	" è ipotizzabile una ripresa delle costruzioni .
REPUBBLICA	quasi	ribellione	?	?	di fronte a questa	quasi-ribellione	di ampi settori del partito , il vertice continua a fare quadrato e a rifiutare di ammettere la spaccatura .
REPUBBLICA	quasi	sorella	?	?	zaza , la sua	quasi-sorella	, si lancia nel mondo del cinema .
REPUBBLICA	quasi	monologo	?	?	lui , maurizio micheli , esce fuori nei tempi lunghi , sviluppa il suo	quasi-monologo	infossando spesso le mani in tasca , gonfiando e sgonfiando le generose mandibole , accentuando la sua fisionomia pulita ,
REPUBBLICA	quasi	morta	Qualification or Set of Circumstances	?	, oltre che claustrofobo e guardone , intasca da bravo feticista le mutandine dell' amata e finisce abbracciato a una	quasi-morta	come un necrofilo .
REPUBBLICA	quasi	zero	?	?	a questo "	quasi-zero	" le case editrici tentano di reagire come possono .
REPUBBLICA	quasi	ristoranti	?	?	dagli sterminati impianti delle mega industrie ai piccoli privilegiatissimi	quasi-ristoranti	, ad esempio , della camera e del senato , dove il menu è stampato su cartoncino e camerieri servono
REPUBBLICA	quasi	moneta	?	?	confronto scaturisce l' ovvia conclusione che il tesoro è disposto a pagare un tasso reale dell' interesse sulla moneta e	quasi-moneta	tra i 5 e i 6 punti percentuali .
REPUBBLICA	quasi	intellettuali	?	?	sta diventando presuntuoso , cerca di spendere tutta la sua fama tra i	quasi-intellettuali	.
REPUBBLICA	quasi	marginalità	?	?	perentorie e un po' spiritate , non si rendono ben conto , come il papa , della perifericità , della	quasi-marginalità	, della chiesa italiana , di fronte al peso crescente , vincente e dirompente delle chiese latino-americane ed africane .
REPUBBLICA	quasi	fattorino	?	?	trentotto anni , funzionario del psi , una lunga trafila nel partito ( da	quasi-fattorino	di teardo fino alla carica di segretario ) bordero ha deciso di differenziar- si dal " capo " .
REPUBBLICA	quasi	recessione	?	?	per cento , o addirittura registrare la prima contrazione trimestrale dal 1982 ; " il settore manifatturiero è in una	quasi-recessione	" ha dichiarato david hale , un analista della kemper economic services , " e il pnl sarà probabilmente ridotto
REPUBBLICA	quasi	congresso	?	?	roma -- ed eccoci al	quasi-congresso	comunista .
REPUBBLICA	quasi	avanguardia	movimento culturale/politico	?	cinema di grande pubblico ( come la diva smita patil ) si prestano volentieri ad interpretare films impegnati o di	quasi-avanguardia	.
REPUBBLICA	quasi	segretario	Role	?	il primo segretario che se ne va senza che nessuno glielo abbia chiesto ( zanone ) , ecco il primo	quasi-segretario	che rifiuta la carica perché ha di meglio da fare .
REPUBBLICA	quasi	verifica	?	?	" vedrete che ogni cosa andrà per il meglio " assicura ) ma a complicare le cose è arrivata la	quasi-verifica	.
REPUBBLICA	quasi	moneta	?	?	cento previsto su base annua al 15 per cento attuale ( 18 se si tiene conto di alcune forme di	quasi-moneta	) ; il disavanzo di parte corrente nei conti con l' estero si è più che raddoppiato sia rispetto al
REPUBBLICA	quasi	pro	?	?	scendono in campo arbasino ( contro : " abuso delle rovine " ) e placido (	quasi-pro	: " il superfluo è necessario ma non sufficientemente " ) .
REPUBBLICA	quasi	moneta	?	?	è però neanche coerenza nel fatto che lo stato paghi sui bot e cct , ossia su queste forme di	quasi-moneta	, un rendimento reale positivo , in quanto all' economia produttiva giunge un segnale sbagliato : si premia il rèntier
REPUBBLICA	quasi	miracolo	?	?	maggioranza comunale : mostro , s' intende , alla latina , nel senso di prodigio , di portento , di	quasi-miracolo	.
REPUBBLICA	quasi	embargo	?	?	lo stesso de clercq ha definito " un	quasi-embargo	" le misure sulla pasta che colpiscono " duramente " l' industria italiana .
REPUBBLICA	quasi	embargo	?	?	la contro rappresaglia di bruxelles , dopo il "	quasi-embargo	" americano sulla posta , è dunque immediata .
REPUBBLICA	quasi	ottimista	?	?	invece qui , messo di fronte al campo dei suoi fagioli , ajello risulta , curiosamente , un	quasi-ottimista	.
REPUBBLICA	quasi	raddoppio	?	?	anche tenendo conto dell' inflazione , si tratta pur sempre di un	quasi-raddoppio	del capitale iniziale .
REPUBBLICA	quasi	broadway	?	?	al promenade theater ( appena una trentina di isolati off-broadway ) , e fool for love al plaza ( un	quasi-broadway	cinematografico che rende perfettamente il " tutto in famiglia " ) .
REPUBBLICA	quasi	capitale	Qualification or Set of Circumstances	?	i lineamenti della	quasi-capitale	che fu questa città nei secoli in cui si chiamò col suo nome moresco , castrogiovanni , prima che mussolini
REPUBBLICA	quasi	riconoscimento	Process	?	yasser arafat ( nel 1979 ) sia il colonnello gheddafi ( nel 1982 ) e aveva accordato all' olp un	quasi-riconoscimento	diplomatico .
REPUBBLICA	quasi	denuncia	?	?	per il momento si sa soltanto che tutto è nato da un esposto , una	quasi-denuncia	nella quale un " organo ufficiale " ( non si sa quale , ma potrebbe essere un ordine professionale che
REPUBBLICA	quasi	nulla	?	?	filosofo vladimir jankèlèvitch , la musica è " una bolla di sapone iridescente " , qualcosa di irrisorio , un	quasi-nulla	.
REPUBBLICA	quasi	nulla	?	?	il suo libro chiave è quello del 1957 , dal titolo così personale e bizzarro : il non-so-che e il	quasi-nulla	.
REPUBBLICA	quasi	nulla	?	?	la musica , nel suo pudore , nel suo ritrar- si , nel suo essere	quasi-nulla	, " accompagna " la nostra felicità .
REPUBBLICA	quasi	nulla	?	?	l' amore e la morte non sono forse dei	quasi-nulla	?
REPUBBLICA	quasi	bianca	?	?	lasciato solo sotto le scale dell' aereo ; e il suo altro status-symbol , la sua bellissima moglie , la	quasi-bianca	michele , rappresentante del potere della classe dirigente mulatta , e le cui ambizioni hanno contribuito seriamente alla fine del
REPUBBLICA	quasi	classe	?	?	( " che non coincide con nessuna classe sociale , anche se la maggioranza dei suoi membri proviene da quella	quasi-classe	denominata piccola borghesia " ) diminuisce il peso politico proprio delle classi sociali .
REPUBBLICA	quasi	ombre	?	?	fantasmagorico " ( questa parola ricavata da marx è una chiave per benjamin ) ; e allora un mondo di	quasi-ombre	riappare : il flneur , la noia , il collezionista , gli specchi , il gioco , la prostituzione ,
REPUBBLICA	quasi	lettore	?	?	il	quasi-lettore	si immerge nella quasi-lettura e come un cavaliere antico deve scegliere se ammazzare i nemici con questa o con quell'
REPUBBLICA	quasi	lettura	?	?	il quasi-lettore si immerge nella	quasi-lettura	e come un cavaliere antico deve scegliere se ammazzare i nemici con questa o con quell' arma : se sceglie
REPUBBLICA	quasi	favorita	?	?	l' incredibile successione di risultati positivi ed ai mondiali si era presentata come una delle più forti outsiders , una	quasi-favorita	perfino nei pronostici di bearzot .
REPUBBLICA	quasi	plebiscito	?	?	un conto è raccogliere un	quasi-plebiscito	su una somma di rivendicazioni , tutt ' altra questione è far- si approvare una bozza di contratto a cui
REPUBBLICA	quasi	certezze	?	?	del resto il psi non faceva mistero delle sue aspettative ed anzi delle sue	quasi-certezze	: tre anni di stabilità politica a roma sotto la guida d' un presidente del consiglio indubbiamente dotato sia d'
REPUBBLICA	quasi	addio	?	?	a chi gli chiede se questo suo	quasi-addio	a pesaro sia da interpretare come un quasi-arrivederci a venezia ( dove , come si sa , il mandato di
REPUBBLICA	quasi	fallimento	?	?	la prima missione può dunque considerar- si un	quasi-fallimento	.
REPUBBLICA	quasi	vertice	?	?	ma la prima giornata di questo	quasi-vertice	si chiude con l' impressione di un vero e proprio negoziato in piedi , serrato e centrato su tutta la
REPUBBLICA	quasi	certezza	?	?	la	quasi-certezza	è che vicini stia proponendo , alla nazionale italiana , un modello molto meno autarchico che in passato , diciamo
REPUBBLICA	quasi	sindaco	Role	?	sì , perché paolo pillitteri ,	quasi-sindaco	di milano , avrebbe avuto una funzione preziosa : quella del cacio sui maccheroni .
REPUBBLICA	quasi	sindaco	Role	?	un detto che rivela altre due doti del	quasi-sindaco	di milano : intelligenza e filosofia .
REPUBBLICA	quasi	occasioni	?	?	la partita è un collage di	quasi-occasioni	: a vedere certi salvataggi in affanno dei belgi , certi traversoni mancati di un soffio , l' assenza di
REPUBBLICA	quasi	espressioni	?	?	scrivo indugiando sulle parole come davanti a vetrine che non vedo , e sono mezzi-sensi ,	quasi-espressioni	ciò che mi resta : come colori di stoffe che non ho decifrato , armonie esibite composte da chissà quali
REPUBBLICA	quasi	western	?	?	ampliare la gamma dei suoi personaggi passando da arsenico e vecchi merletti all' " impegnato " il ribelle , dal	quasi-western	quelli della virginia ( ma egli è forse il solo grande attore di hollywood che non ha mai fatto un
REPUBBLICA	quasi	sindaco	Role	?	e rimbomba dentro le nostre orecchie grazie alle interviste da	quasi-sindaco	che pilli spara a ripetizione .
REPUBBLICA	quasi	bianchi	?	?	sì , io penso che in sudafrica ci sono cinque milioni di albini come me , di	quasi-bianchi	, e venticinque milioni di terroristi potenziali .
REPUBBLICA	quasi	certezze	?	?	certo , la smentita diffusa in mattinata dal ministero delle finanze francese insinuava più di un dubbio nelle	quasi-certezze	di mercoledì , ma la speculazioni sulla possibile riunione del g - 5 riprendevano vigore nel pomeriggio .
REPUBBLICA	quasi	solidarietà	?	?	francia , e ora è stato arrestato per tentata rapina : intorno a costui si è creato un movimento di	quasi-solidarietà	al quale non è estraneo lo stesso ministro degli interni peretz ( il quale rifiuta l' estradizione ) , quasi
REPUBBLICA	quasi	morti	Qualification or Set of Circumstances	?	un morto ( tra l' altro si chiama carlo nobodi , cioè nessuno ) e visita in realtà degli altri	quasi-morti	, che hanno per tomba provvisoria ( con tanto di iscrizione ) la loro casa , il loro ufficio ,
REPUBBLICA	quasi	romanzo	?	?	le confesserò che il primo dell' anno ho letto un romanzo di chandler , omaggio di soavi-olivetti , poi un	quasi-romanzo	di mario borsa in riedizione anastatica ( " la cascina sul po " ) , infine l' ultima parte di
REPUBBLICA	quasi	monopoli	grado	?	attuali essendo 32 ) , presumibilmente in maniera tale da render- le competitive , vale a dire spezzando gli eventuali	quasi-monopoli	democristiano ( come in veneto ) e comunista ( come in emilia-romagna ) e quindi procedendo ad un grande e
REPUBBLICA	quasi	crisi	?	?	roma un po' annebbiato dalla	quasi-crisi	in atto che dirotta attenzione e presenze di grido , al secondo giorno il congresso radicale annega sotto un diluvio
REPUBBLICA	quasi	derby	?	?	coppe , mentre oggi , in tivù ( ore 18,05 ) cantù cerca di tener- si il primato in un	quasi-derby	contro brescia .
REPUBBLICA	quasi	intese	?	?	è una novità rispetto alle	quasi-intese	di reykjavik dove si era parlato solo degli ss - 20 , definiti a raggio intermedio .
REPUBBLICA	quasi	brianzolo	?	?	con la sua voce sommessa e pretesca , le risposte un po' esitanti in	quasi-brianzolo	nasale , i lampi di timidezza dietro le lenti .
REPUBBLICA	quasi	intesa	Qualification or Set of Circumstances	?	più ottimista andreotti sulla possibilità di arrivare a fine legislatura riannodando i fili d' una	quasi-intesa	mancata ( sull' accordo politico per i referendum ) alla vigilia del congresso socialista .
REPUBBLICA	quasi	alleato	Qualification or Set of Circumstances	?	e il quasi-compaesano del professore spara deciso il suo giudizio sul	quasi-alleato	craxi bettino : se i socialisti non votano la fiducia a fanfani , sono degli autolesionisti rincoglioniti !
REPUBBLICA	quasi	eroe	?	?	da	quasi-eroe	e quasi-eletto del popolo , il corsini finisce in galera ; nella , da ragazza in fiore , finisce ludibrio
REPUBBLICA	quasi	eletto	Qualification or Set of Circumstances	?	da quasi-eroe e	quasi-eletto	del popolo , il corsini finisce in galera ; nella , da ragazza in fiore , finisce ludibrio dei fascisti
REPUBBLICA	quasi	ammiraglia	?	?	entro il prossimo settembre , novità sicure per un' altra	quasi-ammiraglia	tedesca , quella bmw serie 3 che sui mercati europei è la più seria concorrente delle nuove audi 80 e
REPUBBLICA	quasi	cicciolina	?	?	adagio , sarebbe eccessivo chiamar- la la	quasi-cicciolina	di de mita , essendo silvia davvero leopardiana , seria e fatta-in-casa .
REPUBBLICA	quasi	presidente	Role	?	insomma , è un	quasi-presidente	.
REPUBBLICA	quasi	documentario	?	?	meno lontanamente ispirati al teatro , da mt 2 mammane premiato lo scorso anno a la prèsence reèlle , un	quasi-documentario	sul festival di avignone a mèmoire des apparences , un film più o meno vagamente imparentato con la vita è
REPUBBLICA	quasi	giallo	?	?	beh , a firenze , in cambio d' una preferenza , lagorio regala due dentro ad un fuoco , un	quasi-giallo	storico dominato dal quesito : gramsci era socialista come turati ?
REPUBBLICA	quasi	monopolio	grado	?	se dunque in passato c' è stata una limatura abbondante della quota di fiat in italia rispetto agli anni del	quasi-monopolio	, contemporaneamente si è assistito a una costante crescita delle sue vendite all' estero e a un conseguente aumento del
REPUBBLICA	quasi	biografia	?	?	marcel detienne ha scritto una	quasi-biografia	di dioniso , il dio dal quale l' uomo impara a conoscere se stesso marcel detienne ha scritto una quasi-biografia
REPUBBLICA	quasi	biografia	?	?	quasi-biografia di dioniso , il dio dal quale l' uomo impara a conoscere se stesso marcel detienne ha scritto una	quasi-biografia	di dioniso , il dio dal quale l' uomo impara a conoscere se stesso .
REPUBBLICA	quasi	destra	?	?	riferisco a gianni baget bozzo ( repubblica di martedì scorso ) , passato dalla sinistra quasi-integrista del partito cristiano alla	quasi-destra	, senz' altro integrista , della chiesa appena pre-conciliare ed appena post-conciliare , per passare poi , all' estrema sinistra
REPUBBLICA	quasi	bancarotta	?	?	appena dopo la conferenza stampa , il ministero ha ordinato un' inchiesta per accertare eventuali responsabilità penali nella	quasi-bancarotta	dell' azienda chimica .
REPUBBLICA	quasi	giovane	Qualification or Set of Circumstances	?	l' esperienza dei ciellini va al microfono un	quasi-giovane	con forte accento meridionale .
REPUBBLICA	quasi	vertice	?	?	un	quasi-vertice	in cui il presidente mario schimberni ( di ritorno da londra dove ha parlato della globalizzazione dei mercati ) e
REPUBBLICA	quasi	consuntivo	?	?	tabellina allegata al documento mette a confronto le previsioni 1987 , formulate nell' ottobre dell' anno scorso , ed il	quasi-consuntivo	di oggi .
REPUBBLICA	quasi	tabù	?	?	quando fu operata betty ford , tredici anni fa , il cancro al seno era ancora un	quasi-tabù	: il modo in cui l' allora first lady parlò pubblicamente della malattia spinse milioni di americane a far- si
REPUBBLICA	quasi	reattore	?	?	iter , per alcuni dei contraenti , ad esempio i giapponesi , doveva già configurar- si come un	quasi-reattore	.
REPUBBLICA	quasi	normalità	?	?	la eloquente cronaca della giornata di ieri comincia con un annuncio che faceva sperare in un ritorno alla	quasi-normalità	: poco dopo mezzogiorno le segreterie nazionali delle federazioni trasporti della cgil , cisl e uil comunicavano , dopo una
REPUBBLICA	quasi	scisma	?	?	ma arriva , la principessa ninì pallavicini , avversaria storica di isabelle colonna , sua grande rivale nel capeggiare il	quasi-scisma	del vescovo lefebvre .
REPUBBLICA	quasi	crisi	?	?	le ore di questa	quasi-crisi	di programma , un piede dentro e uno fuori dal governo di programma , in attesa d' un vertice di
REPUBBLICA	quasi	congresso	?	?	e questo conferma che la riunione del parlamentino comunista sarà , come ormai molti sostengono , un	quasi-congresso	.
REPUBBLICA	quasi	blocco	Qualification or Set of Circumstances	?	in pratica , un	quasi-blocco	salariale per i prossimi tre anni .
REPUBBLICA	quasi	benessere	?	?	ma la vera stangata reaganiana si abbatterà sull' ungheria usa al più vistoso	quasi-benessere	del mondo socialista .
REPUBBLICA	quasi	crisi	?	?	, tra gli uomini del garofano ( che sorvolano sul tradizionale assenteismo d' aula socialista ) sulla paternità dc della	quasi-crisi	.
REPUBBLICA	quasi	crisi	?	?	nel lungo colloquio s' è parlato della recente	quasi-crisi	, delle insoddisfazioni di alcuni gruppi interni alla dc e del loro possibile ruolo nel voto che ha portato il
REPUBBLICA	quasi	narratrice	?	?	giuliana mastrangeli , giornalista e	quasi-narratrice	al debutto , ha qualche volta la tentazione di provar- si a tracciare un suo personale de l' amour ,
REPUBBLICA	quasi	liberal	?	?	è il ritratto di una nancy reagan	quasi-liberal	, delineato da uno dei suoi ex migliori amici michael deaver , in un libro di prossima pubblicazione behind the
REPUBBLICA	quasi	incidente	?	?	il	quasi-incidente	dell' altro ieri è avvenuto sopra la contea inglese dell' essex quando un 727 della compagnia americana pan-am in volo
REPUBBLICA	quasi	riabilitazione	?	?	pochi giorni dopo la	quasi-riabilitazione	del '68 polacco ( un anniversario scomodo che s' avvicina , perché cade l' 8 marzo ) , il generale
REPUBBLICA	quasi	ragazzini	?	?	dietro il braccio destro di bubka , gataullin che vince l' asta a 5,75 ci sono	quasi-ragazzini	come il bulgaro nikolov ( 23 anni , 5,70 ) o i francesi della scuola del racing paris di maurice
REPUBBLICA	quasi	scomparsa	?	?	motown alla epic , le prime produzioni in proprio ( destiny e " bless his soul " ) , la	quasi-scomparsa	dei fratelli e l' affermazione di michael , il film the wiz , l' album off the wall , seguito
REPUBBLICA	quasi	doppione	?	?	non risponde ai fini istituzionali dell' eni ( che è un ente prevalentemente energetico ) , ma rappresenta anche un	quasi-doppione	di quella delle società del gruppo iri impegnate nel settore delle costruzioni e delle infrastrutture .
REPUBBLICA	quasi	governo	Qualification or Set of Circumstances	?	è lo spaccato di una socità cresciuta questo piccolo	quasi-governo	ombra tollerato dal potere .
REPUBBLICA	quasi	paradosso	?	?	questa nuova flessibilità di mosca ha portato a un	quasi-paradosso	: cacciata dalla portamediorientale da 15 anni ( i suoi consiglieri furono espulsi dall' egitto nel 1973 ) , l'
REPUBBLICA	quasi	ricchi	Qualification or Set of Circumstances	?	litorale calabrese : caseggiati selvaggi , palazzine incompiute , cantieri continui e spesso abbandonati , periferie sconcertanti , bidonvilles per	quasi-ricchi	.
REPUBBLICA	quasi	rassegnazione	?	?	ma anche il maestro carosone , alla vigilia , aveva confessato la sua	quasi-rassegnazione	a non imporre più nuove canzoni .
REPUBBLICA	quasi	professori	?	?	cosa vogliono i	quasi-professori	universitari ?
REPUBBLICA	quasi	angelo	Qualification or Set of Circumstances	?	mago dei meccanismi della visione eccolo appendere per i piedi un	quasi-angelo	al soffitto e porre a terra i frammenti fotografici della sua immagine .
REPUBBLICA	quasi	holding	?	?	eppure motivi per essere allegro l' uomo che è a capo di una	quasi-holding	che fattura 28 mila miliardi non ne ha davvero molti .
REPUBBLICA	quasi	ferrovieri	?	?	la validità della riforma è stata vincolata al blocco dei licenziamenti : i 215.000 o 220.000 ferrovieri , più i	quasi-ferrovieri	dei servizi annessi , non possono essere licenziati .
REPUBBLICA	quasi	tg	?	?	chiude l' annata dimezzando invece i suoi appuntamenti quotidiani dentro la notizia , il	quasi-tg	che ha debuttato con grande clamore , ma senza diretta , sulle reti di berlusconi .
REPUBBLICA	quasi	occasioni	?	?	il napoli crea tre	quasi-occasioni	.
REPUBBLICA	quasi	successo	?	?	92 - 88 per il maccabi , lo scarto sembrerebbe un	quasi-successo	, ma la sensazione che la vittoria era appena mezzo metro più in là lascia qualche rimpianto .
REPUBBLICA	quasi	inventore	?	?	l' 87 per cento dei clienti , urlava preston thomas tucker , quasi-industriale ,	quasi-inventore	, quasi-genio , al suo ristretto quanto affiatato clan , vuole un' auto nuova , tutta nuova , non questi
REPUBBLICA	quasi	genio	?	?	l' 87 per cento dei clienti , urlava preston thomas tucker , quasi-industriale , quasi-inventore ,	quasi-genio	, al suo ristretto quanto affiatato clan , vuole un' auto nuova , tutta nuova , non questi bidoni d'
REPUBBLICA	quasi	industriale	?	?	d' altra parte per i tre big , in quel lontano 1947 , i problemi non arrivavano certo dal	quasi-industriale	di chicago .
REPUBBLICA	quasi	pivot	?	?	la novità è il premier	quasi-pivot	, comunque rigenerato .
REPUBBLICA	quasi	velo	?	?	di struzzo per una femme fatale consacrata al lusso , e anche sexy , come quando indossa il vestito di	quasi-velo	che si solleva e si gonfia con studiata facilità .
REPUBBLICA	quasi	decalogo	?	?	il	quasi-decalogo	di bush è andato a ruba .
REPUBBLICA	quasi	lager	?	?	dato modo ai democristiani di ammantare di virginale ideologia il trasferimento di tutti i postriboli fuori città , in un	quasi-lager	.
REPUBBLICA	quasi	uomini	Qualification or Set of Circumstances	?	dichiara che tutti quei sapientoni intenti a manipolare con cura e con amore le ossa di uomini , o di	quasi-uomini	scomparsi , somigliano non a un gruppo di antropologi in un laboratorio , ma a teologi in una cattedrale ,
REPUBBLICA	quasi	diretta	?	?	la vera novità è nella	quasi-diretta	che il gatto tenta nelle sue serate .
REPUBBLICA	quasi	vittoria	?	?	anzi , dopo la sirena , secondo il tavolo : da cui la prosecuzione al supplementare , la	quasi-vittoria	della philips ( + 8 a meno di 2 ` dalla fine ) , il recupero dell' irge , un
REPUBBLICA	quasi	centenario	?	?	ma , nonostante tutta la sua ironia , non siamo certi che man ray avrebbe apprezzato ciò che questo	quasi-centenario	gli sta offrendo : render- lo protagonista di uno degli ambienti e dei luoghi del pensiero che detestava : i
REPUBBLICA	quasi	diretta	?	?	" azzurro " alla tv in	quasi-diretta	.
REPUBBLICA	quasi	battaglia	?	?	a danzica poi questa	quasi-battaglia	per i meno cattivi tra i nemici ha un significato speciale .
REPUBBLICA	quasi	chic	?	?	sta restaurando le 800 stanze , con mobili finto-antico , quadri semi-veri , e tappezzerie	quasi-chic	.
REPUBBLICA	quasi	crisi	?	?	una	quasi-crisi	con tanto di sospensione della delega all' assessore , richiesta di chiarimenti , mediazioni comuniste , scambio di lettere .
REPUBBLICA	quasi	dimissioni	Event	?	praticamente , delle	quasi-dimissioni	, fino a quando non sarà stato stabilito una volta per tutte , in quali modi , con quali termini
REPUBBLICA	quasi	certezze	?	?	a tarda sera alcune	quasi-certezze	, tutte da verificare nel rush finale verso il quirinale : martelli vicepresidente , amato agli esteri , de michelis
REPUBBLICA	quasi	tregua	?	?	nel polarizzare tutta l' attenzione , l' intervento francese ha già portato a dei risultati : una	quasi-tregua	nei bombardamenti che permette alla popolazione di riprendere un po' il fiato , malgrado le condizioni di vita sempre più
REPUBBLICA	quasi	romanzo	?	?	ora bukowski fa esattamente questo : rinuncia al suo arsenale osceno e blasfemo , e , con un libro	quasi-romanzo	, hollywood ( black sparrow press , pagg. 239 , dollari 20 ) , dimostra che il vagabondo folle ,
REPUBBLICA	quasi	delirio	?	?	e via con un	quasi-delirio	, metà giovambattista marino e metà marinetti : il caos della scrittura per fotografare il caos delle idee , dei
REPUBBLICA	quasi	charlot	?	?	l' altro chaplin è il titolo della retrospettiva , che comprende sei comiche del '14 - 15 , dove il	quasi-charlot	può mettere in mostra , senza l' ingombrante presenza del fratello , le sue qualità di acrobata e clown .
REPUBBLICA	quasi	moneta	?	?	i cittadini , detentori di titoli fin qui spendibili come una	quasi-moneta	e , comunque , coperti dalla garanzia di rimborso alla pari ( più gli interessi ) al momento della scadenza
REPUBBLICA	quasi	libertà	?	?	, uno dei dirigenti del settimanale moskovskie novosti , emerge subito una dei grandi limiti della riforma gorbacioviana : la	quasi-libertà	di cui godono i giornali in urss .
REPUBBLICA	quasi	musical	?	?	nei cartelloni italiani , credo di poter- me oggi concedere il lusso di un musical , che poi è un	quasi-musical	dove non si calcano le strade di webber né quelle di garinei e giovannini in che consiste questo montaggio musicale
REPUBBLICA	quasi	scienza	?	?	, in fondo , non è veramente filosofia : più che altro si tratterebbe di una scienza o di una	quasi-scienza	, affine alla linguistica e alla logica , che ha ben poco a che vedere con i grandi temi della
REPUBBLICA	quasi	fidanzato	Kinship	?	nitida stefania montorsi ) , cui non spiace un' avventura col divo nelle cui vesti si cela invece il suo	quasi-fidanzato	cerciolini , e c' è l' immarcescibile soprintendente , che è il cordiale galeazzo benti già applaudito al sistina niente
REPUBBLICA	quasi	architetto	?	?	di mal di testa , la percentuale è destinata a salire fra gli spettatori di sfilate come quella del debuttante	quasi-architetto	francesco maria bandini , che ha imposto come accompagnamento per abiti a volte riusciti musiche ( e volume ) da
REPUBBLICA	quasi	equilibrio	?	?	la separazione fra spese previdenziali e spese assistenziali -- che l' inps è in grado di presentare una situazione di	quasi-equilibrio	.
REPUBBLICA	quasi	capoluogo	?	?	sessantamila abitanti , un passato nobile , una vivacità politica da	quasi-capoluogo	di provincia : imola nella sua storia ne ha viste tante , ma un sindaco che legge l' omelia no
REPUBBLICA	quasi	partito	Qualification or Set of Circumstances	?	la sigla arci-gay diverrà il sottotitolo della nuova denominazione , più seria e lunga , da	quasi-partito	: movimento per le libertà civili .
