REPUBBLICA	quasi	replica	?	?	sportiva di una bellezza un po' androgina come l' alfa romeo 166 , o classica fino alla	quasi-replica	come la jaguar s-type ; oppure rétro ma anche decisamente innovativa come la rover 75 ?
REPUBBLICA	quasi	stato	?	?	che legittimo : lo stato ebraico si appresta a concedere altro territorio a una " entità " , o un	quasi-stato	, al cui interno rimangono attive forze estremamemente minacciose , e determinate a distrugger- lo .
REPUBBLICA	quasi	smorfia	?	?	romano prodi si accorge del cronista e increspa la bocca in una	quasi-smorfia	.
REPUBBLICA	quasi	monopolista	Rank	?	a ) gli accordi di governo prevedono che l' enel perda la sua caratteristica di	quasi-monopolista	, ma resti il protagonista fondamentale del sistema elettrico nazionale .
REPUBBLICA	quasi	sardo	?	?	ma il suo essere	quasi-sardo	non era un risultato del trascorrere del tempo , di una abitudine , né un effetto del trauma del sequestro
REPUBBLICA	quasi	tregua	?	?	roma -- dopo la	quasi-tregua	dell' altro giorno , il match fra romano prodi , da una parte , e ppi-ds , dall' altra ,
REPUBBLICA	quasi	giallo	?	?	a metà mattinata scoppia un	quasi-giallo	sulla traduzione dell' intervista : " the olive tree was a coalition of which i was a founder " ,
REPUBBLICA	quasi	romanzo	?	?	ma tolto il mascherar- si , nella verità stessa restava squisita materia per un	quasi-romanzo	.
REPUBBLICA	quasi	censura	?	?	rigore , per rassicurare la banca centrale europea e magari anche per recuperare una credibilità compromessa dagli scandali e dalla	quasi-censura	dell' europarlamento .
REPUBBLICA	quasi	coniuge	Kinship	?	ma il	quasi-coniuge	abbandonato , che poi è quasi sempre una quasi-coniuge , non ha nessun diritto .
REPUBBLICA	quasi	coniuge	Kinship	?	ma il quasi-coniuge abbandonato , che poi è quasi sempre una	quasi-coniuge	, non ha nessun diritto .
REPUBBLICA	quasi	nozze	?	?	ma alla vigilia delle	quasi-nozze	d' argento , filippo comincia a fare strani discorsi , " questa casa non è mica la tua " ,
REPUBBLICA	quasi	romanzo	?	?	calasso , con questa formula del	quasi-romanzo	, è stato capace di appassionare anche lettori che hanno un' eredità culturale molto diversa " .
REPUBBLICA	quasi	mandato	?	?	del resto il segretario generale nato , solana , ha già un	quasi-mandato	per ordinare i raid appena il negoziato fosse dichiarato defunto .
REPUBBLICA	quasi	silenzio	?	?	e a tal fine è necessario trattare a delegazioni ristrette , e con un	quasi-silenzio	stampa , dispensando ai mezzi d' informazione solo il minimo indispensabile di notizie di carattere generale " .
REPUBBLICA	quasi	presidente	Role	?	eppure non si sentiva un	quasi-presidente	: " io non mi illusi mai " ricorda il senatore a vita , guardando fuori dalla finestra della sua
REPUBBLICA	quasi	presidente	Role	?	ma la mattina dopo , il 16 maggio , il mondo crollò addosso al	quasi-presidente	, che fu impallinato da 70 franchi tiratori e per 39 voti -- 39 voti che forse avrebbero cambiato la
REPUBBLICA	quasi	gol	?	?	c' è solo il tempo per un	quasi-gol	di raducioiu e per i commenti negli spogliatoi a un pareggio inutile .
REPUBBLICA	quasi	oblio	?	?	nella guerra che in questi giorni si combatte e che tra un po' finirà nel	quasi-oblio	come ci è già finita la guerra in bosnia , lo scontro è anche tra popoli di poca memoria come
REPUBBLICA	quasi	oblio	?	?	nella guerra che in questi giorni si combatte e che tra un po' finirà nel	quasi-oblio	come ci è già finita la guerra in bosnia , lo scontro è anche tra popoli di poca memoria come
REPUBBLICA	quasi	recessione	?	?	la stagnazione ( o	quasi-recessione	) italiana è in parte il prezzo che paghiamo per le crisi che hanno colpito l' anno scorso alcuni mercati
REPUBBLICA	quasi	mogli	Kinship	?	curiosità , e stupore , destano i pensieri che avvolgono le menti delle	quasi-mogli	a poche ore dal sì .
REPUBBLICA	quasi	identificazione	?	?	perché allora questa	quasi-identificazione	, nel mondo ortodosso , della dimensione nazionale e di quella religiosa ?
REPUBBLICA	quasi	indipendenza	?	?	stati nazionali , e ciascuno di essi , sul modello luterano , organizzò la sua chiesa sulla base di una	quasi-indipendenza	( l' autocefalia ) , e l' integrò nell' apparato statale .
REPUBBLICA	quasi	mercedes	?	?	, la chairman ( nata alla ssangyong prima dell' acquisizione da parte di daewoo ) delude : è solo una	quasi-mercedes	.
REPUBBLICA	quasi	regina	Role	?	ii d' asburgo ) è una baviera-neuburg sorella dell' imperatrice d' austria e della regina del portogallo e di una	quasi-regina	di polonia , nonché cugina della famosa principessa palatina cognata di luigi xiv , e zia complice di elisabetta farnese
REPUBBLICA	quasi	gigante	?	?	un altro corsivo in cui lo stesso merlo paragonava l' italia a un gigante a metà , forse un "	quasi-gigante	" come il grottesco margutte protagonista dell' eroicomico morgante maggiore di luigi pulci .
REPUBBLICA	quasi	gigante	?	?	sarà tutt ' al più un gigante a metà , un "	quasi-gigante	" .
REPUBBLICA	quasi	realtà	Qualification or Set of Circumstances	?	necessaria è la descrizione poetante dell' assurdo , la ricerca di grimaldelli di senso capaci di scardinare la sensazione di	quasi-realtà	che percepiamo quotidianamente .
REPUBBLICA	quasi	fratello	?	?	proclamare natalia , e racconta di essere stata da giovane , in questo campo , una mediocre allieva del suo	quasi-fratello	felice balbo , che " mi dava dei consigli pratici , mi diceva che dovevo andare in cellula , e
REPUBBLICA	quasi	commedia	?	?	" una	quasi-commedia	drammatica .
REPUBBLICA	quasi	stangata	?	?	una	quasi-stangata	, come ammettono perfino i tecnici di via xx settembre : " è vero che quest' anno non ci sarà
REPUBBLICA	quasi	musical	?	?	-- è un' avventura di ritmi emozionanti e di notturne atmosfere metropolitane lo spettacolo cool heat-urban beat , il trascinante	quasi-musical	che ha debuttato ieri sera al teatro romano dopo la cancellazione dell' anteprima di venerdì a causa di una pioggia
REPUBBLICA	quasi	decollo	?	?	in america l' idea è stata un successo , da noi invece è in perenne	quasi-decollo	, un po' per scarsità d' offerta ( tra le grandi marche solo fiat-alfa-lancia , ford , nissan , opel
REPUBBLICA	quasi	suocera	?	?	è in giardino , a todi , nella villa della sua	quasi-suocera	marina ripa di meana , in un clima relativamente di festa : l' altro ieri era il compleanno della sua
REPUBBLICA	quasi	professionista	Qualification or Set of Circumstances	?	nell' incubo -- che rinasca nel suo meridione quel personaggio patito , pallido , spettrale del quasi proprietario terriero ,	quasi-professionista	che passeggia tutto il giorno e non fa mai niente .
REPUBBLICA	quasi	santone	?	?	" bauschiano " dominique mercy ai " carlsoniani " della prim' ora larrio ekson e jorma uotinen , fino al	quasi-santone	kazuo ohno , inventore della danza butô giapponese .
REPUBBLICA	quasi	pornografia	?	?	non è	quasi-pornografia	?
REPUBBLICA	quasi	presidente	Role	?	con tante spade appese sulla testa , il	quasi-presidente	ha scelto la strategia della pace dichiarata , cercata , esibita con il parlamento .
REPUBBLICA	quasi	collisione	?	?	l' ipotesi è che sia avvenuta una " near collision " , una "	quasi-collisione	con un jet o con un missile " .
REPUBBLICA	quasi	diciottenni	?	?	è chiaro che , se i	quasi-diciottenni	sono ancora i nostri bambini , saranno ragazzi e ragazze a venti o trent' anni , e diventeranno uomini e
REPUBBLICA	quasi	totalità	?	?	del credito , visto che l' istituto porta in dote il controllo strategico del banco di sicilia , cioè della	quasi-totalità	del credito nell' isola , dopo la confluenza degli sportelli sicilcassa .
REPUBBLICA	quasi	nazista	Cultural or political movement	?	avere mille volti : quello corsaro di bossi ma anche quello efficientista del leader bavarese stoiber , quello esoterico del	quasi-nazista	viennese richard lugner o quello indipendentista del savoiardo patrick abelille .
REPUBBLICA	quasi	amico	Qualification or Set of Circumstances	?	il mio	quasi-amico	lolly era intelligente e simpatico .
REPUBBLICA	quasi	amico	Qualification or Set of Circumstances	?	nel caso del nostro	quasi-amico	, era la funzione che suggeriva di risalire all' organo .
REPUBBLICA	quasi	crisi	?	?	fra i piccoli del centrosinistra in queste ore di	quasi-crisi	serpeggiano malumore , inquietudine , preoccupazione .
REPUBBLICA	quasi	divano	?	?	più quelle anteriori , mentre le due posteriori sono ora collegate da un inserto imbottito , così da creare un	quasi-divano	a tre posti .
REPUBBLICA	quasi	architetto	?	?	cesare pancotto ,	quasi-architetto	di 44 anni , coach di lungo corso e ricco marciapiede , 16 stagioni e oltre 500 partite in a
REPUBBLICA	quasi	emergenza	Qualification or Set of Circumstances	?	tasso al 3 % è maturata gradualmente a partire dall' estate scorsa quando è divenuto via via chiaro che la	quasi-emergenza	di inizio anno -- culminata nella riduzione dei tassi decisa ad aprile -- era finita " .
REPUBBLICA	quasi	crollo	?	?		quasi-crollo	, infine , per le vendite all' estero : -- 6 per cento .
REPUBBLICA	quasi	suv	?	?	nel fuoristrada leggero , questa	quasi-suv	si districa senza particolari problemi , seppur non sia indicata per salite impervie in quanto la prima non è ridotta
REPUBBLICA	quasi	familiari	?	?	nel caso della sportwagon il riferimento storico più istintivo è quello delle	quasi-familiari	derivate dalle coupé che gli inglesi hanno battezzato " shooting brake " .
REPUBBLICA	quasi	battuta	?	?	tant ' è che si lascia andare a una	quasi-battuta	: " per usare un eufemismo , la definirei inquietante " .
REPUBBLICA	quasi	cartello	?	?	presidente dell' antitrust , giuseppe tesauro , ascoltato ieri dalla commissione industria del senato , avrebbero dato vita ad un	quasi-cartello	per mantenere il prezzo della benzina uniforme e , attraverso paradossali rapporti contrattuali , costringerebbero i gestori -- come afferma
REPUBBLICA	quasi	autogol	?	?	bisgaard 5,5 : un suo cross provoca un	quasi-autogol	di zago , poco altro .
REPUBBLICA	quasi	sindacato	?	?	marzo scorso si è ritrovato ex di tutto , ex comandante di reggimento ed ex leader del cocer , il	quasi-sindacato	dei carabinieri .
REPUBBLICA	quasi	scoperta	?	?	inversamente proporzionale all' investimento nella ricerca : spendiamo pochissimo ma ci lanciamo in osanna ogniqualvolta viene annunciata una scoperta o	quasi-scoperta	" .
REPUBBLICA	quasi	certezza	?	?	la	quasi-certezza	che la fusione sia imminente , e non come unione tra pari , era ieri l' argomento del giorno nei
REPUBBLICA	quasi	paralisi	?	?	dei casi clinici di freud , uno di quei giovani che andavano da lui per curare " uno stato di	quasi-paralisi	" , perché " ha perso ogni interesse , ogni capacità di concentrazione , perfino la possibilità di ricordare con
REPUBBLICA	quasi	sì	?	?	incertezza per pantani ( ma ormai è un	quasi-sì	) e incertezza per cipollini .
REPUBBLICA	quasi	monaco	Job or Career	?	una biografia indecifrabile : pronipote di san giovanni bosco , ex ateo ed ex libertino , ex	quasi-monaco	in tibet , ex dc da combattimento nella zona più rossa d' italia .
REPUBBLICA	quasi	modo	?	?	certo pregiudizio antifrancese ( " this gallic musical " ) e hanno infierito con battute a tutto spiano ( "	quasi-modo	, quasi-musical " ) .
REPUBBLICA	quasi	sfiducia	?	?	la	quasi-sfiducia	.
REPUBBLICA	quasi	premier	Role	?	il centro-destra , invece , è in anticipo : ha un	quasi-premier	con la lista dei ministri già in tasca , eppure deve adattar- si a vagabondare da oppositore , tra le
WIKICONLL	quasi	integrazione	?	?	altre disposizioni chiarificano l' assetto della politica estera e di sicurezza comune , con la	quasi-integrazione	dell' ueo , mentre viene data una rinfrescata ( insufficiente ) al sistema istituzionale , in vista dell' adesione dei
WIKICONLL	quasi	monte	?	?	in questa situazione , si può usare un metodo monte carlo , un metodo	quasi-monte	carlo , o , per dimensioni moderatamente grandi , il metodo delle griglie sparse .
WIKICONLL	quasi	atomi	?	?	la chimica degli atomi esotici studia le proprietà e le applicazioni di	quasi-atomi	come il positronio , il muonio , gli antiatomi .
WIKICONLL	quasi	genere	?	?	recitati in lingua veneta - è considerato uno dei massimi esponenti della cosiddetta " prima generazione " di quel "	quasi-genere	" solitamente definito come teatro di narrazione : un teatro che , sulla scia della lezione del " mistero buffo
WIKICONLL	quasi	particelle	?	?	sotto determinate condizioni può accadere che i due monopoli possono muover- si in modo indipendente ed essere considerate quindi delle	quasi-particelle	( vedi monopoli nei sistemi della materia condensata sotto ) .
WIKICONLL	quasi	particelle	?	?	colleghi dal dresden university of technology , university di st. andrews e dell' oxford university hanno descritto l' osservazione di	quasi-particelle	simili come proprietà ai monopoli .
WIKICONLL	quasi	particelle	?	?	è stato descritto inoltre un contributo alla capacità termica del sistema proveniente da un gas effettivo di queste	quasi-particelle	.
WIKICONLL	quasi	morte	Qualification or Set of Circumstances	?	molte persone rianimate dopo essere state per alcuni momenti in questo stato hanno riferito esperienze di	quasi-morte	, la natura delle quali è controversa .
WIKICONLL	quasi	object	?	?	della programmazione orientata agli oggetti anche se ne mutua molte caratteristiche , infatti viene definito un ambiente di sviluppo "	quasi-object	" dato che la base dello sviluppo è la manipolazione di entità chiamate oggetti ma il database non supporta molte
WIKICONLL	quasi	prigionia	?	?	approfittando della situazione favorevole , urquhart , e con lui gli ufficiali che condivisero quello stato di	quasi-prigionia	, poté fuggire e tornare alle sue unità .
WIKICONLL	quasi	monte	?	?	un simile approccio implica l' uso di low-discrepancy sequence s piuttosto del metodo	quasi-monte	carlo .
WIKICONLL	quasi	monte	?	?	i metodi	quasi-monte	carlo spesso possono essere più efficienti come metodi di integrazione numerica poiché la successione di valori generata riempie meglio l'
WIKICONLL	quasi	integrazione	?	?	altre disposizioni chiarificano l' assetto della politica estera e di sicurezza comune , con la alla	quasi-integrazione	dell' ueo , mentre viene data una rinfrescata ( insufficiente ) al sistema istituzionale , in vista del' adesione dei
WIKICONLL	quasi	monte	?	?	il valore atteso sopra può essere approssimato tramite metodi monte carlo o	quasi-monte	carlo .
WIKICONLL	quasi	cugino	?	?	proviene da un pianeta prossimo a betelgeuse , ed è "	quasi-cugino	" di ford prefect ( con cui " condivide tre madri " ) .
WIKICONLL	quasi	realtà	Qualification or Set of Circumstances	?	si-stemi di relazioni oggettive che sono il prodotto dell’ istituzione del sociale nelle cose e nei mec-canismi che hanno la	quasi-realtà	degli oggetti fisici ; e naturalmente tutto ciò che scaturisce da questa relazione , cioè le prati-che e le rappresentazioni
WIKICONLL	quasi	satellite	?	?		quasi-satellite	.
WIKICONLL	quasi	satellite	?	?	un	quasi-satellite	è un corpo celeste analogo ad un pianeta o ad un satellite , la cui orbita comprende tuttavia sia il
WIKICONLL	quasi	satellite	?	?	l' orbita di un	quasi-satellite	attorno al sole impiega esattamente lo stesso tempo che di quella del suo pianeta , ma di solito ha una
WIKICONLL	quasi	satellite	?	?	quando visto dalla prospettiva del pianeta , il	quasi-satellite	apparirà percorrere un anello oblungo attorno ad esso , anche se tecnicamente non vi orbita attorno .
WIKICONLL	quasi	satelliti	Qualification or Set of Circumstances	?		quasi-satelliti	conosciuti .
WIKICONLL	quasi	satelliti	Qualification or Set of Circumstances	?	è noto che urano e nettuno possono trattenere	quasi-satelliti	per l' intera età del sistema solare ( circa 4,5 miliardi di anni ) , mentre giove per soli 10
WIKICONLL	quasi	satelliti	Qualification or Set of Circumstances	?	è inoltre noto che la terra possiede i	quasi-satelliti	2003 yn107 e 2004 gu9 , e venere possiede il quasi-satellite 2002 ve68 .
WIKICONLL	quasi	satellite	?	?	è inoltre noto che la terra possiede i quasi-satelliti 2003 yn107 e 2004 gu9 , e venere possiede il	quasi-satellite	2002 ve68 .
WIKICONLL	quasi	satelliti	Qualification or Set of Circumstances	?	gli oggetti in " orbita a ferro di cavallo " come 2002 aa29 sono talvolta chiamati	quasi-satelliti	, benché non sia la stessa cosa .
WIKICONLL	quasi	satelliti	Qualification or Set of Circumstances	?	questi oggetti " ferro di cavallo " ogni tanto diventano	quasi-satelliti	per poche decine o centinaia di anni prima di tornare nel loro stato precedente .
WIKICONLL	quasi	contratti	documento	?	molte revisioni e molte interpretazioni e verrà presto ampliata , prima nelle res cottidianae ( dove verranno aggiunti i "	quasi-contratti	" ) e poi nelle istituzioni di giustiniano ( dove si aggiungeranno pure i " quasi-delitti " , portando a
WIKICONLL	quasi	delitti	Event	?	verranno aggiunti i " quasi-contratti " ) e poi nelle istituzioni di giustiniano ( dove si aggiungeranno pure i "	quasi-delitti	" , portando a 4 le fonti delle obbligazioni ) .
WIKICONLL	quasi	usufrutto	?	?	il	quasi-usufrutto	.
WIKICONLL	quasi	usufrutto	?	?	in questo caso , solitamente definita come "	quasi-usufrutto	" l' usufruttuario dovrà restituire , al termine dell' usufrutto , il loro equivalente in quantità e qualità .
WIKICONLL	quasi	usufrutto	?	?	in alcuni casi un usufrutto si converte in	quasi-usufrutto	: si trasferisce sull' indennità dovuta dal terzo che ha cagionato il perimento della cosa ; si trasferisce , in
WIKICONLL	quasi	analogia	?	?	questa	quasi-analogia	accese le speranze di ehrlich , che sulla base di una precisa analogia chimica sostituì al gruppo azoico - n
WIKICONLL	quasi	recitativo	?	?	arpeggi d' ottava della mano destra introduce la parte finale , molto drammatica : la caduta dell' eroe , un	quasi-recitativo	lento e sospeso e infine un grandioso e trionfante finale in re maggiore , con acuti squilli di tromba e
WIKICONLL	quasi	immunità	?	?	la protezione catodica ha un costo che può essere espresso dalla corrente complessiva necessaria per ottenere condizioni di "	quasi-immunità	" ( per compensare la " velocità di corrosione " entro prefissati limiti di tolleranza ) sull' intera superficie della
WIKICONLL	quasi	sposa	Kinship	?	reclamizza il suo amore per la	quasi-sposa	del professore ; ma angelo interviene subito dicendo sottovoce al suo maggiordomo : " liquidalo , " espeditivamente " e
WIKICONLL	quasi	benedizione	?	?	, benedizione ( " kichi " , 吉 ) , mezza-benedizione ( " han-kichi " , 半 吉 ) ,	quasi-benedizione	( " sue-kichi " , 末 吉 ) , quasi-piccola-benedizione ( " sue-shō-kichi " , 末 小 吉 ) ,
WIKICONLL	quasi	maledizione	?	?	piccola-maledizione ( " shō-kyō " , 小 凶 ) , mezza-maledizione ( " han-kyō " , 半 凶 ) ,	quasi-maledizione	( " sue-kyō " , 末 凶 ) , grande maledizione ( " dai-kyō " , 大 凶 ) .
WIKICONLL	quasi	religione	?	?	nel suo ruolo come discepola della	quasi-religione	, sedusse un barone delle miniere su panatha , che si legò a lei .
WIKICONLL	quasi	guerra	Qualification or Set of Circumstances	?	nel 1799 , dopo una serie di battaglie navali con i francesi ( note come la	quasi-guerra	) , la guerra sembrava inevitabile .
WIKICONLL	quasi	equilibrio	?	?	si dice così che l' ecosistema è in equilibrio o in	quasi-equilibrio	biologico .
WIKICONLL	quasi	equilibrio	?	?	il campo coltivato , o agroecosistema , è simile ad un ecosistema giovane , con un equilibrio o	quasi-equilibrio	biologico precario e , per di più , le specie botaniche che lo popolano , al contrario delle pionieristiche ,
WIKICONLL	quasi	scioperi	?	?	innovando rispetto alla tradizione gandhiana , marco pannella ha sempre legato i suoi	quasi-scioperi	della fame ( ha bevuto solo qualche cappuccino ) a rivendicazioni legate al rispetto del diritto da parte delle autorità
WIKICONLL	quasi	morti	Qualification or Set of Circumstances	?	fa catturare e portare sulla propria nave ammiraglia , dove lo sottopone ad un' indagine mentale da parte degli psichici	quasi-morti	, che ne rivelano l' identità furyana .
WIKICONLL	quasi	totalità	?	?	lunga 725 km , la barriera ingloba la maggior parte delle colonie israeliane e la	quasi-totalità	dei pozzi .
WIKICONLL	quasi	disastro	?	?	dopo il	quasi-disastro	dell' apollo 13 , la missione apollo 14 fu l' ultima in cui gli astronauti rimasero in quarantena al loro
WIKICONLL	quasi	anonimato	?	?	quantità di oggettistica e pupazzi ( in particolar modo basata sull' insolito personaggio di plue ) , proiettando mashima dal	quasi-anonimato	alla notorietà mondiale .
WIKICONLL	quasi	nil	?	?	indicare una quantità variabile positiva quando questa poteva essere considerata più grande di un qualsiasi numero positivo dato ; "	quasi-nil	" quando questa poteva essere considerata più piccola di un qualsiasi numero positivo dato ; " quasi-a " quando questa
WIKICONLL	quasi	a	?	?	dato ; " quasi-nil " quando questa poteva essere considerata più piccola di un qualsiasi numero positivo dato ; "	quasi-a	" quando questa poteva essere considerata più grande di un qualsiasi numero più piccolo di " a " e più
WIKICONLL	quasi	playback	?	?	in grado di leggere le registrazioni s-vhs , ma alcuni dei modelli più recenti offrono una funzionalità chiamata " s-vhs	quasi-playback	" ( sqpb ) , che permette la riproduzione dei nastri s-vhs anche se ai livelli qualitativi vhs .
WIKICONLL	quasi	equilibrio	?	?	la tracca di henyey è caratterizzata da un lento collasso della protostella in condizione di	quasi-equilibrio	idrostatico .
WIKICONLL	quasi	allieva	Qualification or Set of Circumstances	?	in repertorio alcuni decenni e famosi poi fino ai giorni nostri , in entrambi i casi a fianco della sua	quasi-allieva	giuseppina grassini .
WIKICONLL	quasi	gemello	?	?	nettuno ha 17 volte la massa della terra ed è leggermente più massiccio del suo	quasi-gemello	urano , la cui massa è uguale a 15 masse terrestri , ma è meno denso di nettuno .
WIKICONLL	quasi	trionfo	?	?	, arrivando alla finale di coppa uefa nella seconda stagione e distinguendo- si come uno tra i maggiori protagonisti del	quasi-trionfo	nella competizione ( il piccolo alaves venne sconfitto dal grande liverpool solamente per un' autorete nei tempi supplementari , 5-4
WIKICONLL	quasi	fine	?	?	si rivela subito un personaggio antagonista più degli altri , perché cerca di uccidere jim sia all' inizio che alla	quasi-fine	del film .
WIKICONLL	quasi	mariti	Kinship	?	sul fatto che non sa nemmeno come le piacciono cucinate le uova ( si adeguava sempre ai gusti dei diversi	quasi-mariti	) .
WIKICONLL	quasi	guerra	Qualification or Set of Circumstances	?	la resistenza si configurò come una	quasi-guerra	civile durata circa tent' anni e fu tanto efficace da costringere emanuele filiberto , duca di savoia , a concedere
WIKICONLL	quasi	degenerazione	?	?	esistono anche delle applicazioni per i casi di	quasi-degenerazione	, dove l' approccio perturbativo è applicato a un insieme di stati elettronici .
WIKICONLL	quasi	biografia	?	?	è una	quasi-biografia	di hendrick e di william johnson , e dei rapporti tra i due , rapporti segnati dalla diversa maniera di
WIKICONLL	quasi	morte	Qualification or Set of Circumstances	?	l' eresia finirà poi con la morte di horus , l' esilio delle sue legioni traditrici , e la	quasi-morte	dell' imperatore .
WIKICONLL	quasi	moneta	?	?	che , per il loro grado di liquidità , possono svolgere le stesse funzioni della moneta ( la cosiddetta "	quasi-moneta	" ) .
WIKICONLL	quasi	indipendenza	?	?	nel 1493 suo figlio , giacomo iv , con successo ha concluso la questione della	quasi-indipendenza	del signore delle isole , mettendo per la prima volta le isole occidentali sotto reale controllo scozzese .
WIKICONLL	quasi	totalità	?	?	è nata dalla fusione delle	quasi-totalità	delle società private sul territorio nazionale .
WIKICONLL	quasi	verbali	?	?	in senso stretto , sia costituita da episodi non verbali auto-evidenti la cui autorità viene trasmessa alle esecuzioni verbali e	quasi-verbali	quando queste vengono compite in conformità alle regole semantiche del linguaggio » .
WIKICONLL	quasi	totalità	?	?	la terra nel nord di moldova è molto fertile , con nero-terra che domina nella	quasi-totalità	.
WIKICONLL	quasi	radiocronista	?	?	il	quasi-radiocronista	sportivo tom leezak ( ashton kutcher ) e la rampolla di una ricca famiglia , sarah mcnerney ( brittany murphy
WIKICONLL	quasi	satellite	?	?	gli oggetti che condividono queste caratteristiche orbitali sono detti	quasi-satellite	.
WIKICONLL	quasi	satellite	?	?	diverrà un	quasi-satellite	della terra approssimativamente in 600 anni .
WIKICONLL	quasi	equilibrio	?	?	è da notare il fatto che non ci sono restrizioni per quanto riguarda deboli campi e condizioni di	quasi-equilibrio	.
WIKICONLL	quasi	guardia	Job or Career	?	ha sia capacità di tiro da lontano che di rimbalzo ; non è né un' ala	quasi-guardia	, né un' ala quasi-centro , ma sa combinare entrambe le caratteristiche .
WIKICONLL	quasi	centro	?	?	sia capacità di tiro da lontano che di rimbalzo ; non è né un' ala quasi-guardia , né un' ala	quasi-centro	, ma sa combinare entrambe le caratteristiche .
WIKICONLL	quasi	astrazione	?	?	i soggetti di questa seconda fase di lavoro stanno in bilico con la leggerezza e la	quasi-astrazione	che le forme finiscono con l’ assumere .
WIKICONLL	quasi	risonanza	?	?	il criterio secondo il quale ciò avviene , è una condizione di "	quasi-risonanza	" sulle frequenze dei moti ( " commensurabilità " ) , ed il teorema quantifica le condizioni sulle perturbazioni affinché
WIKICONLL	quasi	gol	?	?	dopo il 90 ' da david beckham i loro sforzi furono premiati : il subentrato teddy sheringham segnò dopo un	quasi-gol	di ryan giggs .
WIKICONLL	quasi	genere	?	?	il " mistero buffo " di fo costituisce , per certi versi , il modello di quel	quasi-genere	che si è soliti definire come teatro di narrazione e che annovera tra i suoi esponenti di spicco autori-attori come
