REPUBBLICA	allora prima	ministro	Role	?	DET ADV NOUN	a suo tempo in india non piacque , così come versi satanici scandalizzò i dirigenti iraniani , e	l' allora prima ministro	indira gandhi tentò di metter- lo al bando .
REPUBBLICA	allora prima	ministro	Role	?	DET ADV NOUN	per questo , nel 1984 , su ordine	dell' allora prima ministro	begin , l' aviazione israeliana bombardò e distrusse con una temeraria operazione la centrale nucleare irachena sospettata di lavorare alla produzione
REPUBBLICA	allora prima	ministro	Role	?	DET ADV NOUN	sul tavolo di questa trattativa senza fine c' è un nuovo ritiro dalla cisgiordania : il patto firmato	dall' allora prima ministro	netanyahu nell' ottobre '98 al summit negli usa , e da lui congelato dopo un primo ridispiegamento .
WIKICONLL	allora prima	sezione	?	?	DET ADV NOUN	chiamato da monsignor domenico tardini , segretario della congregazione degli affari ecclesiastici straordinari , a prestare il suo servizio presso	l' allora prima sezione	della segreteria di stato ( oggi sezione per i rapporti con gli stati ) , incarico che ricoprì per circa diciannove
ITWAC	allora prima	deputato	Role	?	DET ADV NOUN	salendo pian piano qualche gradino accanto a quello che negli anni ottanta era il plenipotenziario locale dei governi pentapartiti ,	l' allora prima deputato	e poi senatore franco bonferroni .
ITWAC	allora prima	circoscrizione	Qualification or Set of Circumstances	?	DET ADV NOUN	per far capire meglio la situazione , dagli uffici del municipio arriva qualche dato : nel 1997	l' allora prima circoscrizione	aveva a disposizione per la manutenzione delle strade una cifra che , tradotta in euro , fa due milioni e 160
ITWAC	allora prima	circoscrizione	Qualification or Set of Circumstances	?	DET ADV NOUN	panecaldo , delegato al piano urbano parcheggi - il precedente pup aveva escluso la possibilità di nuove aree di sosta	nell' allora prima circoscrizione	.
ITWAC	allora prima	deputato	Role	?	DET ADV NOUN	salendo pian piano qualche gradino accanto a quello che negli anni ottanta era il plenipotenziario locale dei governi pentapartiti ,	l' allora prima deputato	e poi senatore franco bonferroni .
ITWAC	allora prima	circoscrizione	Qualification or Set of Circumstances	?	DET ADV NOUN	per far capire meglio la situazione , dagli uffici del municipio arriva qualche dato : nel 1997	l' allora prima circoscrizione	aveva a disposizione per la manutenzione delle strade una cifra che , tradotta in euro , fa due milioni e 160
ITWAC	allora prima	circoscrizione	Qualification or Set of Circumstances	?	DET ADV NOUN	quel progetto di " riqualificazione " fu bocciato senza esitazioni cinque anni fa dalla commissione urbanistica	della allora prima circoscrizione	, è poi rispuntato e ora viene realizzato in una versione persino peggiore della originale .
ITWAC	allora prima	uscita	?	?	DET ADV NOUN	esplorabili e di segreti al loro interno celati , forte di un level design semplice , ma assolutamente mai sottotono	l' allora prima uscita	tridimensionale del pargolo ed icona ubisoft mostra ahinoi il fianco nell' adattamento toccato in sorte al sistema di controllo ( affidato
ITWAC	allora prima	base	Place or function	?	DET ADV NOUN	la leggenda di gehrig ebbe inizio il 2 giugno del 1922 , quando	l' allora prima base	dei new york yankees , wally pipp , chiese di non giocare perché non si sentiva bene .
ITWAC	allora prima	ministro	Role	?	DET ADV NOUN	della festa cade a un anno preciso dalla firma del trattato di adesione al vertice di atene , in cui	l' allora prima ministro	e attuale presidente della repubblica adam fenech adami suggellava in modo formale l' ingresso del suo paese nell' ue .
ITWAC	allora prima	categoria	?	?	DET ADV NOUN	bicicletta come un mezzo per evidenziare le sue straordinarie differenze rispetto ai coetanei e quando poté iniziare a correre ,	nell' allora prima categoria	possibile , gli allievi , il suo dominio si manifestò .
