ITWAC	sempre più	comodo	?	?	DET ADV NOUN	il 4 ottobre risulta essere rilasciata anche la nuova versione di	un sempre più comodo	gmail notifier .
ITWAC	sempre più	largo	?	?	DET ADV NOUN	di fatto un nuovo contributo per la conoscenza dello straordinario corpus grafico quarenghiano , che potrà risultare godibile anche ad	un sempre più largo	pubblico di appassionati estimatori .
ITWAC	sempre più	sofisticate	?	?	DET ADV NOUN	tirreno e il dio nettuno al quale è stato chiesto mare mosso e condizioni climatiche avverse ad oltranza in risposta	alle sempre più sofisticate	tecniche di pesca di noi poveri pescatori sportivi .
ITWAC	sempre più	persone	Qualification or Set of Circumstances	?	DET ADV NOUN	seguito a tale esperimento , con i suoi 94 acri di terreno che ospitano 280 abitazioni , è diventato richiestissimo	dalle sempre più persone	che , in germania come in altre parti del mondo , non ce la fanno più a vivere in città invase
ITWAC	sempre più	spinta	?	?	DET ADV NOUN	le capacità operative dello strumento militare , attraverso un' integrazione sinergica delle migliori peculiarità delle singole componenti e a perseguire	una sempre più spinta	interoperabilità multinazionale nell' ambito della nato e dell' unione europea .
ITWAC	sempre più	brava	?	?	DET ADV NOUN	dalla mente del poliedrico sceneggiatore diego cajelli ( napoleone , dampyr , diabolik e tanti altri ) e dalla mano	della sempre più brava	federica manfredi , già vista all' opera per indy press su magenta e fresca di pubblicazione in usa con la serie
ITWAC	sempre più	grasso	?	?	DET ADV NOUN	smagliante delpiero ( speriamo che non si riprende x gli europei , sennò ci fa perdere pure questi ) ,	un sempre più grasso	miccoli , un di vaio che nei momenti migliori è sempre rimasto in panca ( acume di lippi ) ed un
ITWAC	sempre più	grasso	?	?	DET ADV NOUN	smagliante delpiero ( speriamo che non si riprende x gli europei , sennò ci fa perdere pure questi ) ,	un sempre più grasso	miccoli , un di vaio che nei momenti migliori è sempre rimasto in panca ( acume di lippi ) ed un
ITWAC	sempre più	grasso	?	?	DET ADV NOUN	smagliante delpiero ( speriamo che non si riprende x gli europei , sennò ci fa perdere pure questi ) ,	un sempre più grasso	miccoli , un di vaio che nei momenti migliori è sempre rimasto in panca ( acume di lippi ) ed un
ITWAC	sempre più	ottimo	?	?	DET ADV NOUN	una dimensione umana per una sorta di tornaconto d' immagine che non sempre sono loro a chiedere : l' intervista	del sempre più ottimo	roberto mi fa riflettere su questo lato .
ITWAC	sempre più	utilizzo	?	?	DET ADV NOUN	che il sistema di rilevamento elettronico delle infrazioni sia valido non c' è dubbio , prova n' è	il sempre più utilizzo	da parte molti comuni d' italia , e persino in metropoli europee come londra , se pur con ovvie differenziazioni .
ITWAC	sempre più	serrata	?	?	DET ADV NOUN	direzione , riprendendo e rafforzando quanto detto dal suo collega in merito al necessario massimo coinvolgimento dell' esperto trasversale in	una sempre più serrata	e significativa azione di prevenzione .
ITWAC	sempre più	richieste	?	?	DET ADV NOUN	ricerca di una soluzione estremamente pratica e facilmente trasportabile per poter portare sempre con se i propri dati , oppure	le sempre più richieste	card reader usb 2.0 , lettori universali di schede di memoria .
ITWAC	sempre più	stretta	?	?	DET ADV NOUN	il pubblico e gli organismi competenti aventi un ruolo diretto e indiretto su dette malattie ; promuovere l' aggiornamento e	una sempre più stretta	e vigilante collaborazione tra gli operatori sanitari del settore ; sopperire alle eventuali carenze delle strutture pubbliche reperendo farmaci e strumenti
ITWAC	sempre più	spinta	?	?	DET ADV NOUN	e sarebbe il caso di incentivare la conoscenza delle espressioni ed allargarla sotto il registro di	una sempre più spinta	selezione .
ITWAC	sempre più	rapido	?	?	DET ADV NOUN	con macaluso ci siamo intrattenuti sui problemi che la sinistra deve oggi affrontare , per non lasciarsi spiazzare	dal sempre più rapido	evolversi degli scenari economici e politici del nostro tempo .
ITWAC	sempre più	brava	?	?	DET ADV NOUN	dalla mente del poliedrico sceneggiatore diego cajelli ( napoleone , dampyr , diabolik e tanti altri ) e dalla mano	della sempre più brava	federica manfredi , già vista all' opera per indy press su magenta e fresca di pubblicazione in usa con la serie
ITWAC	sempre più	poveri	Qualification or Set of Circumstances	?	DET ADV NOUN	milioni di euro , con una ricaduta non indifferente sui prezzi dei beni di largo consumo e , quindi ,	sui sempre più poveri	italiani .
ITWAC	sempre più	scatenato	?	?	DET ADV NOUN	' anno scorso , si e classificato due domeniche fa al secondo posto alla corsa di maser alle spalle di	un sempre più scatenato	marco bui .
ITWAC	sempre più	complicata	?	?	DET ADV NOUN	e applicabile , invece di aggiungere commi , codicilli ed eccezioni varie , come è stato fatto per altri punti	della sempre più complicata	normativa sulla tutela dei dati personali .
ITWAC	sempre più	stretta	?	?	DET ADV NOUN	altri esempi sono invece i servizi cooperativi nati da	una sempre più stretta	e diffusa collaborazione nazionale di varie biblioteche statali , regionali e universitarie , ognuna con una propria missione e specializzazione .
ITWAC	sempre più	interesse	?	?	DET ADV NOUN	questo unito ad	un sempre più interesse	verso il fenomeno migrazione hanno dato il la a questa nuova letteratura .
ITWAC	sempre più	brava	?	?	DET ADV NOUN	gli attori si calano in maniera convincente nei ruoli , oltre	alla sempre più brava	sarandon , eccelle paul walker che qui ha modo di dimostrare le sue potenzialità oltre i vari fast and the furious
ITWAC	sempre più	commerciabilità	?	?	DET ADV NOUN	lo stato dell' informazione discografica oggi in italia è alquanto caotico : da un lato le grandi majors spingono per	una sempre più commerciabilità	dei loro prodotti , chiedendo ai produttori di arricchire di sonorità più commerciali le loro produzioni , dall' altra giovani label
ITWAC	sempre più	brava	?	?	DET ADV NOUN	, de bartolo , oltre ai ben noti di bari , mancini , esposito , di vietri , antonelli e	la sempre più brava	isabel von piotrowska .
ITWAC	sempre più	isolamento	?	?	DET ADV NOUN	film incentrato su un solo personaggio , dove continua l' ispezione sui rapporti sentimentali nella società contemporanea , dominata da	un sempre più isolamento	della persona e da un' invadenza tecnologica ( computer e cellulari su tutti ) che invece di unire gli individui li
ITWAC	sempre più	ottimo	?	?	DET ADV NOUN	una dimensione umana per una sorta di tornaconto d' immagine che non sempre sono loro a chiedere : l' intervista	del sempre più ottimo	roberto mi fa riflettere su questo lato .
ITWAC	sempre più	sofisticate	?	?	DET ADV NOUN	tirreno e il dio nettuno al quale è stato chiesto mare mosso e condizioni climatiche avverse ad oltranza in risposta	alle sempre più sofisticate	tecniche di pesca di noi poveri pescatori sportivi .
ITWAC	sempre più	raro	?	?	DET ADV NOUN	scarsa antropizzazione permette di osservare numerose altre specie di rapaci , oltre a quelli già citati : tra i notturni	il sempre più raro	barbagianni ( tyto alba ) e la civetta ( athene noctua ) , tra i diurni la poiana ( buteo buteo
ITWAC	sempre più	sofisticate	?	?	DET ADV NOUN	tirreno e il dio nettuno al quale è stato chiesto mare mosso e condizioni climatiche avverse ad oltranza in risposta	alle sempre più sofisticate	tecniche di pesca di noi poveri pescatori sportivi .
ITWAC	sempre più	spinta	?	?	DET ADV NOUN	, nell' odierno contesto europeo , c' è chi proclama ad alta voce la propria totale e incondizionata adesione a	una sempre più spinta	integrazione dell' unione europea , salvo poi , talvolta anche alla luce del giorno , operare concretamente per seminare il percorso
