REPUBBLICA	sempre più	compianto	?	?	DET ADV NOUN	è risaputo , come spiegava	il sempre più compianto	ennio flaiano , che si sarebbe sentito assai disorientato in questo mondo di velisti e di velinari , che gli stupidi
REPUBBLICA	sempre più	complessi	?	?	DET ADV NOUN	i due terzi del fondo per incentivare la piena esplicazione delle varie professionalità di tutti i lavoratori della scuola e	i sempre più complessi	carichi di lavoro .
REPUBBLICA	sempre più	armi	?	?	DET ADV NOUN	dal 7 dicembre 1987 parte la prima inversione di marcia ,	dal sempre più armi	al meno armi , che il dopoguerra abbia veduto .
REPUBBLICA	sempre più	complessi	?	?	DET ADV NOUN	ma la fetta maggiore della torta ( i due terzi appunto ) dovrebbe andare a tutti in nome	dei sempre più complessi	carichi di lavoro .
REPUBBLICA	sempre più	complessi	?	?	DET ADV NOUN	francia , + 8 % nel primo semestre '88 ) dipende soprattutto dalla propria capacità di tenere il passo con	i sempre più complessi	problemi di convivenza sociale ed è essa stessa la prima ad auspicare veri e definitivi accordi internazionali per l' unificazione delle
REPUBBLICA	sempre più	grasso	?	?	DET ADV NOUN	l' esempio perfetto di cosa è davvero l' alta moda lo ha dato ieri , ancora una volta ,	il sempre più grasso	saint laurent : inflessibilmente costretto al lavoro dal socio pierre bergé che è anche responsabile dei tre teatri d' opera della
REPUBBLICA	sempre più	impersonale	?	?	DET ADV NOUN	nella prospettiva commerciale di	un sempre più impersonale	consumo dell' immagine ( che è la logica del programma-simbolo della rai pre-duemila , i promessi sposi risciacquati in tamigi )
REPUBBLICA	sempre più	poveri	Qualification or Set of Circumstances	?	DET ADV NOUN	decani di canterbury e di westminster , l' ammettono persino i conservatori , ed è fatale che i più poveri	dei sempre più poveri	diventino plebe , teppa , suburra violenta .
REPUBBLICA	sempre più	complessi	?	?	DET ADV NOUN	con le tensioni che possono derivare dal tentativo di equilibrare la preoccupazione per la produttività , con una sensibilità per	i sempre più complessi	problemi etici , connessi con la gestione dei vostri interessi industriali .
REPUBBLICA	sempre più	piccolo	?	?	DET ADV NOUN	contemporaneamente , all' interno	del sempre più piccolo	pce , è nata una corrente minoritaria che vuole che il partito si sciolga per confluire nella coalizione elettorale , che
REPUBBLICA	sempre più	complessi	?	?	DET ADV NOUN	di massicce ondate di migliaia di immigrati economici e di profughi politici da sud e da est , e con	i sempre più complessi	problemi di integrazione per i milioni già residenti , sembra davvero poco realistico pensare che , continuando in ordine sparso ,
REPUBBLICA	sempre più	complessi	?	?	DET ADV NOUN	sotto l' incalzare di massicce ondate di migliaia di immigrati economici e di profughi politici , e con	i sempre più complessi	problemi di integrazione per i milioni già residenti , è infatti ormai irrealistico pensare che , continuando a procedere in ordine
REPUBBLICA	sempre più	promessa	Qualification or Set of Circumstances	?	DET ADV NOUN	il tempo di riportare a casa , a gemonio in provincia di varese , i figli e	la sempre più promessa	sposa manuela , ed ecco i giornali radio fare da altoparlante alle parole pronunciate nella battutissima aula del processo cusani da
REPUBBLICA	sempre più	tesi	?	?	DET ADV NOUN	il fatto che i vescovi catalani abbiano deciso di dibattere i problemi evangelici separatamente da quelli spagnoli aggiunge nuove incertezze	ai sempre più tesi	rapporti fra madrid e barcellona .
REPUBBLICA	sempre più	complessi	?	?	DET ADV NOUN	mobile ha deciso di cambiare rotta : rinuncia a spiegare in pochi secondi , con scritte minuscole e asterischi ,	i sempre più complessi	meccanismi di calcolo del costo di una telefonata e si limita a un messaggio evocativo .
WIKICONLL	sempre più	stretta	?	?	DET ADV NOUN	gli americani caldeggiavano infatti	una sempre più stretta	collaborazione fra la non allineata jugoslavia e l' europa comunitaria ed atlantica in funzione antisovietica .
WIKICONLL	sempre più	stretta	?	?	DET ADV NOUN	questo fu l' avvio per	una sempre più stretta	connessione con forme taoiste di medicina tradizionale cinese ed una ricca fioritura di opere fino al xiii secolo .
WIKICONLL	sempre più	stretta	?	?	DET ADV NOUN	indica in origine la parte abitata della terra ; la scelta indica come una sorta di indirizzo nella ricerca di	una sempre più stretta	collaborazione e comunione tra le varie chiese cristiane che abitano il mondo .
WIKICONLL	sempre più	stretta	?	?	DET ADV NOUN	il film segna l' inizio di	una sempre più stretta	collaborazione tra lui e il regista , nonché l' instaurar- si definitivo della collaborazione tra il regista e il compositore danny
WIKICONLL	sempre più	stretta	?	?	DET ADV NOUN	dopo l’ esperienza con la nccp , roberto de simone continua la sua opera di rinnovamento attraverso	una sempre più stretta	collaborazione con il gruppo di artisti " media aetas " , nel quale ritrova virgilio villani , già splendido protagonista della
WIKICONLL	sempre più	potenti	?	?	DET ADV NOUN	il podestà e la neo-figura del capitano del popolo , nato per difendere i diritti dei ceti più bassi da	i sempre più potenti	nobil uomini che spadroneggiavano in città .
WIKICONLL	sempre più	serrata	?	?	DET ADV NOUN	buia , 1968 ; strip-street , 1969 ; per un trattamento completo , 1971 ) , dall’ altra parte in	una sempre più serrata	riflessione teorica sui mezzi di comunicazione e il processo artistico ( duchamp e l’ occultamento del lavoro , 1978 ; fotografia
WIKICONLL	sempre più	acuto	?	?	DET ADV NOUN	fondamentalmente in pieno accordo con i dettami della sua filosofia , manifestò	un sempre più acuto	disagio nei confronti dei contatti umani ( ciò che gli procurò , in città , la fama di irriducibile misantropo )
WIKICONLL	sempre più	stretta	?	?	DET ADV NOUN	risultati sperati , ed ottenne solo di isolare l' italia dai suoi ex alleati dell' intesa , spingendo- la ad	una sempre più stretta	- e definitiva - alleanza con la germania churchill , nel 1933 , lo definì « il più grande legislatore vivente
WIKICONLL	sempre più	attaccamento	?	?	DET ADV NOUN	al crescente numero di devoti , numero che anche ai giorni nostri non accenna a diminuire , proprio a sottolineare	il sempre più attaccamento	dei viagrandesi verso il proprio patrono .
ITWAC	sempre più	stretta	?	?	DET ADV NOUN	questo appello e invii numerosa le firme per la sottoscrizione " , ma invita anche gli enti del territorio ad	una sempre più stretta	e proficua collaborazione .
ITWAC	sempre più	sofisticate	?	?	DET ADV NOUN	tirreno e il dio nettuno al quale è stato chiesto mare mosso e condizioni climatiche avverse ad oltranza in risposta	alle sempre più sofisticate	tecniche di pesca di noi poveri pescatori sportivi .
ITWAC	sempre più	spinta	?	?	DET ADV NOUN	avanzamento scientifico e tecnologico , si sono moltiplicati i centri decisionali politici e amministrativi , si è di fronte ad	una sempre più spinta	internazionalizzazione dell' economia , si è affermato il modello politico-culturale ( e socio-economico ) d' una società aperta , sono aumentati
ITWAC	sempre più	isolato	?	?	DET ADV NOUN	soprattutto , come dimostrano gli umori degli inglesi ormai in piena rivolta contro	il sempre più isolato	blair , la pressione cresce quando la fermezza comincia a sembrare gratuita e fine a se stessa , più fatta per
ITWAC	sempre più	brava	?	?	DET ADV NOUN	a dare al tutto una marcia in più contribuiscono le melodie vocali di andrea ferro e	della sempre più brava	cristina scabbia , che oltre a essersi conquistata paragoni con artiste del calibro di natalie merchant e kate bush , è
ITWAC	sempre più	attenzione	?	?	DET ADV NOUN	vantaggi rispetto alle prime pillole che furono introdotte , soprattutto provocano meno ritenzione idrica ( fatto da non trascurare per	la sempre più attenzione	che le donne pongono nei riguardi del proprio aspetto fisico ) e quindi un minore o nullo aumento ponderale e una
ITWAC	sempre più	spinta	?	?	DET ADV NOUN	questa è basata sulla scomposizione delle mansioni e	sulla sempre più spinta	introduzione di macchine e strumenti meccanici .
ITWAC	sempre più	conservatore	movimento culturale/politico	?	DET ADV NOUN	fassino propone di allargare il gruppo del pse ai riformisti laici e cattolici per farne un polo progressista da contrapporre	al sempre più conservatore	ppe .
ITWAC	sempre più	spinta	?	?	DET ADV NOUN	sono posti in questi ultimi anni si concentrano essenzialmente sul perseguimento dell' ammodernamento della segnaletica marittima , all' insegna di	una sempre più spinta	automazione : ciascun comando di zona fari , come organo dipartimentale , opera alle dirette dipendenze dell' alto comando periferico che
ITWAC	sempre più	stretta	?	?	DET ADV NOUN	durante la sessione plenaria il presidente del toroc valentino castellani ha ringraziato il cio per	la sempre più stretta	e costruttiva collaborazione .
ITWAC	sempre più	stretta	?	?	DET ADV NOUN	l' arma , assurta al rango di quarta forza armata , la più giovane ma dal cuore antico , in	una sempre più stretta	ed armonica integrazione interforze .
ITWAC	sempre più	sofisticate	?	?	DET ADV NOUN	tirreno e il dio nettuno al quale è stato chiesto mare mosso e condizioni climatiche avverse ad oltranza in risposta	alle sempre più sofisticate	tecniche di pesca di noi poveri pescatori sportivi .
ITWAC	sempre più	incisivo	?	?	DET ADV NOUN	la nuova punta di diamante fu individuata in rovani , pescato nel potenza , coadiuvato	dalla sempre più incisivo	urban .
ITWAC	sempre più	spinta	?	?	DET ADV NOUN	nel settore energetico dove , a fianco della tradizionale , rilevante incidenza negli usi industriali e domestico si assiste ad	una sempre più spinta	penetrazione dei consumi per la produzione elettrica .
ITWAC	sempre più	banale	?	?	DET ADV NOUN	tocca sentire la tromba suonare " il silenzio " negli studi del costanzo show , uno spettacolo annichilente e scoraggiante	della sempre più banale	italietta ...
ITWAC	sempre più	spinta	?	?	DET ADV NOUN	il ruolo dell' ingegnere la prima questione che deve essere affrontata è se si possa ancora oggi , con	la sempre più spinta	diversificazione delle attività , parlare in modo unitario dell' ingegneria .
ITWAC	sempre più	utenti	?	?	DET ADV NOUN	la sua caratteristica peculiare sta nellessere in continuo movimento ed aggiornamento , nel saper cogliere le esigenze	dei sempre più utenti	del portale , partendo dalla newsletter , che fornisce informazioni culturali direttamente nelle mail degli iscritti , fino ad arrivare ad
ITWAC	sempre più	stretta	?	?	DET ADV NOUN	il pubblico e gli organismi competenti aventi un ruolo diretto e indiretto su dette malattie ; promuovere l' aggiornamento e	una sempre più stretta	e vigilante collaborazione tra gli operatori sanitari del settore ; sopperire alle eventuali carenze delle strutture pubbliche reperendo farmaci e strumenti
ITWAC	sempre più	sorprendente	?	?	DET ADV NOUN	il terzo tempo è	del sempre più sorprendente	australiano della jaguar mark webber , più di dieci chilometri più lento delle ferrari nei rettifili ma capace di sfruttare al
ITWAC	sempre più	sorprendente	?	?	DET ADV NOUN	intanto gli umbri sono stati raggiunti a 54 punti	dalla sempre più sorprendente	triestina ( 1 - 0 al treviso ) .
ITWAC	sempre più	raffinate	?	?	DET ADV NOUN	'70 , quando cominciarono ad affermarsi i primi programmi per il text processing : il trattamento elettronico dei testi unito	alle sempre più raffinate	tecniche di immagazzinamento e gestione di grosse quantità di dati diede origine ai primi sistemi per il recupero selettivo dell' informazione
ITWAC	sempre più	brava	?	?	DET ADV NOUN	( 1 maggio 2002 ) godibile altra buona produzione targata spagna questo film divertentissimo e irriverente ( interpretato	dalla sempre più brava	carmen maura ) racconta gli intrighi condominiali di un gruppo di terribili inquilini che fanno di tutto e di più per
ITWAC	sempre più	brava	?	?	DET ADV NOUN	per intanto sappiate che è stato un inverno con grandi realizzazioni	della sempre più brava	grazia fenu , che questa volta ha vinto l' 8 b di " kaum " a fuili e il difficilissimo 8
ITWAC	sempre più	debole	?	?	DET ADV NOUN	armata qui e là , ma sostanzialmente il grosso lavoro lo ha già fatto auchinleck che ha già quasi circondato	il sempre più debole	rommel .
ITWAC	sempre più	entusiasta	?	?	DET ADV NOUN	l' entusiasmo finale ha visto tutta la squadra stringersi attorno	al sempre più entusiasta	presidente peppino pellegrino .
ITWAC	sempre più	stretta	?	?	DET ADV NOUN	pilotati da un equipaggio operante da una stazione remota di comando e controllo , è infatti funzionale allo sviluppo di	una sempre più stretta	ed efficace collaborazione fra le forze alleate nella lotta al terrorismo , nella risoluzione dei conflitti e delle crisi che affliggono
ITWAC	sempre più	brava	?	?	DET ADV NOUN	( 23 dicembre 2002 ) godibile altra buona produzione targata spagna questo film divertentissimo e irriverente ( interpretato	dalla sempre più brava	carmen maura ) racconta gli intrighi condominiali di un gruppo di terribili inquilini che fanno di tutto e di più per
ITWAC	sempre più	sofisticate	?	?	DET ADV NOUN	tirreno e il dio nettuno al quale è stato chiesto mare mosso e condizioni climatiche avverse ad oltranza in risposta	alle sempre più sofisticate	tecniche di pesca di noi poveri pescatori sportivi .
ITWAC	sempre più	sofisticate	?	?	DET ADV NOUN	tirreno e il dio nettuno al quale è stato chiesto mare mosso e condizioni climatiche avverse ad oltranza in risposta	alle sempre più sofisticate	tecniche di pesca di noi poveri pescatori sportivi .
ITWAC	sempre più	brava	?	?	DET ADV NOUN	soprattutto quando cenerentola è interpretata da	una sempre più brava	drew barrymore e da una strepitosa anjelica houston nel fatale ruolo della matrigna cattiva , anzi cattivissima .
ITWAC	sempre più	neo	?	?	DET ADV NOUN	l' alleanza democratica ( impresa non tanto facile in tempi in cui l' egualitarismo e perfino la socialdemocrazia vengono trattati	dal sempre più neo	centrista rutelli come scarpe vecchie da rottamare ) , la strada tracciata da asor rosa è quella della camera di consultazione
ITWAC	sempre più	buono	?	?	DET ADV NOUN	saluti ,	un sempre più buono	francesco lauria _ _ _ _ _ _ _ _ _ _ _ _ _ _ _ _ _ _ _
ITWAC	sempre più	spinta	?	?	DET ADV NOUN	le capacità operative dello strumento militare , attraverso un' integrazione sinergica delle migliori peculiarità delle singole componenti e a perseguire	una sempre più spinta	interoperabilità multinazionale nell' ambito della nato e dell' unione europea .
ITWAC	sempre più	spinta	?	?	DET ADV NOUN	impatto sui sistemi di c 3 i : · da un lato è necessaria , al comandante sul campo ,	una sempre più spinta	ed aggiornata consapevolezza della situazione operativa , allo scopo di poter pianificare tempestivamente azioni mirate , a basso rischio e "
ITWAC	sempre più	entusiasta	?	?	DET ADV NOUN	geronio , dopo aver narrato gli ultimi avvenimenti a	un sempre più entusiasta	prosdocimo , ha un duro scontro con la moglie , che proclama orgogliosamente la sua libertà di prendersi tutti gli amanti
ITWAC	sempre più	pessimista	?	?	DET ADV NOUN	lavoro nero per garantirsi oltre che uno stipendio decente anche la possibilità di accumularsi qualche soldino per la pensione saluti	un sempre più pessimista	mario :( da : fabrizio data : 6 ottobre 2004 date retta a me , tenetevi la liquidazione !
ITWAC	sempre più	stretta	?	?	DET ADV NOUN	, l' auspicio profondamente sentito di successo per i lavori che ella si appresta a condurre , nel segno di	una sempre più stretta	cooperazi one di tutti i paesi che vi prendono parte e che mirano alla costruzione di un' europa di pace e
ITWAC	sempre più	spinta	?	?	DET ADV NOUN	ed il rilancio dell' industria locale e dare una prospettiva di consolidamento e di sviluppo qualitativo dell' occupazione per evitare	una sempre più spinta	" precarizzazione " dei posti di lavoro ed un inarrestabile indebolimento dei settori produttivi .
ITWAC	sempre più	brava	?	?	DET ADV NOUN	appare invece come un contentino ( peraltro piuttosto bislacco , considerata la gigantesca prestazione	della sempre più brava	nicole kidman e la sorprendente e intrigante prova della nuova promessa " di casa " ludivine sagnier ) la palma per
ITWAC	sempre più	sofisticate	?	?	DET ADV NOUN	0 , 000000000001 1 x 10 - 12 queste valutazioni circa il pericolo per la salute sono possibili anche grazie	alle sempre più sofisticate	tecniche di indagine dei microinquinanti organici , attraverso le quali si sono raggiunti limiti di sensibilità solo qualche anno fa impensabili
ITWAC	sempre più	spinta	?	?	DET ADV NOUN	e di alleanza tra imprese si pongono come necessaria strategia per rispondere alle esigenze della globalizzazione dei mercati e di	una sempre più spinta	internazionalizzazione delle imprese stesse .
ITWAC	sempre più	brava	?	?	DET ADV NOUN	ottimo il cast , da giorgio tirabassi a cecilia dazzi , passando per	la sempre più brava	paola cortellesi .
ITWAC	sempre più	mal	?	?	DET ADV NOUN	medici , fisioterapisti , osteopati , perfino profani sono coinvolti	nelle sempre più mal	definite " manipolazioni vertebrali " da non confondersi con la chiropratica .
ITWAC	sempre più	stretta	?	?	DET ADV NOUN	tema tanto delicato ed importante , iniziativa che va nel senso della politica che l' organizzazione intende portare avanti di	una sempre più stretta	colleganza con le esigenze della categoria rappresentata .
ITWAC	sempre più	entusiasta	?	?	DET ADV NOUN	l' entusiasmo finale ha visto tutta la squadra stringersi attorno	al sempre più entusiasta	presidente peppino pellegrino .
ITWAC	sempre più	spinta	?	?	DET ADV NOUN	il nodo focale della trasformazione è rappresentato da	una sempre più spinta	integrazione interforze , intesa ad accrescere l' output operativo attraverso una sinergia delle specificità operative delle quattro componenti , e da
ITWAC	sempre più	spinta	?	?	DET ADV NOUN	nella prospettiva di	una sempre più spinta	integrazione internazionale , la nuova stazione navale di taranto sarà chiamata ad assolvere la funzione di base di appoggio anche per
ITWAC	sempre più	spinta	?	?	DET ADV NOUN	processo di progressiva riduzione delle scorte di magazzino dei clienti sia industriali che commerciali e dalla domanda conseguentemente caratterizzata da	una sempre più spinta	riduzione dei tempi di consegna .
ITWAC	sempre più	re	Role	?	DET ADV NOUN	la soddisfazione dei bisogni materiali e intellettuali delle masse veniva perciò continuamente rinviata a	un sempre più re	­ moto futuro di " realizzazione " compiuta dello sviluppo produttivo .
ITWAC	sempre più	isolato	?	?	DET ADV NOUN	se , un evento di cui gioire viste le decise prese di posizione del presidente consob lamberto cardia e soprattutto	del sempre più isolato	( ed ironico ) governatore della banca d' italia antonio fazio , che ha indirettamente mandato a dire a quelle migliaia
ITWAC	sempre più	sofisticate	?	?	DET ADV NOUN	tirreno e il dio nettuno al quale è stato chiesto mare mosso e condizioni climatiche avverse ad oltranza in risposta	alle sempre più sofisticate	tecniche di pesca di noi poveri pescatori sportivi .
ITWAC	sempre più	sofisticate	?	?	DET ADV NOUN	tirreno e il dio nettuno al quale è stato chiesto mare mosso e condizioni climatiche avverse ad oltranza in risposta	alle sempre più sofisticate	tecniche di pesca di noi poveri pescatori sportivi .
ITWAC	sempre più	sofisticate	?	?	DET ADV NOUN	tirreno e il dio nettuno al quale è stato chiesto mare mosso e condizioni climatiche avverse ad oltranza in risposta	alle sempre più sofisticate	tecniche di pesca di noi poveri pescatori sportivi .
ITWAC	sempre più	affezionato	?	?	DET ADV NOUN	la gara si conclude con le vicentine a salutare	il sempre più affezionato	pubblico ; le beriche staranno " alla finestra " in attesa della partita tra alberga e poggibonsese che si disputerà in
ITWAC	sempre più	brava	?	?	DET ADV NOUN	altra buona produzione targata spagna questo film divertentissimo e irriverente ( interpretato	dalla sempre più brava	carmen maura ) racconta gli intrighi condominiali di un gruppo di terribili inquilini che fanno di tutto e di più per
ITWAC	sempre più	commerciabilità	?	?	DET ADV NOUN	lo stato dell' informazione discografica oggi in italia è alquanto caotico : da un lato le grandi majors spingono per	una sempre più commerciabilità	dei loro prodotti , chiedendo ai produttori di arricchire di sonorità più commerciali le loro produzioni , dall' altra giovani label
ITWAC	sempre più	programmi	?	?	DET ADV NOUN	) ; --- brian ppp per tutti è sempre più crescente l' uso di linux anche per l' internet grazie	ai sempre più programmi	chge facilitano la connessione .
ITWAC	sempre più	sorprendente	?	?	DET ADV NOUN	fra le ragazze magnifico 11.04 della giamaicana bailey davanti alla bahamense ferguson ( 11.15 ) , ed	alla sempre più sorprendente	inglese oyepitan ( 11.17 ) .
ITWAC	sempre più	entusiasta	?	?	DET ADV NOUN	- e balzò giù dal davanzale seguito	dal sempre più entusiasta	milo .
ITWAC	sempre più	banale	?	?	DET ADV NOUN	tromba suonare â   il silenzioâ   negli studi del costanzo show , uno spettacolo annichilente e scoraggiante	della sempre più banale	italiettaâ  ¦ .
ITWAC	sempre più	spinta	?	?	DET ADV NOUN	appalto in un mercato del lavoro dove si assiste ad	una sempre più spinta	esternalizzazione e decentramento delle imprese , diventa fondamentale , in un percorso di riforma del lavoro , predisporre quelle misure idonee
ITWAC	sempre più	brava	?	?	DET ADV NOUN	delicato la finestra di fronte di ozpetek , meritato david di donatello 2003 , con un raoul bova inedito ,	una sempre più brava	giovanna mezzogiorno e un grande massimo girotti , che ricordiamo con nostalgia ; ma che colpa abbiamo noi di carlo verdone
ITWAC	sempre più	scatenato	?	?	DET ADV NOUN	la lauretana , tra l' altro , sta mettendo in mostra	un sempre più scatenato	cookie belcher .
ITWAC	sempre più	mal	?	?	DET ADV NOUN	medici , fisioterapisti , osteopati , perfino profani sono coinvolti	nelle sempre più mal	definite " manipolazioni vertebrali " da non confondersi con la chiropratica .
ITWAC	sempre più	sofisticate	?	?	DET ADV NOUN	tirreno e il dio nettuno al quale è stato chiesto mare mosso e condizioni climatiche avverse ad oltranza in risposta	alle sempre più sofisticate	tecniche di pesca di noi poveri pescatori sportivi .
ITWAC	sempre più	spinta	?	?	DET ADV NOUN	il secondo obiettivo è costituito dalla necessità di accelerare il processo d' integrazione interforze e di perseguire	una sempre più spinta	interoperabilità multinazionale .
ITWAC	sempre più	spinta	?	?	DET ADV NOUN	e infine si procederà verso	una sempre più spinta	unificazione dei media , intesi come i supporti su cui registrare i dati digitali .
ITWAC	sempre più	nota	?	?	DET ADV NOUN	« il fatto è che con la tecnica del computer generated imaginery -	la sempre più nota	cgi - tutto diventa troppo reale , fin troppo vero .
ITWAC	sempre più	sofisticate	?	?	DET ADV NOUN	tirreno e il dio nettuno al quale è stato chiesto mare mosso e condizioni climatiche avverse ad oltranza in risposta	alle sempre più sofisticate	tecniche di pesca di noi poveri pescatori sportivi .
ITWAC	sempre più	sofisticate	?	?	DET ADV NOUN	tirreno e il dio nettuno al quale è stato chiesto mare mosso e condizioni climatiche avverse ad oltranza in risposta	alle sempre più sofisticate	tecniche di pesca di noi poveri pescatori sportivi .
ITWAC	sempre più	raro	?	?	DET ADV NOUN	parlando dell' orario di lavoro , la figura di riferimento utilizzata è quella	del sempre più raro	metalmeccanico , la cui produzione era strettamente proporzionale al numero di minuti e secondi trascorsi alla catena di montaggio .
ITWAC	sempre più	complesso	?	?	DET ADV NOUN	patrimonio storico della nostra civiltà , la musica è oggi una componente immancabile	nel sempre più complesso	universo dei mezzi di comunicazione e delle nuove tecnologie , che ne fanno una realtà centrale nella vita del bambino e
ITWAC	sempre più	spinta	?	?	DET ADV NOUN	la conseguenza di tutto ciò è	una sempre più spinta	globalizzazione delle aziende dell' auto .
ITWAC	sempre più	capacità	?	?	DET ADV NOUN	una sorta di design sonoro elettronico , che prende le forme più disparate , ma con	una sempre più capacità	da parte del gruppo di gestire il proprio lavoro sul suono e ala volontà di riuscire a creare una propria matrice
ITWAC	sempre più	sorprendente	?	?	DET ADV NOUN	il clamoroso balzo di robert archibald nella graduatoria " interna " della valutazione : se si tolgono i decimali ,	il sempre più sorprendente	scozzese ha addirittura affiancato charlie smith come giocatore più produttivo della squadra , a quota 17 , benché il dato del
ITWAC	sempre più	volontà	?	?	DET ADV NOUN	oltre a provare indignazione provo una seria preoccupazione di	una sempre più volontà	di manganello e polizia di partito .
ITWAC	sempre più	spinta	?	?	DET ADV NOUN	nel settore energetico dove , a fianco della tradizionale , rilevante incidenza negli usi industriali e domestico si assiste ad	una sempre più spinta	penetrazione dei consumi per la produzione elettrica .
ITWAC	sempre più	richiesta	?	?	DET ADV NOUN	né facile risoluzione potrà aversi	dalla sempre più richiesta	e appoggiata migrazione di alcune competenze dalla magistratura di sorveglianza al giudice della cognizione , come indica a chiare lettere la
ITWAC	sempre più	brava	?	?	DET ADV NOUN	la sala ha applaudito la nomination per	la sempre più brava	naomi watts in 21 grammi .
ITWAC	sempre più	stretta	?	?	DET ADV NOUN	economicità , a risorse bibliografiche ed editoriali elettroniche , in parte seguendone , e in parte promuovendone l' evoluzione verso	una sempre più stretta	e interattiva integrazione di risorse .
